{"question":"What does it mean when the LED display flashes yellow In Accentum Wireless Around Ear Headphones? Select the correct answer from A, B, C, D. Only one answer is correct. A) Battery charge is 0 % to 20 %. B) Battery charge is 90 % to 100 %. C) Battery charge is 20 % to 90 %. D) Headphones are in Bluetooth pairing mode","ground_truth":"C) Battery charge is 20 % to 90 %.","answer":"C) Battery charge is 20 % to 90 %.","contexts":["devices (headphones and e.g. smartphone) once. This process is \ncalled pairing.\nIf operation differs from the steps mentioned, also refer to the \ninstruction manual of the Bluetooth device you are using.\nLED Meaning\n1 red Rechargeable battery is almost empty \n(less than 2% charged)\n1 white\nRechargeable battery is approx. 2-20% \ncharged \n(>1 hour of playback time)\n2 white\nRechargeable battery is approx. \n20-40% charged \n(>12 hours of playback time)\n3 white\nRechargeable battery is approx.","Product overview\nACCENTUM  |  9\nDuring charging\nOverview of sound signals and voice prompts\nThe headphones output voice prompts and sound signals in case of \nvarious events.\nYou hear short sound signals when the headphones\n\u2022 are switched on or off,\n\u2022 are in pairing mode (melody),\n\u2022 detect devices in the pairing list,\nLED Meaning\nflashes red Battery charge is 0 % to 20 %.\nflashes yellow Battery charge is 20 % to 90 %.\nflashes green Battery charge is 90 % to 100 %.\nlights up green \nfor 5 minutes","display to indicate the charging process.\nR\nUSB-C\nUSB-A\nLED Meaning\nflashes red Battery charge is 0 % to 20 %.\nflashes yellow Battery charge is 20 % to 90 %.\nflashes green Battery charge is 90 % to 100 %. \nlights up green \nfor 5 minutes \nWhen the rechargeable battery is \n100% charged, the LED lights up for \n5 minutes and then goes off.\nYou can speed up the charging process by charging the head-\nphones when they are switched off. \nIf you disconnect the USB connection during or after charging,"]}
{"question":"Is it possible to setup voice prompt? If yes, how to do that in Accentum Wireless Around Ear Headphones?","ground_truth":"Yes, it is possible. To set up the voice prompts you require the Smart Control App (>18). In the app settings, you can activate voice prompts and sound signals (also the default setting) or deactivate them.","answer":"To set up voice prompts in the Accentum Wireless Around Ear Headphones, you need to use the Smart Control app. Within the app settings, you can activate or deactivate voice prompts and sound signals.","contexts":["ACCENTUM\nWireless around-ear headphones\nModel: ACAEBT\nInstruction manual\nUse the search function, the navigation (left) or the following links:\nStart\n\u201cProduct overview\u201d\n\u201cGetting started\u201d\n\u201cUsing the headphones\u201d\n\u201cFAQ\/If a problem occurs ...\u201d\n\u201cSpecifications\u201d\nSonova Consumer Hearing GmbH\nAm Labor 1 \n30900 Wedemark \nGermany\nwww.sennheiser-hearing.com\nVersion: 11\/23 A02","Using the headphones\nACCENTUM  |  19\nSwitching the headphones off\n\u25b7 Press the main button for 3 seconds.\nYou hear a sound signal. The LED flashes red 3x. The headphones \nswitch off.\nMake sure that Bluetooth is already activated on your Blue-\ntooth device when switching on the headphones.\nIf Bluetooth is activated and the headphones cannot find a \npaired Bluetooth device within a few minutes, you hear the \nvoice prompt \u201cNo connection\u201d. The LED flashes red 3x. The","settings are active even without using the Smart Control app, i.e. \nwhen you are using a different Bluetooth device.\nSetting the voice prompts\/sound signals\nTo be able to set the voice prompts and sound signals, you require \nthe Smart Control app (> 18).\nIn the app settings, you can activate voice prompts and sound sig-\nnals (default setting) or deactivate them completely.\nDeactivating the touch pad function\nTo avoid unintentional entries via the touch pad of the headphones,"]}
{"question":"When do I replace the ear pads and where can I find the replacement ear pads for Accentum Wireless Around Ear Headphones?","ground_truth":"There is no specific timeframe for ear pad replacement. For hygiene reasons, you should replace your ear pads from time to time. Replacement ear pads are available at www.sennheiser-hearing.com\/accentum-wireless.","answer":"You should replace the ear pads of the Accentum Wireless Around Ear Headphones from time to time for hygiene reasons. Replacement ear pads can be found at [location not specified].","contexts":["Care and maintenance\n34  |  ACCENTUM\nCare and maintenance\n\u25b7 Clean the parts of the product only with a soft, dry cloth.\nTo clean the charging socket:\n\u25b7 Blow vigorously over the charging socket. \n\u25b7 If necessary, carefully remove any stuck dirt from the charging \nsocket using a dry, soft brush or a dry interdental brush. Only \napply gentle pressure when doing so.\nReplacing the ear pads\nFor reasons of hygiene, you should replace your ear pads from time \nto time. Spare ear pads are available at","ACCENTUM\nWireless around-ear headphones\nModel: ACAEBT\nInstruction manual\nUse the search function, the navigation (left) or the following links:\nStart\n\u201cProduct overview\u201d\n\u201cGetting started\u201d\n\u201cUsing the headphones\u201d\n\u201cFAQ\/If a problem occurs ...\u201d\n\u201cSpecifications\u201d\nSonova Consumer Hearing GmbH\nAm Labor 1 \n30900 Wedemark \nGermany\nwww.sennheiser-hearing.com\nVersion: 11\/23 A02","Care and maintenance\nMOMENTUM 4  | 37\nCare and maintenance\n\u25b7 Clean the parts of the product only with a soft, dry cloth.\nTo clean the charging socket:\n\u25b7 Blow vigorously over the charging socket. \n\u25b7 If necessary, carefully remove any stuck dirt from the charging \nsocket using a dry, soft brush or a dry interdental brush. Only \napply gentle pressure when doing so.\nReplacing the ear pads\nFor reasons of hygiene, you should replace your ear pads from time \nto time. Spare ear pads are available at"]}
{"question":"What is the charging temperature range of Accentum wireless around ear headphones?","ground_truth":"Between +10 \u00b0C to +40 \u00b0C","answer":"The charging temperature range of Accentum wireless around ear headphones is from +10\u00b0C to +40\u00b0C.","contexts":["charging: +10\u00b0C to +40\u00b0C\nstorage: \u201320\u00b0C to +60\u00b0C\nRelative humidity\n(non condensing)\noperation: 10 to 80 %\nstorage: 10 to 90 %\nWeight (headphones) approx. 293 g\nMagnetic field strength 6.25 mT\nVersion Bluetooth 5.2 compliant, class 1\nTransmission frequency 2,402 MHz to 2,480 MHz\nModulation GFSK, \u03c0\/4 DQPSK, 8DPSK\nProfiles HFP, AVRCP, A2DP\nOutput power 10 mW (max)\nCodec aptX\u2122 Adaptive, AAC, SBC\nDevice name MOMENTUM 4 (individually adjust-\nable)\nLE-MOMENTUM 4 (Bluetooth Low \nEnergy only)","storage: \u201320 \u00b0C to +60 \u00b0C\nRelative humidity\n(non condensing)\noperation: 10 to 80 %\nstorage: 10 to 90 %\nWeight (headphones) approx. 222 g\nMagnetic field strength 3.00 mT\nVersion Bluetooth 5.2 compliant, class 1\nTransmission frequency 2,402 MHz to 2,480 MHz\nModulation GFSK, \u03c0\/4 DQPSK, 8DPSK\nProfiles A2DP, AVRCP, HFP, HSP, GATT\nOutput power 10 mW (max)\nCodec aptX\u2122 HD, AAC, SBC\nDevice name ACCENTUM (individually adjustable)\nNumber of active connec-\ntions\n2","Microphone pick-up pat-\ntern (speech audio)\n2 omni-directional microphones \n(beamforming)\nPower supply built-in rechargeable lithium-ion \nbattery: 3.7 V \u2393, 800 mAh, 2.96 Wh \nUSB charging: 5 V \u2393, 700 mA max.\nCharging time of recharge-\nable battery\napprox. 3 hrs\nOperating time up to 50 hrs (music playback via Blue-\ntooth with ANC activated)\nTemperature range operation: 0 \u00b0C to +40 \u00b0C\ncharging: +10 \u00b0C to +40 \u00b0C\nstorage: \u201320 \u00b0C to +60 \u00b0C\nRelative humidity\n(non condensing)\noperation: 10 to 80 %"]}
{"question":"What is the weight of the Momentum 4 Wireless Around Ear Headphones?","ground_truth":"Approximately 293g.","answer":"The weight of the Momentum 4 Wireless Around Ear Headphones is approximately 293 g.","contexts":["charging: +10\u00b0C to +40\u00b0C\nstorage: \u201320\u00b0C to +60\u00b0C\nRelative humidity\n(non condensing)\noperation: 10 to 80 %\nstorage: 10 to 90 %\nWeight (headphones) approx. 293 g\nMagnetic field strength 6.25 mT\nVersion Bluetooth 5.2 compliant, class 1\nTransmission frequency 2,402 MHz to 2,480 MHz\nModulation GFSK, \u03c0\/4 DQPSK, 8DPSK\nProfiles HFP, AVRCP, A2DP\nOutput power 10 mW (max)\nCodec aptX\u2122 Adaptive, AAC, SBC\nDevice name MOMENTUM 4 (individually adjust-\nable)\nLE-MOMENTUM 4 (Bluetooth Low \nEnergy only)","Specifications\nMOMENTUM True Wireless 4  | 49\nBluetooth\nTemperature range operation: 0 to +40 \u00b0C\ncharging: +5 to +35 \u00b0C\nstorage: \u201320 to +60 \u00b0C\nRelative humidity operation: 25 to 75 %, non condensing\nstorage: 10 to 90 %\nMagnetic field strength earbuds: 0.95 mT\ncharging case: 105 mT\nIngress protection of the \nearbuds splash proof (IP54)\nWeight earbuds: approx. 6 g each\ncharging case: approx. 66 g\nboth earbuds and charging case: \napprox. 78 g\nVersion Bluetooth 5.4 certified, class 1","Specifications\nMOMENTUM True Wireless 4  | 49\nBluetooth\nTemperature range operation: 0 to +40 \u00b0C\ncharging: +5 to +35 \u00b0C\nstorage: \u201320 to +60 \u00b0C\nRelative humidity operation: 25 to 75 %, non condensing\nstorage: 10 to 90 %\nMagnetic field strength earbuds: 0.95 mT\ncharging case: 105 mT\nIngress protection of the \nearbuds splash proof (IP54)\nWeight earbuds: approx. 6 g each\ncharging case: approx. 66 g\nboth earbuds and charging case: \napprox. 78 g\nVersion Bluetooth 5.4 certified, class 1"]}
{"question":"What is the charging time of the rechargeable battery in Momentum 4 Wireless Around Ear Headphones?","ground_truth":"Approximately 2 hours","answer":"The charging time of the rechargeable battery in Momentum 4 Wireless Around Ear Headphones is approximately 2 hours.","contexts":["Using the headphones\nMOMENTUM 4  | 13\nUsing the headphones\nInformation on the rechargeable battery \nand the charging process\nThe headphones have a built-in rechargeable battery. A complete \ncharging cycle takes approx. 2 hours. The charging time can vary \ndepending on the power source used and the ambient temperature. \nBefore using the headphones for the first time, charge the recharge-\nable battery for a complete charging cycle without interruption.","Using the headphones\n12  |  ACCENTUM\nUsing the headphones\nInformation on the rechargeable battery \nand the charging process\nThe headphones have a built-in rechargeable battery. A complete \ncharging cycle takes approx. 3 hours. The charging time can vary \ndepending on the power source used and the ambient temperature. \nBefore using the headphones for the first time, charge the recharge-\nable battery for a complete charging cycle without interruption.","20-40% charged \n(>12 hours of playback time)\n3 white\nRechargeable battery is approx. \n40-60% charged \n(>24 hours of playback time)\n4 white\nRechargeable battery is approx. \n60-80% charged\n(>36 hours of playback time)\n5 white\nRechargeable battery is approx. \n80-100% charged \n(>48 hours of playback time)\n5 white Rechargeable battery is 100% charged \n(up to 60 hours of playback time)\nYou can speed up the charging process by charging the head-\nphones when they are switched off."]}
{"question":"What does it mean when the LED display flashes red 3x repeatedly during phone calls in Momentum 4 Wireless Headphones? Select the correct answer from A, B, C, D. Only one answer is correct.  A) Incoming call B) switch off C) Rechargeable battery is almost empty (less than 2% charged) D) incoming call with an almost empty battery.","ground_truth":"D) incoming call with an almost empty battery.","answer":"C) Rechargeable battery is almost empty (less than 2% charged)","contexts":["Incoming call with an almost empty \nbattery\nLED Meaning\n1 red Rechargeable battery is almost empty\n(less than 2% charged)\n1 white\nRechargeable battery is approx. 2-20% \ncharged \n(>1 hour of playback time)\n2 white\nRechargeable battery is approx. \n20-40% charged \n(>12 hours of playback time)\n3 white\nRechargeable battery is approx. \n40-60% charged \n(>24 hours of playback time)\n4 white\nRechargeable battery is approx \n60-80% charged\n(>36 hours of playback time)\n5 white","devices (headphones and e.g. smartphone) once. This process is \ncalled pairing.\nIf operation differs from the steps mentioned, also refer to the \ninstruction manual of the Bluetooth device you are using.\nLED Meaning\n1 red Rechargeable battery is almost empty \n(less than 2% charged)\n1 white\nRechargeable battery is approx. 2-20% \ncharged \n(>1 hour of playback time)\n2 white\nRechargeable battery is approx. \n20-40% charged \n(>12 hours of playback time)\n3 white\nRechargeable battery is approx.","Product overview\n10 | MOMENTUM 4\nOverview of the LED display\nDuring operation\nDuring phone calls\nDuring charging\nLED Meaning\/headphones...\nwhite \nflashes 3x\n... switch on.\n... are connected to a device via Blue-\ntooth.\nwhite\ncontinuous \nsequence\n... are in Bluetooth pairing mode.\nred \nflashes 3x ... switch off.\nLED Meaning\nwhite \nflashes 3x \nrepeatedly\nIncoming call\nred \nflashes 3x \nrepeatedly\nIncoming call with an almost empty \nbattery\nLED Meaning\n1 red Rechargeable battery is almost empty"]}
{"question":"What does it mean when the LED display presents 3 white during charging in Momentum 4 wireless around ear headphones? Select the correct answer from A, B, C, D. Only one answer is correct.  A) Incoming call B) switch off C) Rechargeable battery is almost empty (less than 2% charged) D) incoming call with an almost empty battery.","ground_truth":"A) Incoming call","answer":"C) Rechargeable battery is almost empty (less than 2% charged)","contexts":["Incoming call with an almost empty \nbattery\nLED Meaning\n1 red Rechargeable battery is almost empty\n(less than 2% charged)\n1 white\nRechargeable battery is approx. 2-20% \ncharged \n(>1 hour of playback time)\n2 white\nRechargeable battery is approx. \n20-40% charged \n(>12 hours of playback time)\n3 white\nRechargeable battery is approx. \n40-60% charged \n(>24 hours of playback time)\n4 white\nRechargeable battery is approx \n60-80% charged\n(>36 hours of playback time)\n5 white","devices (headphones and e.g. smartphone) once. This process is \ncalled pairing.\nIf operation differs from the steps mentioned, also refer to the \ninstruction manual of the Bluetooth device you are using.\nLED Meaning\n1 red Rechargeable battery is almost empty \n(less than 2% charged)\n1 white\nRechargeable battery is approx. 2-20% \ncharged \n(>1 hour of playback time)\n2 white\nRechargeable battery is approx. \n20-40% charged \n(>12 hours of playback time)\n3 white\nRechargeable battery is approx.","Product overview\n10 | MOMENTUM 4\nOverview of the LED display\nDuring operation\nDuring phone calls\nDuring charging\nLED Meaning\/headphones...\nwhite \nflashes 3x\n... switch on.\n... are connected to a device via Blue-\ntooth.\nwhite\ncontinuous \nsequence\n... are in Bluetooth pairing mode.\nred \nflashes 3x ... switch off.\nLED Meaning\nwhite \nflashes 3x \nrepeatedly\nIncoming call\nred \nflashes 3x \nrepeatedly\nIncoming call with an almost empty \nbattery\nLED Meaning\n1 red Rechargeable battery is almost empty"]}
{"question":"How many audio sources can I connect at the same time to the BTT100 Audio transmitter?","ground_truth":"You can simultaneously connect 2 different sources to the transmitter.","answer":"You can connect 2 audio sources simultaneously to the BTT100 Audio transmitter.","contexts":["PC and a stereo hi-fi system) to the transmitter. The transmitter features \na digital as well as an analog audio input. If you connect 2 audio sources, \nyou can toggle between them using the Input Selection switch (see \npage 14).\n X Switch your audio source off before connecting the transmitter.\n X Check the connection options available on your audio source (for analog \naudio connection, the audio output is usually marked \u201cOUT\u201d).","10 | BT T100 Bluetooth\u00ae Audio Transmitter\nGetting started\nConnection to an audio source using the 3.5 mm analog audio cable\nSome TV models mute the loudspeakers when you connect the transmitter \nto the headphone socket. Check in the menu of your TV to see if the muting \nfunction can be deactivated. \n X Connect the 3.5 mm plug of the analog audio cable to the Analog input \nof the transmitter. \n X Connect the other end of the analog audio cable to the 3.5 mm \nheadphone socket of the TV or PC.","X Avoid using mounting parts made of metal, as this can decrease the \ntransmitter\u2019s range. \n X Do not place the transmitter close to metal objects such as shelf bars, \nreinforced concrete walls, etc. as this can decrease the transmitter\u2019s \nrange.\nConnecting the Bluetooth\u00ae Audio Transmitter to an \naudio source\nYou can simultaneously connect 2 different audio sources (e.g. a TV or \nPC and a stereo hi-fi system) to the transmitter. The transmitter features"]}
{"question":"What happens to the LED light colour when I switch the transmitter on and how do I know whether a connection is established in BTT100 Bluetooth Audio Transmitter?","ground_truth":"The LED lights up red when the transmitter is switched on and once the connection is established, the LED lights up blue.","answer":"When you switch the transmitter on in the BTT100 Bluetooth Audio Transmitter, the LED initially lights up red. Once the connection is established, the LED changes to blue, indicating that the connection is successful.","contexts":["BT T100 Bluetooth\u00ae Audio Transmitter | 15 \nUsing the transmitter\nConnecting the transmitter to the headphones\/\nearphones\nConnect the headphones\/earphones to the transmitter to watch a movie \nor listen to music from your TV, PC, or home entertainment system. \n1. Switch the paired headphones\/earphones on.\n2. Switch the transmitter on.\nThe LED lights up red. Once the connection is established, the LED \nlights up blue.\nON 2sHold\n1 2\nConnecting the transmitter to a second pair of \nheadphones","BT T100 Bluetooth\u00ae Audio Transmitter | 13 \nUsing the transmitter\nUsing the transmitter\nSwitching the transmitter on\nThe transmitter goes into pairing mode when switched on for the \nfirst time.\n1. Press the Multifunction button for 2 seconds.\nThe LED lights up red. \nON\n2sHold\nSwitching the transmitter off\n1. Press the Multifunction button for 3 seconds.\nThe LED switches off.\nOFF\n3sHold","BT T100 Bluetooth\u00ae Audio Transmitter | 11 \nGetting started\nPowering the transmitter\n1. Connect the USB micro B plug of the supplied USB power cable to the \nUSB-B port of the transmitter.\n2. Connect the USB plug to the USB port of your TV or PC. For older TV \nmodels without built-in USB port, connect the USB plug to an external \nUSB power adapter and connect to the power source.\nThe transmitter automatically switches on.\nUSB-B\nPower\nDigital Optical\nIN\nInput\nSelection\nAnalog\n3.5 mm\nIN\nUSB\nPower"]}
{"question":"What is the number of transmission channels in BTT100 Bluetooth Audio Transmitter?","ground_truth":"79","answer":"The number of transmission channels in the BTT100 Bluetooth Audio Transmitter is 79.","contexts":["20 | BT T100 Bluetooth\u00ae Audio Transmitter\nSpecifications\nSpecifications\nBluetooth\u00ae Audio Transmitter \nModel: BT T100\nInputs digital input: optical \nsupported data streams:  \nPCM, 44.1 - 48 kHz\/16 - 24 bit\nanalog input: 3.5 mm stereo jack \nsocket\nInput voltage & current USB power supply via USB micro \nB socket \n5 V\u2393,  500 mA\nNumber of transmission channels 79\nOccupied bandwidth 1 channel 1 MHz\nFrequency response 20 Hz - 20 kHz\nWeight 85 g\nTemperature range operation: 0 to 40\u00b0C (32 to 104\u00b0F)","BT T100 Bluetooth\u00ae Audio Transmitter | 19 \nTroubleshooting\nLeaving the Bluetooth transmission range\nWireless streaming is only possible in the Bluetooth transmission range \nof your Bluetooth devices. The transmission range largely depends on \nenvironmental conditions such as wall thickness, wall composition etc. \nWith a free line of sight, the transmission range of most Bluetooth devices \nis up to 30 meters.\nIf the headphones leave the Bluetooth transmission range of the","BT T100 Bluetooth\u00ae Audio Transmitter | 5 \nThe Bluetooth\u00ae Audio Transmitter\nBluetooth\nThe Bluetooth\u00ae Audio Transmitter complies with the Bluetooth  4.2 standard \nand is compatible with all Bluetooth 1.1, 1.2, 2.0, 2.1, and 3.0 headphones \nwith Advanced Audio Distribution Profile (A2DP) for audio playback.\naptXTM\nWith aptXTM audio coding, you can be assured of crisp, pure and full stereo \nsound. It allows you to not only hear, but experience and feel the audio"]}
{"question":"What is the weight of BTT100 Bluetooth Audio Transmitter?","ground_truth":"85g.","answer":"The weight of the BTT100 Bluetooth Audio Transmitter is 85 g.","contexts":["charging: +10\u00b0C to +40\u00b0C\nstorage: \u201320\u00b0C to +60\u00b0C\nRelative humidity\n(non condensing)\noperation: 10 to 80 %\nstorage: 10 to 90 %\nWeight (headphones) approx. 293 g\nMagnetic field strength 6.25 mT\nVersion Bluetooth 5.2 compliant, class 1\nTransmission frequency 2,402 MHz to 2,480 MHz\nModulation GFSK, \u03c0\/4 DQPSK, 8DPSK\nProfiles HFP, AVRCP, A2DP\nOutput power 10 mW (max)\nCodec aptX\u2122 Adaptive, AAC, SBC\nDevice name MOMENTUM 4 (individually adjust-\nable)\nLE-MOMENTUM 4 (Bluetooth Low \nEnergy only)","20 | BT T100 Bluetooth\u00ae Audio Transmitter\nSpecifications\nSpecifications\nBluetooth\u00ae Audio Transmitter \nModel: BT T100\nInputs digital input: optical \nsupported data streams:  \nPCM, 44.1 - 48 kHz\/16 - 24 bit\nanalog input: 3.5 mm stereo jack \nsocket\nInput voltage & current USB power supply via USB micro \nB socket \n5 V\u2393,  500 mA\nNumber of transmission channels 79\nOccupied bandwidth 1 channel 1 MHz\nFrequency response 20 Hz - 20 kHz\nWeight 85 g\nTemperature range operation: 0 to 40\u00b0C (32 to 104\u00b0F)","and M-size ear tip)\ncharging case: 78.4 g\nboth earbuds and charging case: 91 g\nDimensions earbuds: ap prox. 23.3 x 20.9 x \n26.1 mm\ncharging case: 63.7 x 64.8 x 30.0 mm\nSensors heart rate, body temperature, \n3-axis acceleration sensor, infrared \nin-ear sensor\nSensor measuring ranges heart rate: 30 ~ 220 bpm\nbody temperature: 35.5 to 42.0\u00b0C \n(accuracy: \u00b1 0.3\u00b0C)\nVersion Bluetooth 5.2 certified, class 1\nTransmission frequency 2,402 MHz to 2,480 MHz\nModulation GFSK, \u03c0\/4 DQPSK, 8DPSK"]}
{"question":"What does green light in momentum sport's charging case LED indicate with earbuds inserted in? Select the correct answer from A, B, C, D. Only one answer is correct.  A) Earbuds are fully charged, charging case can still charge at least one complete cycle. B) Charging case is fully charged. C) Firmware update is being performed. D) Rechargeable battery of the charging case is almost empty.","ground_truth":"A) Earbuds are fully charged, charging case can still charge at least one complete cycle.","answer":"A) Earbuds are fully charged, charging case can still charge at least one complete cycle.","contexts":["Product overview\n10 | MOMENTUM Sport\nCharging case LED Charging case WITH \nearbuds inserted\nCharging case \nWITHOUT earbuds \ninserted \nlights up \ngreen\nEarbuds are fully \ncharged, charging \ncase can still charge \nat least one com-\nplete cycle.\nCharging case is \nfully charged.\npulses \nyellow\nEarbuds are being \ncharged via the \nrechargeable bat-\ntery of the charging \ncase.\n\u2013\nlights up \nyellow\nEarbuds are fully \ncharged, charging \ncase is more than \n10% and less than \n50% charged.\nCharging case is","Displaying the battery charge status using the charging case\nIf no USB cable is connected to the charging case or the charging \ncase is not placed on a wireless charging pad:\n\u25b7 Open the lid of the charging case. \nIf the earbuds are inserted, the LED display of the charging case \nindicates the battery charge status of the earbuds. \nIf the earbuds are not inserted, the LED display indicates the bat-\ntery charge status of the charging case.","The rechargeable batteries of the earbuds and the charging case \nare being charged.\nIf no earbuds are inserted into the charging case, only the \nrechargeable battery of the charging case is being charged.\nThe LED display of the charging case indicates the charge status:\nLED Charging case WITH \nearbuds inserted\nCharging case \nWITHOUT earbuds \ninserted \npulses \nyellow \nEarbuds and \ncharging case are \nbeing charged.\nCharging case is \nbeing charged.\nlights up \ngreen\nEarbuds and \ncharging case are"]}
{"question":"What does it mean when the Momentum Sport's earbud LED flashes red 3x ? Select the correct answer from A, B, C, D. Only one answer is correct.  A) Rechargeable battery is almost empty. B) Bluetooth pairing or earbud pairing failed. C) System error is present. Perform a reset (see page > 63). D) Bluetooth pairing or earbud pairing was successful.","ground_truth":"B) Bluetooth pairing or earbud pairing failed.","answer":"B) Bluetooth pairing or earbud pairing failed.","contexts":["Product overview\nMOMENTUM Sport  | 11\nOverview of the LED indications of the \nearbuds\nEarbud LED Meaning\nflashes red-blue \nfor approx. \n2m i n u t e s\nEarbuds are in Bluetooth pairing \nmode.\nflashes blue 3x Bluetooth pairing or earbud pairing \nwas successful.\nflashes red 3x Bluetooth pairing or earbud pairing \nfailed.\nlights up blue Earbuds are connected to a device \nvia Bluetooth.\nlights up red\nEarbuds are not connected to a \ndevice via Bluetooth or the connec-\ntion has been interrupted.","Product overview\n10 | MOMENTUM True Wireless 4\nOverview of the LED indications of the \nearbuds\nLED Meaning\nflashes red-blue \nfor approx. \n2m i n u t e s  \nEarbuds are in Bluetooth pairing \nmode.\nflashes blue 3x Bluetooth pairing or earbud pairing \nwas successful.\nflashes red 3x Bluetooth pairing or earbud pairing \nfailed.\nlights up blue Earbuds are connected to a device \nvia Bluetooth.\nlights up red\nEarbuds are not connected to a \ndevice via Bluetooth or the connec-\ntion has been interrupted.","Product overview\n10 | MOMENTUM True Wireless 4\nOverview of the LED indications of the \nearbuds\nLED Meaning\nflashes red-blue \nfor approx. \n2m i n u t e s  \nEarbuds are in Bluetooth pairing \nmode.\nflashes blue 3x Bluetooth pairing or earbud pairing \nwas successful.\nflashes red 3x Bluetooth pairing or earbud pairing \nfailed.\nlights up blue Earbuds are connected to a device \nvia Bluetooth.\nlights up red\nEarbuds are not connected to a \ndevice via Bluetooth or the connec-\ntion has been interrupted."]}
{"question":"What does 'Podcast' voice prompt mean in Momentum Sport?","ground_truth":"Equalizer preset for podcasts is activated (improved speech intelligibility).","answer":"I don't know.","contexts":["Product overview\n14 | MOMENTUM Sport\nNotes on voice prompts\nThe earbuds output voice prompts for events (the table gives some \nexamples). Using the Smart Control app, you can choose between \nvoice prompts and beep sounds, or deactivate the status messages \nwith a few exceptions (e.g. rechargeable battery is empty). \nVoice prompt Meaning\n\u201cPower on\u201d Earbuds are switched on.\n\u201cPower off\u201d Earbuds switch off.\n\u201cConnected\u201d Earbuds are connected via Blue-\ntooth.","\u201cMOMENTUM Sport\u201d. If necessary, enter the default pin code \n\u201c0000\u201d.\nIf pairing was successful, you hear the voice prompt \u201cPairing suc-\ncessful\u201d and the LEDs of the earbuds flash blue 3x.\nIf you have completely deactivated the control functions for \nTouch and Tap control via the Smart Control app (see \npage > 53):\n\u2022 The earbuds can only be controlled via the Smart Control \napp and the connected Bluetooth device. \n\u2022 If the earbuds are inserted into the ears (proximity sensors","Using the earbuds\nMOMENTUM Sport  | 37\nAdjusting the volume\nTo increase the volume:\n\u25b7 Press and hold the control panel of the right earbud until the \nvolume is increased. \nTo reduce the volume:\n\u25b7 Press and hold the control panel of the left earbud until the \nvolume is reduced. \nWhen the maximum or minimum volu me is reached, you hear the\nvoice prompt \u201cVolume max\u201d or \u201cVolume min\u201d.\nWARNING\nDanger due to high volume levels!\nListening at high volume levels can lead to permanent \nhearing defects."]}
{"question":"What is Momentum Sport's microphone frequency?","ground_truth":"100 Hz to 10 kHz.","answer":"100 Hz to 10 kHz","contexts":["Specifications\n64 | MOMENTUM Sport\nSpecifications\nMOMENTUM Sport\nModel: MSPORT1, MSPORT1 R, MSPORT1 L, MSPORT1 C\nWearing style True Wireless stereo earbuds\nEar coupling ear canal, semi-open\nFrequency response 15 Hz to 18 kHz\nTransducer principle dynamic\nTransducer size 10 mm\nSound pressure level (SPL) 110 dB (1 kHz\/0 dBFS)\nTHD \n(1 kHz, 94 dB SPL)\n< 0.25% (1 kHz\/94 dB)\nNoise cancellation Hybrid Adaptive ANC technology\nMicrophone principle MEMS\nMicrophone frequency \nresponse\n100 Hz to 10 kHz","Transmission frequency 2,402 MHz to 2,480 MHz\nModulation GFSK, \u03c0\/4 DQPSK, 8DPSK\nProfiles AVRCP, A2DP, HFP\nOutput power 16 mW (max)\nCodec aptX\u2122, aptX\u2122 Adaptive, AAC, SBC\nDevice name MOMENTUM Sport\nNumber of active connec-\ntions\n2\nRequired apps Sennheiser Smart Control for Android \nand iOS \nPolar Flow\u00ae for full use of the sensor \ndata","charging: +10\u00b0C to +40\u00b0C\nstorage: \u201320\u00b0C to +60\u00b0C\nRelative humidity\n(non condensing)\noperation: 10 to 80 %\nstorage: 10 to 90 %\nWeight (headphones) approx. 293 g\nMagnetic field strength 6.25 mT\nVersion Bluetooth 5.2 compliant, class 1\nTransmission frequency 2,402 MHz to 2,480 MHz\nModulation GFSK, \u03c0\/4 DQPSK, 8DPSK\nProfiles HFP, AVRCP, A2DP\nOutput power 10 mW (max)\nCodec aptX\u2122 Adaptive, AAC, SBC\nDevice name MOMENTUM 4 (individually adjust-\nable)\nLE-MOMENTUM 4 (Bluetooth Low \nEnergy only)"]}
{"question":"What is the transducer size in Momentum True Wireless 4 earbuds?","ground_truth":"7mm","answer":"The transducer size in Momentum True Wireless 4 earbuds is 7 mm.","contexts":["charging: +10\u00b0C to +40\u00b0C\nstorage: \u201320\u00b0C to +60\u00b0C\nRelative humidity\n(non condensing)\noperation: 10 to 80 %\nstorage: 10 to 90 %\nWeight (headphones) approx. 293 g\nMagnetic field strength 6.25 mT\nVersion Bluetooth 5.2 compliant, class 1\nTransmission frequency 2,402 MHz to 2,480 MHz\nModulation GFSK, \u03c0\/4 DQPSK, 8DPSK\nProfiles HFP, AVRCP, A2DP\nOutput power 10 mW (max)\nCodec aptX\u2122 Adaptive, AAC, SBC\nDevice name MOMENTUM 4 (individually adjust-\nable)\nLE-MOMENTUM 4 (Bluetooth Low \nEnergy only)","Specifications\n48 | MOMENTUM True Wireless 4\nSpecifications\nMOMENTUM True Wireless 4\nModel: MTW4, MTW4 R, MTW4 L, MTW4 C\nWearing style True Wireless stereo earbuds\nEar coupling ear-canal\nFrequency response 5 Hz to 21 kHz\nTransducer principle dynamic\nTransducer size 7 mm\nSound pressure level (SPL) 107 dB (1 kHz\/1 mW)\nTHD (1 kHz, 94 dB SPL) < 0.08 % (1 kHz\/94 dB)\nNoise cancellation Hybrid Adaptive ANC technology\nMicrophone principle MEMS\nMicrophone frequency \nresponse\n100 Hz to 10 kHz","Specifications\n48 | MOMENTUM True Wireless 4\nSpecifications\nMOMENTUM True Wireless 4\nModel: MTW4, MTW4 R, MTW4 L, MTW4 C\nWearing style True Wireless stereo earbuds\nEar coupling ear-canal\nFrequency response 5 Hz to 21 kHz\nTransducer principle dynamic\nTransducer size 7 mm\nSound pressure level (SPL) 107 dB (1 kHz\/1 mW)\nTHD (1 kHz, 94 dB SPL) < 0.08 % (1 kHz\/94 dB)\nNoise cancellation Hybrid Adaptive ANC technology\nMicrophone principle MEMS\nMicrophone frequency \nresponse\n100 Hz to 10 kHz"]}
{"question":"What should you do to reset MOMENTUM True Wireless 4 earbuds to factory settings?","ground_truth":"To reset, disconnect all Bluetooth connections, place one earbud in the charging case, and hold the touch panel of the other earbud for 15 seconds.","answer":"To reset MOMENTUM True Wireless 4 earbuds to factory settings, you can use the Smart Control app or manually reset them.","contexts":["FAQ\/If a problem occurs ...\nMOMENTUM True Wireless 4  | 45\nFAQ\/If a problem occurs ...\nIf a problem has occurred, proceed in the following order until the \nproblem is solved and you can use the earbuds again:\n1. Insert the earbuds into the char ging case and close the lid. Wait\nfor at least 10 seconds (> 46). \n2. Connect the earbuds to the Smart Control app to install the latest\nfirmware (> 44).\n3. Reset the earbuds to the factory default settings (> 47).","FAQ\/If a problem occurs ...\nMOMENTUM True Wireless 4  | 45\nFAQ\/If a problem occurs ...\nIf a problem has occurred, proceed in the following order until the \nproblem is solved and you can use the earbuds again:\n1. Insert the earbuds into the char ging case and close the lid. Wait\nfor at least 10 seconds (> 46). \n2. Connect the earbuds to the Smart Control app to install the latest\nfirmware (> 44).\n3. Reset the earbuds to the factory default settings (> 47).","FAQ\/If a problem occurs ...\nMOMENTUM True Wireless 4  | 47\nResetting the earbuds to the factory default settings\nIf the function of the earbuds is disturbed and a reset (> 46) does not \nimprove, reset the earbuds to the factory default settings. This \ndeletes, among other things, all pairing settings.\nThe easiest way to reset the earbuds to the factory default settings \nis using the Smart Control app.\nAlternatively, you can manually proceed as follows:"]}
{"question":"How can you switch to Transparency Mode on MOMENTUM True Wireless 4 earbuds?","ground_truth":"To switch to Transparency Mode, tap the touch control panel of the left earbud once.","answer":"To switch to Transparency Mode on MOMENTUM True Wireless 4 earbuds, touch and hold the touch control panel of the right earbud.","contexts":["Using the earbuds\nMOMENTUM True Wireless 4  | 29\nSwitching the earbuds off\nThe earbuds do not have to be switched off explicitly. \n\u25b7 Insert the earbuds into the charging case and close the lid to \nswitch them off. \nAs soon as the earbuds are inserted into the charging case and \nthe lid of the charging case is closed, the earbuds switch off and \nare being charged (> 17).\nAdjusting the volume\nTo increase the volume:\n\u25b7 Touch and hold the touch control panel of the right earbud until","Using the earbuds\nMOMENTUM True Wireless 4  | 29\nSwitching the earbuds off\nThe earbuds do not have to be switched off explicitly. \n\u25b7 Insert the earbuds into the charging case and close the lid to \nswitch them off. \nAs soon as the earbuds are inserted into the charging case and \nthe lid of the charging case is closed, the earbuds switch off and \nare being charged (> 17).\nAdjusting the volume\nTo increase the volume:\n\u25b7 Touch and hold the touch control panel of the right earbud until","Using the earbuds\n28 | MOMENTUM True Wireless 4\nSwitching the earbuds on\n\u25b7 Open the lid of the charging case and take out both earbuds.\n\u25b7 Insert the earbuds into your ears (> 27). \nIf a paired Bluetooth device is within the transmission range, you \nhear the voice prompts \u201cPower On\u201d and \u201cConnected\u201d. The LEDs \nof the earbuds light up blue.\nWARNING\nDanger due to high volume levels!\nListening at high volume levels can lead to permanent \nhearing defects."]}
{"question":"In the scenario 1 in Network whitepaper what is the only component needing active configuration?","ground_truth":"The only component needing active configuration is the SRV-record in the DNS-Server","answer":"The only component needing active configuration in Scenario 1 of the Network whitepaper is the SRV-record in the DNS-Server.","contexts":["Scenarios for network integration Scenario 1 - One port solution  In this scenario, all components (MobileConnect Station, MobileConnect Manager, MobileConnect App clients) are part of the same network. This makes for a very simple setup, light on configuration, as the only component needing active configuration is the SRV-record in the DNS-Server.                 Advantages \u2022 Easy to setup \u2022 No additional hardware\/software needed  Disadvantages \u2022 The server with the MobileConnect Manager is","There are two options for network integration scenarios from a system side:  \nOne port solution  \nIn this scenario, all components (MobileConnect Station, MobileConnect Manager, MobileConnect App clients) are part of the same network. This makes for a very simple setup, light on configuration, as the only component needing active configuration is the SRV-record in the DNS-Server.","have. \u2022 When using a single network (for more see Scenario 1 - One port solution), you can use the default Docker configuration and it will work out of the box. \u2022 When using two separate networks (for more see Scenario 2 - Two port solution), for security considerations, it is important and strongly recommended, to use a firewall. Otherwise, both - streaming and administration will be accessible through both network interfaces. You will find some small firewall configuration scripts for the"]}
{"question":"Why does the first ruleset disallow all access using IPv6?","ground_truth":"Because MobileConnect Manager is currently only supporting IPv4","answer":"The first ruleset disallows all access using IPv6 because the MobileConnect Manager currently only supports IPv4.","contexts":["Additionally, connecting a device to a network without internet access limits its usability for other functions, making the system less inclusive.","expect a global configuration file to be located at \/etc\/mcm-iptables.conf. An example file:            Please note that not every option is used in every ruleset. The first ruleset disallows all access using IPv6, as the MobileConnect Manager is currently only supporting IPv4. Using this ruleset is recommended.","In this case, the \ufb01rst WSM being registered in the network owns all access rights. In order \nto avoid any collisions, you should deactivate access to the devices for all other WSMs (see \nWithdrawing access rights from a WSM\n).\nIf you should assign \u201cExclusive\u201d access right to several WSMs, then access is \nrandom. The WSM which registers quicker with the device owns all access rights. \nThis can, under certain circumstances, lead to confusion during operation."]}
{"question":"What happens when you activate 'Low Latency' mode on MOMENTUM True Wireless 4 earbuds?","ground_truth":"Activating 'Low Latency' mode minimizes delay between audio and video but may reduce Bluetooth transmission range.","answer":"Activating 'Low Latency' mode on MOMENTUM True Wireless 4 earbuds reduces the delay between audio and video for a more synchronized experience.","contexts":["Using the earbuds\n32 | MOMENTUM True Wireless 4\nListening to ambient sounds or \nconversations - activating\/deactivating \nthe Transparency Mode\nWith the Transparency Mode activated, you can hear ambient \nsounds or communicate without having to remove the earbuds from \nyour ears. This allows you to hear e.g. announcements in the train or \naircraft or to have short conversations.\nWith the Smart Control app, you can adjust the intensity of the","Using the earbuds\n32 | MOMENTUM True Wireless 4\nListening to ambient sounds or \nconversations - activating\/deactivating \nthe Transparency Mode\nWith the Transparency Mode activated, you can hear ambient \nsounds or communicate without having to remove the earbuds from \nyour ears. This allows you to hear e.g. announcements in the train or \naircraft or to have short conversations.\nWith the Smart Control app, you can adjust the intensity of the","Using the earbuds\n30 | MOMENTUM True Wireless 4\nTo reduce the volume:\n\u25b7 Touch and hold the touch control panel of the left earbud until the \nvolume decreases. \nWhen the maximum or minimum volu me is reached, you hear the\nvoice prompt \u201cVolume max\u201d or \u201cVolume min\u201d.\nInformation on the active noise \ncancellation ANC\nDue to the wearing style in the ear canal, the earbuds provide effec-\ntive passive isolation from ambient noise. \nIn addition, the earbuds are equipped with the active noise cancella-"]}
{"question":"What are the two modes of operation for MobileConnect, and how do they differ?","ground_truth":"The two modes are Standalone Mode and Manager Mode. Standalone Mode is easier to set up with minimal IT support, focusing on audio streaming via QR codes without internet connectivity. Manager Mode offers full functionality with IT infrastructure, DNS setup, and centralized administration.","answer":"The two modes of operation for MobileConnect are Manager Mode and Standalone Mode. Manager Mode allows for more advanced settings and network configurations, while Standalone Mode focuses on central audio streaming with simplified setup and basic IT support.","contexts":["3 \nMobileConnect \u2013 System Modes \n \nSystem  Sennheiser MobileConnect allows streaming live audio content with low latency and in superior quality via WiFi to connected Android and iOS smart devices. To ensure low latency and superior audio quality, unicast is used for streaming.  Application Modes  To adapt to different application scenarios and network environments, MobileConnect can be operated in two Modes: Manager Mode and Standalone Mode.  Mode Differentiation","With Standalone Mode, MobileConnect focuses on its central audio streaming function. After connecting it to a network infrastructure, it is ready to operate. Setup and installation effort are simplified in this mode, only basic IT support is required. All settings and administration are done via the Local Admin Interface. To connect to streams, users have to scan the QR-Code created in the Local Admin Interface.","Wi-Fi  \nMobileConnect relies on Wi-Fi to transmit streams to connected smartphones. The quality of the Wi-Fi is directly influencing the service\u2019s quality and performance.   \nQuality of Service is recommended.  Usage of 5 GHz band is recommended.  The recommended limit of number of clients per AP is 50.  \n \nThe term Standalone Mode refers to the MobileConnect Station, not the network infrastructure. MobileConnect does not handle network organization."]}
{"question":"What is required for using MobileConnect in Standalone Mode?","ground_truth":"An enterprise-grade router, access point(s), and a local network with DHCP enabled are required. Streams are accessed using QR codes.","answer":"In Standalone Mode, MobileConnect requires connection to a network infrastructure and basic IT support for setup. All settings and administration are done via the Local Admin Interface, and users need to scan the QR-Code created in the interface to connect to streams. No internet connection is required for using MobileConnect in Standalone Mode.","contexts":["With Standalone Mode, MobileConnect focuses on its central audio streaming function. After connecting it to a network infrastructure, it is ready to operate. Setup and installation effort are simplified in this mode, only basic IT support is required. All settings and administration are done via the Local Admin Interface. To connect to streams, users have to scan the QR-Code created in the Local Admin Interface.","In this mode, the MobileConnect Station and MobileConnect App are the system components.   Considerations  \n\u00fc Ease of installation \u00fc Limited IT support required \u2013 Manager functionalities not available \u2013 Streams can only be accessed via QR-Code   \nSetup Overview  Setting up MobileConnect in Standalone Mode requires the following steps: \n The target application for Standalone Mode is the equipment of a single room (or multiple single rooms) with live audio streams.","Does the system require an internet connection?\n\u00c2\u00b6\n\n\nThe MobileConnect system itself only requires internet connectivity when it is used in the so called \u00e2\u0080\u009cManager Mode\u00e2\u0080\u009d because the MobileConnect Manager handles the authentication and updates over the cloud.\n\n\nIn \u00e2\u0080\u009cStandalone Mode\u00e2\u0080\u009d the MobileConnect system does not require an internet connection."]}
{"question":"How does MobileConnect handle data load per client in Standalone Mode?","ground_truth":"The data load is 165 kbps per unique client connection.","answer":"The data load per unique client connection in Standalone Mode is 165 kbps.","contexts":["6 \nMobileConnect \u2013 System Modes \nHardware  Minimum hardware requirements  \nI Enterprise Grade Router  II Enterprise Grade Access Point(s)  Network  For Standalone Mode, a Wi-Fi network is required for transmission. Usage of an existing network infrastructure as well as the setup of a dedicated infrastructure is possible.   \nThe data load is 165 kbps per unique client connection.  DHCP is required.  Internet connectivity","Wi-Fi  \nMobileConnect relies on Wi-Fi to transmit streams to connected smartphones. The quality of the Wi-Fi is directly influencing the service\u2019s quality and performance.   \nQuality of Service is recommended.  Usage of 5 GHz band is recommended.  The recommended limit of number of clients per AP is 50.  \n \nThe term Standalone Mode refers to the MobileConnect Station, not the network infrastructure. MobileConnect does not handle network organization.","With Standalone Mode, MobileConnect focuses on its central audio streaming function. After connecting it to a network infrastructure, it is ready to operate. Setup and installation effort are simplified in this mode, only basic IT support is required. All settings and administration are done via the Local Admin Interface. To connect to streams, users have to scan the QR-Code created in the Local Admin Interface."]}
{"question":"What network recommendation is critical for using MobileConnect?","ground_truth":"The use of the 5 GHz Wi-Fi band is recommended for better performance and reduced interference.","answer":"The critical network recommendation for using MobileConnect is to ensure Quality of Service, use the 5 GHz band, and limit the number of clients per Access Point to 50. It is also highly recommended to use the existing Wi-Fi network for MobileConnect to avoid interference and maintain service quality.","contexts":["Wi-Fi  \nMobileConnect relies on Wi-Fi to transmit streams to connected smartphones. The quality of the Wi-Fi is directly influencing the service\u2019s quality and performance.   \nQuality of Service is recommended.  Usage of 5 GHz band is recommended.  The recommended limit of number of clients per AP is 50.  \n \nThe term Standalone Mode refers to the MobileConnect Station, not the network infrastructure. MobileConnect does not handle network organization.","If a Wi-Fi network is existing, it is highly recommended to use the same network for MobileConnect. Adding an additional Wi-Fi network will likely cause interference and lower the quality of service. Additionally, usage of a separate network worsens user experiences because it forces users to decide between MobileConnect and the other network\u2019s functionality.  Quality of Service is recommended.  Usage of 5 GHz band is recommended.  It is recommended to make 12 Mbps the lowest mandatory data","MobileConnect relies on Wi-Fi to transmit streams to connected smartphones. The quality of the Wi-Fi is directly influencing the quality and performance of service."]}
{"question":"What firmware version is required for using the Digital 6000 series with WSM?","ground_truth":"The required firmware version for the EM 6000 is 3.2.1, and for the L 6000, it is 3.0.1.","answer":"The required firmware version for using the Digital 6000 series with WSM is 3.2.1 or higher.","contexts":["| 2 - WSM (Wireless Systems Manager)\nCompatible Sennheiser products\nThe following Sennheiser systems can be con\ufb01gured using the WSM:\nOnly transmitters and receivers that are equipped with the same compander \nsystem can be combined with each other.\nDigital 9000\n\u2022 Required Firmware Version (or higher): 4.0.1\nDigital 6000\n\u2022 EM 6000\n\u2022 Required Firmware Version (or higher): 3.2.1\n\u2022 L 6000\n\u2022 Required Firmware Version (or higher): 3.0.1\nEW-DX\n\u2022 EW-DX EM 2\n\u2022 Required Firmware Version (or higher): 2.0.1","| 2 - WSM (Wireless Systems Manager)\new 300 G4\n\u2022 Required Firmware Version (or higher): 1.2.0.1\new 500 G4\n\u2022 Required Firmware Version (or higher): 1.2.0.1\new IEM G4\n\u2022 Required Firmware Version (or higher): 1.2.0.1\new 300 G3\n\u2022 Required Firmware Version (or higher): 1.8.0\new 500 G3\n\u2022 Required Firmware Version (or higher): 1.8.0\new 300 G3 IEM\n\u2022 Required Firmware Version (or higher): 1.8.0\n8","| 4 - Working with the software\nDownloading the latest \ufb01rmware update from the Internet\nSennheiser is continuously improving the WSM software.\nSelect the current \ufb01rmware package (SENNPKG \ufb01le) on the Sennheiser website at \nsennheiser.com\/wsm  and start the download.\nClick on \u201cOpen\u201d.\nThe \ufb01le is automatically saved in the \u201cNew Releases\u201d subfolder of the program \nfolder. If this folder already contains a \ufb01le, this \ufb01le is moved to the \u201cArchive\u201d \nfolder.\n48"]}
{"question":"What operating systems are compatible with the WSM software?","ground_truth":"WSM is compatible with Windows 10\/11 (32\/64-bit) and macOS 13 Ventura and macOS 14 Sonoma, with a minimum of 8 GB RAM.","answer":"The WSM software is compatible with the following operating systems:\n- Windows 10 (32 Bit\/64 Bit)\n- Windows 11 (32 Bit\/64 Bit)\n- macOS 13 Ventura\n- macOS 14 Sonoma","contexts":["| 2 - WSM (Wireless Systems Manager)\nSystem requirements\nThe WSM software runs on the following operating systems:\nWindows\nWindows 10 (32 Bit\/64 Bit)\nWindows 11 (32 Bit\/64 Bit)\n8 GB RAM\nMac\nmacOS 13 Ventura\nmacOS 14 Sonoma\n8 GB RAM\n9","| 2 - WSM (Wireless Systems Manager)\nCompatible Sennheiser products\nThe following Sennheiser systems can be con\ufb01gured using the WSM:\nOnly transmitters and receivers that are equipped with the same compander \nsystem can be combined with each other.\nDigital 9000\n\u2022 Required Firmware Version (or higher): 4.0.1\nDigital 6000\n\u2022 EM 6000\n\u2022 Required Firmware Version (or higher): 3.2.1\n\u2022 L 6000\n\u2022 Required Firmware Version (or higher): 3.0.1\nEW-DX\n\u2022 EW-DX EM 2\n\u2022 Required Firmware Version (or higher): 2.0.1","Wireless Systems Manager\n5. Troubleshooting\nThe most frequent questions and answers summarized in a chapter.\nFrequently asked questions\nIf a problem occurs\nGlossar\nFrequently asked questions\nWhich Sennheiser hardware is compatible to WSM Software?\nCompatible Sennheiser products\nWhich third party spectrum scans are supported?\nWSM supports the following frequency scans\n\u2022 Rohde & Schwarz FSH\/FPH (*.csv)\n\u2022 RF Explorer (*.csv)\n\u2022 Tektronix RSA (*.csv)\n\u2022 Aim TTi (*.csv)"]}
{"question":"What hardware is required for setting up MobileConnect in Standalone Mode?","ground_truth":"The hardware requirements include an enterprise-grade router, enterprise-grade access points, Server for MobileConnect Manager installation, A device providing DNS \/ DHCP in the network.","answer":"Enterprise Grade Router, Enterprise Grade Access Point(s), Wi-Fi network, DHCP, Internet connectivity.","contexts":["6 \nMobileConnect \u2013 System Modes \nHardware  Minimum hardware requirements  \nI Enterprise Grade Router  II Enterprise Grade Access Point(s)  Network  For Standalone Mode, a Wi-Fi network is required for transmission. Usage of an existing network infrastructure as well as the setup of a dedicated infrastructure is possible.   \nThe data load is 165 kbps per unique client connection.  DHCP is required.  Internet connectivity","With Standalone Mode, MobileConnect focuses on its central audio streaming function. After connecting it to a network infrastructure, it is ready to operate. Setup and installation effort are simplified in this mode, only basic IT support is required. All settings and administration are done via the Local Admin Interface. To connect to streams, users have to scan the QR-Code created in the Local Admin Interface.","In this mode, the MobileConnect Station and MobileConnect App are the system components.   Considerations  \n\u00fc Ease of installation \u00fc Limited IT support required \u2013 Manager functionalities not available \u2013 Streams can only be accessed via QR-Code   \nSetup Overview  Setting up MobileConnect in Standalone Mode requires the following steps: \n The target application for Standalone Mode is the equipment of a single room (or multiple single rooms) with live audio streams."]}
{"question":"What is the recommended Wi-Fi configuration for optimal performance of MobileConnect?","ground_truth":"It is recommended to use the 5 GHz band with a Quality of Service configuration. Each access point should ideally support a maximum of 50 clients, with a minimum data rate of 12 Mbps.","answer":"The recommended Wi-Fi configuration for optimal performance of MobileConnect includes using Quality of Service, utilizing the 5 GHz band, and limiting the number of clients per access point to 50. It is also recommended to use the same existing Wi-Fi network for MobileConnect to avoid interference and ensure a better user experience.","contexts":["Wi-Fi  \nMobileConnect relies on Wi-Fi to transmit streams to connected smartphones. The quality of the Wi-Fi is directly influencing the service\u2019s quality and performance.   \nQuality of Service is recommended.  Usage of 5 GHz band is recommended.  The recommended limit of number of clients per AP is 50.  \n \nThe term Standalone Mode refers to the MobileConnect Station, not the network infrastructure. MobileConnect does not handle network organization.","If a Wi-Fi network is existing, it is highly recommended to use the same network for MobileConnect. Adding an additional Wi-Fi network will likely cause interference and lower the quality of service. Additionally, usage of a separate network worsens user experiences because it forces users to decide between MobileConnect and the other network\u2019s functionality.  Quality of Service is recommended.  Usage of 5 GHz band is recommended.  It is recommended to make 12 Mbps the lowest mandatory data","Usage of 5 GHz band is recommended.  It is recommended to make 12 Mbps the lowest mandatory data rate.  The recommended limit of number of clients per AP is 50."]}
{"question":"What kind of delay or latency can I expect in the audio transmission for iOS devices?  Select the correct answer from A, B, C, D. Only one answer is correct. A) The latency is 50-65ms B) The latency is 50-55s C) The latency is 50-55ms D) The latency is 40-55ms","ground_truth":"C) The latency is 50-55ms","answer":"The latency for audio transmission on iOS devices is 50-55ms. Therefore, the correct answer is C) The latency is 50-55ms.","contexts":["The following latency can be expected with the system:\n\n\n\n\nOn iOS devices the latency is \n50-55ms\n\n\nOn mid-range to high-end Android devices (Wifi 5\/ac & Android Version >9) the latency is \n50-65ms\n\n\n\n\n\n\n\n\nWhich smartphones are recommended to use with MobileConnect?\n\u00c2\u00b6\n\n\nIn terms of Android we recommend to use mid-range or high-end devices that support Android Version >9 and WiFi ac.\nFor iOS we recommend all devices that support iOS version >13.","Is there a delay\/latency in the audio transmission?\n\n\nWhich smartphones are recommended to use with MobileConnect?\n\n\nWhich headphones do you recommend, and which induction neck loop do you recommend?\n\n\nIs it also possible to use headphones or hearing aids connected via Bluetooth?\n\n\nWhat if the smartphone does not provide a 3.5 mm headphone jack?\n\n\nCan I customize the app with my own logo or color?\n\n\nIs there an SDK (Software Development Kit) for implementation into my own app available?","scanning a specific channel QR-Code\n\n\ntyping in manually a channel ID\n\n\n\n\nLastly, the end-user can listen to the audio stream over wired headphones that are connected to the smartphone. It is also possible to listen directly over the hearing aids or the cochlea implant in T-Position with the combination of an induction neck loop that is connected to the smartphone.\n\n\n\n\n\n\n\n\nIs there a delay\/latency in the audio transmission?\n\u00c2\u00b6\n\n\nThe following latency can be expected with the system:"]}
{"question":"What is the release date of MobileConnect Manager 1.4.2?","ground_truth":"21.09.2022","answer":"The release date of MobileConnect Manager 1.4.2 is 21.09.2022.","contexts":["With the new App Customization feature, you can customize the MobileConnect App design, upload your custom app logo\nand create up to three onboarding screens to interact with your app users.\n\n\nMobileConnect now supports IPv6 which allows for usage in state-of-the-art network environments\n\n\n\n\n\n\n\n\nMobileConnect Manager 1.4.2\n\u00c2\u00b6\n\n\nRelease date: 21.09.2022\n\n\nThis is a hotfix release that enables the ADAT inputs for the MobileConnect Station 1 again.","MobileConnect Manager 1.4.0\n\u00c2\u00b6\n\n\nRelease date: 2.09.2021\n\n\n\n\nIntroducing an improved way to \naccess and secure the streaming channels\n.\n\n\n\n\nThe streaming channels can be accessed using automatic discovery or by providing a QR code or Channel ID to the app user.\n\n\nThe streaming channels can be secured using a 6 digit \nPIN code\n.\n\n\nThe channel access methods and PIN code can be combined or used separately as you see fit.","MobileConnect Manager 1.2.0\n\u00c2\u00b6\n\n\nRelease date: 24.09.2020\n\n\n\n\nImproved access to your MobileConnect Manager with support for \nmultiple members\n:\n\n\n\n\n\n\nNew owner, admin and moderator roles.\n\n\nEasy access management: control who can view and edit your MobileConnect network and audio configuration.\n\n\nFor more see the MobileConnect user guide.\n\n\n\n\n\n\n\n\nIncreased \nsecurity\n between MobileConnect Manager and Station; Station authorization\/rejection."]}
{"question":"What is the release date of MobileConnect Station 7.2.0?","ground_truth":"18.01.2024","answer":"The release date of MobileConnect Station 7.2.0 is 18.01.2024.","contexts":["It is now possible to hide streaming channels or share them via QR or numeric code.\n\n\n\n\n\n\n\n\n\n\nPrevious Releases Station v2 (2020)\n\u00c2\u00b6\n\n\n\n\nMobileConnect Station 7.2.0\n\u00c2\u00b6\n\n\nRelease date: 18.01.2024\n\n\nThis firmware release is required to support the above MobileConnect Manager 2.1.0 features. It also brings the following features to Standalone Mode:\n\n\n\n\nAudience Mic users can now queue up, allowing a smoother user experience for those who want to participate in vivid discussions.","MobileConnect is made for streaming live audio to mobile devices at lowest possible audio delay. In some cases, it might be beneficial to adjust the target latency to a specific value. With this release you can now set a manual latency value, for example when transmitting audio of an interpreter or a TV.\n\n\n\n\n\n\n\n\nMobileConnect Station 7.2.1\n\u00c2\u00b6\n\n\nRelease date: 15.07.2024\n\n\nThis is a security release fixing a severe vulnerability. We recommend all users to update the firmware.","Release date: 10.06.2022\n\n\nThis is a small bugfix release for the following:\n\n\n\n\nSwitching from Standalone to Manager Mode does not always work\n\n\nClients are not disconnected when a channel is disabled or PIN is set via the Standalone Mode API\n\n\nOther Standalone API improvements\n\n\n\n\nWe recommend updating the firmware to this version, especially in case you are using the \nStandalone Mode API\n.\n\n\n\n\n\n\nMobileConnect Station 6.7.0\n\u00c2\u00b6\n\n\nRelease date: 5.05.2022"]}
{"question":"What is the battery life of the Bose QuietComfort Earbuds II during continuous playback with ANC on?","ground_truth":"I don't know","answer":"The battery life of the Bose QuietComfort Earbuds II during continuous playback with ANC on is approximately 6 hours.","contexts":["m distance, Bluetooth AAC codec, \nvolume level 50%, ANC activated, \nhealth data sensors activated)\nCharging time of recharge-\nable batteries\napprox. 1.5 hours for full charge\napprox. 10 minutes for 1 hour of music \nplayback (ANC mode)","input:\nearbuds (R and L): \n5 V , max. 100 mA\ncharging case: 5 V , max. 1000 mA\noutput:\nearbuds (R and L): none\ncharging case: \n5 V , max. 100 mA x 2 (R and L)\nCharging method via \ncharging case\nUSB charging via USB-C socket: \n5 V , 1000 mA;\nQi wireless charging\nOperating time 6 hrs with rechargeable battery of the \nearbud\n24 hrs with rechargeable battery of \nthe charging case\n(test conditions: smartphone within 1 \nm distance, Bluetooth AAC codec, \nvolume level 50%, ANC activated,","Microphone pick-up pat-\ntern (speech audio)\n2 omni-directional microphones \n(beamforming)\nPower supply built-in rechargeable lithium-ion \nbattery: 3.7 V \u2393, 800 mAh, 2.96 Wh \nUSB charging: 5 V \u2393, 700 mA max.\nCharging time of recharge-\nable battery\napprox. 3 hrs\nOperating time up to 50 hrs (music playback via Blue-\ntooth with ANC activated)\nTemperature range operation: 0 \u00b0C to +40 \u00b0C\ncharging: +10 \u00b0C to +40 \u00b0C\nstorage: \u201320 \u00b0C to +60 \u00b0C\nRelative humidity\n(non condensing)\noperation: 10 to 80 %"]}
{"question":"Does the Sony WH-1000XM5 support multi-device Bluetooth pairing, and how many devices can it connect to simultaneously?","ground_truth":"I don't know","answer":"The Sony WH-1000XM5 does not support multi-device Bluetooth pairing.","contexts":["nect devices (see page > 29).\nSmart Control \u201cSennheiser Smart Control\u201d\nYou can connect the earbuds to two Bluetooth devices at the \nsame time, e.g. to a sports watch and your smartphone with a \nfitness app or to an indoor fitness bike and a sports watch.\n3s\nLR\n \u201cPairing\u201c","operating system (see page > 28)\nPaired devices establish a Bluet ooth wireless connection immedi-\nately after switch-on and are ready for use.\nWhen switched on, the earbuds will automatically try to connect to \nthe last two Bluetooth devices used. The earbuds can save the con-\nnection profiles of up to six Bluetooth devices with which they have \nbeen paired. Audio playback is only possible from one device at a \ntime.\nIf you pair the earbuds with the seventh Bluetooth device, the con-","Getting started\nMOMENTUM True Wireless 4  | 15\n5. Connecting additional Bluetooth devices\n\u25b7 If desired, connect the earbuds to additional devices via Blue-\ntooth (> 22).\nThe earbuds can save the connection profiles of up to six Bluetooth \ndevices with which they have been paired. Audio playback is only \npossible from one device at a time.\nUsing the Smart Control app (\u201cConnections\u201d), you can view the list of \npaired devices and selectively connect and disconnect devices (> \n23).\n3s\nLR\n \u201cPairing\u201c"]}
{"question":"What is the water resistance rating of the Apple AirPods Pro 2?","ground_truth":"I don't know","answer":"I don't know.","contexts":["charging: +10\u00b0C to +40\u00b0C\nstorage: \u201320\u00b0C to +60\u00b0C\nRelative humidity\n(non condensing)\noperation: 10 to 80 %\nstorage: 10 to 90 %\nWeight (headphones) approx. 293 g\nMagnetic field strength 6.25 mT\nVersion Bluetooth 5.2 compliant, class 1\nTransmission frequency 2,402 MHz to 2,480 MHz\nModulation GFSK, \u03c0\/4 DQPSK, 8DPSK\nProfiles HFP, AVRCP, A2DP\nOutput power 10 mW (max)\nCodec aptX\u2122 Adaptive, AAC, SBC\nDevice name MOMENTUM 4 (individually adjust-\nable)\nLE-MOMENTUM 4 (Bluetooth Low \nEnergy only)","storage: \u201320 \u00b0C to +60 \u00b0C\nRelative humidity\n(non condensing)\noperation: 10 to 80 %\nstorage: 10 to 90 %\nWeight (headphones) approx. 222 g\nMagnetic field strength 3.00 mT\nVersion Bluetooth 5.2 compliant, class 1\nTransmission frequency 2,402 MHz to 2,480 MHz\nModulation GFSK, \u03c0\/4 DQPSK, 8DPSK\nProfiles A2DP, AVRCP, HFP, HSP, GATT\nOutput power 10 mW (max)\nCodec aptX\u2122 HD, AAC, SBC\nDevice name ACCENTUM (individually adjustable)\nNumber of active connec-\ntions\n2","and M-size ear tip)\ncharging case: 78.4 g\nboth earbuds and charging case: 91 g\nDimensions earbuds: ap prox. 23.3 x 20.9 x \n26.1 mm\ncharging case: 63.7 x 64.8 x 30.0 mm\nSensors heart rate, body temperature, \n3-axis acceleration sensor, infrared \nin-ear sensor\nSensor measuring ranges heart rate: 30 ~ 220 bpm\nbody temperature: 35.5 to 42.0\u00b0C \n(accuracy: \u00b1 0.3\u00b0C)\nVersion Bluetooth 5.2 certified, class 1\nTransmission frequency 2,402 MHz to 2,480 MHz\nModulation GFSK, \u03c0\/4 DQPSK, 8DPSK"]}
