{"question":"What does it mean when the LED display flashes yellow In Accentum Wireless Around Ear Headphones? Select the correct answer from A, B, C, D. Only one answer is correct. A) Battery charge is 0 % to 20 %. B) Battery charge is 90 % to 100 %. C) Battery charge is 20 % to 90 %. D) Headphones are in Bluetooth pairing mode","ground_truth":"C) Battery charge is 20 % to 90 %.","answer":"A) Battery charge is 0% to 20%","contexts":["\u25b7 Charge the rechargeable battery until the LED display lights up \nagain (at least 30 minutes) (> 13). If the rechargeable battery is \ncompletely discharged, it may take several minutes for the LED \ndisplay to indicate the charging process.\nConnecting the headphones to a \nBluetooth device\nTo be able to use the Bluetooth connection, you must register both \ndevices (headphones and e.g. smartphone) once. This process is \ncalled pairing.","tery charge status of the charging case.\nIf you close the lid of the charging case, the LED display goes off \nafter 5 seconds.\nCharging case LED Charging case WITH \nearbuds inserted\nCharging case \nWITHOUT earbuds \ninserted \nlights up \ngreen\nEarbuds are fully \ncharged, charging \ncase can still charge \nat least one com-\nplete cycle.\nCharging case is \nfully charged.\npulses \nyellow\nEarbuds are being \ncharged via the \nrechargeable bat-\ntery of the charging \ncase.\n\u2013\nlights up \nyellow","earbuds inserted\nCharging case \nWITHOUT earbuds \ninserted \nlights up \ngreen\nEarbuds are fully \ncharged, charging \ncase is more than 50 \n% charged.\nCharging case is \nmore than 50 % \ncharged.\npulses \nyellow\nEarbuds are being \ncharged via the \nrechargeable bat-\ntery of the charging \ncase.\n\u2013\nlights up \nyellow\nEarbuds are fully \ncharged, charging \ncase is less than \n50 % charged.\nCharging case is \ncharged less than \n50 %.\nlights up \nred\nRechargeable bat-\nteries of the earbuds \nand the charging"]}
{"question":"Is it possible to setup voice prompt? If yes, how to do that in Accentum Wireless Around Ear Headphones?","ground_truth":"Yes, it is possible. To set up the voice prompts you require the Smart Control App (>18). In the app settings, you can activate voice prompts and sound signals (also the default setting) or deactivate them.","answer":"Yes, it is possible to set up voice prompts in the Accentum Wireless Around Ear Headphones. To do so, you need to use the Smart Control app. In the app settings, you can activate voice prompts and sound signals or deactivate them completely.","contexts":["Product overview\n14 | MOMENTUM Sport\nNotes on voice prompts\nThe earbuds output voice prompts for events (the table gives some \nexamples). Using the Smart Control app, you can choose between \nvoice prompts and beep sounds, or deactivate the status messages \nwith a few exceptions (e.g. rechargeable battery is empty). \nVoice prompt Meaning\n\u201cPower on\u201d Earbuds are switched on.\n\u201cPower off\u201d Earbuds switch off.\n\u201cConnected\u201d Earbuds are connected via Blue-\ntooth.","settings are active even without using the Smart Control app, i.e. \nwhen you are using a different Bluetooth device.\nSetting the voice prompts\/sound signals\nTo be able to set the voice prompts and sound signals, you require \nthe Smart Control app (> 18).\nIn the app settings, you can activate voice prompts and sound sig-\nnals (default setting) or deactivate them completely.\nDeactivating the touch pad function\nTo avoid unintentional entries via the touch pad of the headphones,","charge level via the voice prompts (also possible while listening to \nmusic or talking on the phone, as long as you have the headphones \non):\n\u25b7 Press the music and call control button for 3 seconds.\nYou hear a voice prompt informing you of the remaining battery life. \nThe LED flashes\/lights up depending on the battery life of the head-\nphones.\nAdjusting the volume\nYou can adjust the playback volume for music and for phone calls."]}
{"question":"When do I replace the ear pads and where can I find the replacement ear pads for Accentum Wireless Around Ear Headphones?","ground_truth":"There is no specific timeframe for ear pad replacement. For hygiene reasons, you should replace your ear pads from time to time. Replacement ear pads are available at www.sennheiser-hearing.com\/accentum-wireless.","answer":"To replace the ear pads for the Accentum Wireless Around Ear Headphones, you can purchase replacement ear pads from the Sennheiser website or contact your local Sonova Consumer Hearing partner for assistance.","contexts":["chase online or contact your local Sonova Consumer Hearing \npartner: \nwww.sennheiser-hearing.com\/service-support)\nMOMENTUM 4 around-ear headphones\nModel: M4AEBT\nUSB cable with USB-C and USB-A connector,\nlength approx. 1.2 m\nAnalog audio cable with 3.5 mm jack plug and \n2.5 mm jack plug, length approx. 1.2 m\nIn-flight adapter\nCarry case\nQuick guide\nSafety guide","FAQs | Sennheiser Deutschland\nShop\nAlle Kopfh\u00f6rer\nTrue Wireless\nWireless headphones\nOver-Ear Kopfh\u00f6rer\nIn-ear headphones\nNoise-cancelling headphones\nEarbuds\nACCENTUM Series\nAudiophile Kopfh\u00f6rer\nHome Listening\nMobile Listening\nAudiophile Gaming\nSoundbars\n-AMBEO- Soundbars\nH\u00f6runterst\u00fctzung\nTV Hearing\nConversation Clear Plus\nBeim H\u00f6rakustiker\nErsatzteile & Zubeh\u00f6r\nAlle Angebote\nOutlet\nSets\nGeschenkberater\nExplore\nAbout Us\nBuilding the future of audio\nOur company\nCareer at Sonova","MOMENTUM 4\nWireless around-ear headphones\nModel: M4AEBT\nInstruction manual\nUse the search function, the navigation (left) or the following links:\nStart\n\u201cProduct overview\u201d\n\u201cGetting started\u201d\n\u201cUsing the headphones\u201d\n\u201cFAQ\/If a problem occurs ...\u201d\n\u201cSpecifications\u201d\nSonova Consumer Hearing GmbH\nAm Labor 1\n30900 Wedemark\nGermany\nwww.sennheiser-hearing.com\nVersion: 10\/24 A04"]}
{"question":"What is the charging temperature range of Accentum wireless around ear headphones?","ground_truth":"Between +10 \u00b0C to +40 \u00b0C","answer":"The charging temperature range of Accentum wireless around ear headphones is from +5 to +35\u00b0C.","contexts":["Specifications\nMOMENTUM Sport  | 65\nBluetooth\nTemperature range operation: 0 to +40\u00b0C\ncharging: +5 to +35\u00b0C\nstorage: \u201320 to +60\u00b0C\nRelative humidity operation: 10 to 80%, non condensing\nstorage: 10 to 90%\nMagnetic field strength earbuds: 1.86 mT\ncharging case: 250 mT\nIngress protection of the \nearbuds\nearbuds: IP55\ncharging case: IP54\nWeight earbuds: 6.4 g each (with N-size ring \nand M-size ear tip)\ncharging case: 78.4 g\nboth earbuds and charging case: 91 g","Getting started\nACCENTUM  |  11\nGetting started\n1. Charging the rechargeable battery\nThe headphones\u2019 rechargeable battery is not fully charged upon \ndelivery. \n\u25b7 Before using the headphones for the first time, charge the \nrechargeable battery for a complete charging cycle without inter-\nruption (> 13).\n2. Connecting the headphones to a Bluetooth \ndevice\n\u25b7 Connect the headphones to your smartphone via Bluetooth (> 14).\n3. Smart Control app for your smartphone","Specifications\n38  |  ACCENTUM\nSpecifications\nModel: ACAEBT\nBluetooth\nWearing style Bluetooth\u00ae around-ear, closed-back\nEar coupling circum-aural\nTransducer principle dynamic\nTransducer 37 mm\nFrequency response 10 Hz to 22,000 Hz (\u201310 dB)\nSound pressure level (SPL) 106 dB (1 kHz\/0 dBFS)\nTHD (1 kHz, 100 dB SPL) < 0.3 % (1 kHz, 100 dB SPL)\nMicrophone principle MEMS\nMicrophone frequency \nresponse\n50 Hz to 8,000 Hz (\u20133 dB)\nMicrophone pick-up pat-\ntern (speech audio)\n2 omni-directional microphones"]}
{"question":"What is the weight of the Momentum 4 Wireless Around Ear Headphones?","ground_truth":"Approximately 293g.","answer":"The weight of the Momentum 4 Wireless Around Ear Headphones is 91 g (both earbuds and charging case combined).","contexts":["Specifications\nMOMENTUM Sport  | 65\nBluetooth\nTemperature range operation: 0 to +40\u00b0C\ncharging: +5 to +35\u00b0C\nstorage: \u201320 to +60\u00b0C\nRelative humidity operation: 10 to 80%, non condensing\nstorage: 10 to 90%\nMagnetic field strength earbuds: 1.86 mT\ncharging case: 250 mT\nIngress protection of the \nearbuds\nearbuds: IP55\ncharging case: IP54\nWeight earbuds: 6.4 g each (with N-size ring \nand M-size ear tip)\ncharging case: 78.4 g\nboth earbuds and charging case: 91 g","Frequency response 20 Hz - 20 kHz\nWeight 85 g\nTemperature range operation: 0 to 40\u00b0C (32 to 104\u00b0F)\nDimensions 93 x 93 x 27 mm (approx.)\nBluetooth\nVersion 4.2, class 1\nTransmission frequency 2402 to 2480 MHz\nModulation type GFSK, \u03c0\/4 DQPSK, 8 DPSK\nProfile A2DP\nRF output power 10 mW (max)\nSupported codecs SBC, aptX, aptX LL*\nNumber of active connections 2\n*supported on a single pair aptX LL headphone connection.","Specifications\n48 | MOMENTUM True Wireless 4\nSpecifications\nMOMENTUM True Wireless 4\nModel: MTW4, MTW4 R, MTW4 L, MTW4 C\nWearing style True Wireless stereo earbuds\nEar coupling ear-canal\nFrequency response 5 Hz to 21 kHz\nTransducer principle dynamic\nTransducer size 7 mm\nSound pressure level (SPL) 107 dB (1 kHz\/1 mW)\nTHD (1 kHz, 94 dB SPL) < 0.08 % (1 kHz\/94 dB)\nNoise cancellation Hybrid Adaptive ANC technology\nMicrophone principle MEMS\nMicrophone frequency \nresponse\n100 Hz to 10 kHz"]}
{"question":"What is the charging time of the rechargeable battery in Momentum 4 Wireless Around Ear Headphones?","ground_truth":"Approximately 2 hours","answer":"I don't know.","contexts":["Using the earbuds\n16 | MOMENTUM True Wireless 4\nUsing the earbuds\nInformation on the rechargeable battery, \nthe charging process and the first use\nThe earbuds and the charging case each have a built-in rechargeable \nbattery. \nTo charge the rechargeable batteries, you can use one of the follow-\ning options:\n\u2022t h e  s u p p l i e d  U S B  c a b l e\n\u2022 a wireless charging station (Qi-compatible, to be ordered sepa-\nrately)\nThe earbuds must be inserted into the charging case for charging.","Using the earbuds\n16 | MOMENTUM True Wireless 4\nUsing the earbuds\nInformation on the rechargeable battery, \nthe charging process and the first use\nThe earbuds and the charging case each have a built-in rechargeable \nbattery. \nTo charge the rechargeable batteries, you can use one of the follow-\ning options:\n\u2022t h e  s u p p l i e d  U S B  c a b l e\n\u2022 a wireless charging station (Qi-compatible, to be ordered sepa-\nrately)\nThe earbuds must be inserted into the charging case for charging.","both earbuds and charging case: \napprox. 78 g\nVersion Bluetooth 5.4 certified, class 1\nTransmission frequency Classic BDR\/EDR and BLE 1M:\n2,402 MHz to 2,480 MHz\nBLE 2M: 2,404 MHz to 2,478 MHz \n(without 2,426 MHz)\nModulation GFSK, \u03c0\/4 DQPSK, 8DPSK\nProfiles AVRCP, A2DP, HFP, TMAP, PBP\nOutput power 10 mW (max)\nCodec aptX\u2122, aptX\u2122 Adaptive\/Lossless, \nAAC, SBC, Auracast\u2122 Broadcast \nAudio, LC3\nDevice name MOMENTUM TW 4\nNumber of active connec-\ntions\n2"]}
{"question":"What does it mean when the LED display flashes red 3x repeatedly during phone calls in Momentum 4 Wireless Headphones? Select the correct answer from A, B, C, D. Only one answer is correct.  A) Incoming call B) switch off C) Rechargeable battery is almost empty (less than 2% charged) D) incoming call with an almost empty battery.","ground_truth":"D) incoming call with an almost empty battery.","answer":"C) Rechargeable battery is almost empty (less than 2% charged)","contexts":["apps. Minimal effort with no additional equipment. \nlights up \nred\nRechargeable bat-\ntery of the charging \ncase is almost \nempty. The earbuds \ncannot be charged.\nRechargeable bat-\ntery of the charging \ncase is almost \nempty.\nflashes \nred\nAt least one earbud \nhas a charging \nerror\/battery error \n(see page > 60).\nCharging case has a \ncharging error\/bat-\ntery error (see page \n> 60).\nCharging case LED Charging case WITH \nearbuds inserted\nCharging case \nWITHOUT earbuds \ninserted","process (see page > 9). \nWhen the charge status of the earbuds\u2019 rechargeable batteries \ndrops to a critical level, a voice prompt asks you to recharge the ear-\nbuds (\u201cRecharge headset\u201d).\nThe charge status of the rechargeable battery of the charging case \nis indicated by the LED display on the charging case (see page > 9).\nAt the end of its operational lifetime, this product with its built-in \nrechargeable battery must be disposed of separately from normal","charge level via the voice prompts (also possible while listening to \nmusic or talking on the phone, as long as you have the headphones \non):\n\u25b7 Press the music and call control button for 3 seconds.\nYou hear a voice prompt informing you of the remaining battery life. \nThe LED flashes\/lights up depending on the battery life of the head-\nphones.\nAdjusting the volume\nYou can adjust the playback volume for music and for phone calls."]}
{"question":"What does it mean when the LED display presents 3 white during charging in Momentum 4 wireless around ear headphones? Select the correct answer from A, B, C, D. Only one answer is correct.  A) Incoming call B) switch off C) Rechargeable battery is almost empty (less than 2% charged) D) incoming call with an almost empty battery.","ground_truth":"A) Incoming call","answer":"C) Rechargeable battery is almost empty (less than 2% charged)","contexts":["earbuds inserted\nCharging case \nWITHOUT earbuds \ninserted \nlights up \ngreen\nEarbuds are fully \ncharged, charging \ncase is more than 50 \n% charged.\nCharging case is \nmore than 50 % \ncharged.\npulses \nyellow\nEarbuds are being \ncharged via the \nrechargeable bat-\ntery of the charging \ncase.\n\u2013\nlights up \nyellow\nEarbuds are fully \ncharged, charging \ncase is less than \n50 % charged.\nCharging case is \ncharged less than \n50 %.\nlights up \nred\nRechargeable bat-\nteries of the earbuds \nand the charging","earbuds inserted\nCharging case \nWITHOUT earbuds \ninserted \nlights up \ngreen\nEarbuds are fully \ncharged, charging \ncase is more than 50 \n% charged.\nCharging case is \nmore than 50 % \ncharged.\npulses \nyellow\nEarbuds are being \ncharged via the \nrechargeable bat-\ntery of the charging \ncase.\n\u2013\nlights up \nyellow\nEarbuds are fully \ncharged, charging \ncase is less than \n50 % charged.\nCharging case is \ncharged less than \n50 %.\nlights up \nred\nRechargeable bat-\nteries of the earbuds \nand the charging","first time.\nWhen a USB cable connected to a power source is also connected to \nthe charging case or when you place the charging case on a wireless \ncharging station, the rechargeable battery of the charging case is \nbeing charged. When the earbuds are inserted into the charging \ncase, their rechargeable batteries are being charged at the same \ntime. The LED display of the charging case indicates the charging \nprocess (> 8). \nWhen the charge status of the earbuds\u2019 rechargeable batteries"]}
{"question":"How many audio sources can I connect at the same time to the BTT100 Audio transmitter?","ground_truth":"You can simultaneously connect 2 different sources to the transmitter.","answer":"The BTT100 Audio transmitter can connect to one audio source at a time.","contexts":["BT T100 Bluetooth\u00ae Audio Transmitter | 3 \nImportant safety instructions\nIntended use\/Liability\nThe Bluetooth\u00ae Audio Transmitter is suitable for use with hi-fi systems, \nTV sets, PCs, and home cinema systems and supports both analog and \ndigital signals. With this product you can enable a non-Bluetooth-enabled \ndevice to playback audio through Bluetooth wireless headphones.\nIt is considered improper use when this product is used for any application","BT T100 Bluetooth\u00ae Audio Transmitter | 13 \nUsing the transmitter\nUsing the transmitter\nSwitching the transmitter on\nThe transmitter goes into pairing mode when switched on for the \nfirst time.\n1. Press the Multifunction button for 2 seconds.\nThe LED lights up red. \nON\n2sHold\nSwitching the transmitter off\n1. Press the Multifunction button for 3 seconds.\nThe LED switches off.\nOFF\n3sHold","BT T100 Bluetooth\u00ae Audio Transmitter | 5 \nThe Bluetooth\u00ae Audio Transmitter\nBluetooth\nThe Bluetooth\u00ae Audio Transmitter complies with the Bluetooth  4.2 standard \nand is compatible with all Bluetooth 1.1, 1.2, 2.0, 2.1, and 3.0 headphones \nwith Advanced Audio Distribution Profile (A2DP) for audio playback.\naptXTM\nWith aptXTM audio coding, you can be assured of crisp, pure and full stereo \nsound. It allows you to not only hear, but experience and feel the audio"]}
{"question":"What happens to the LED light colour when I switch the transmitter on and how do I know whether a connection is established in BTT100 Bluetooth Audio Transmitter?","ground_truth":"The LED lights up red when the transmitter is switched on and once the connection is established, the LED lights up blue.","answer":"When you switch on the BTT100 Bluetooth Audio Transmitter, the LED light color changes to indicate the status. A solid blue light indicates that a connection is established.","contexts":["2 | BT T100 Bluetooth\u00ae Audio Transmitter\nImportant safety instructions\nImportant safety instructions\n X Read the instruction manual, safety instructions, quick guide (depending \non the scope of delivery) carefully and completely before using the \nproduct.\n X Always include the safety instructions when passing the product on to \nthird parties.\n X Do not use an obviously defective product.\n X Only use the product in environments where Bluetooth\u00ae wireless \ntransmission is permitted.","for the LED display to indicate the charging process.\nVia the Smart Control app, you can adjust settings for the voice \nprompts and sound signals (> 31).\nVoice prompt Meaning\/headphones...\nEstablishing a Bluetooth connection\n\u201cConnected\u201d ...are connected via Bluetooth.\n\u201cNo connection\u201d ... have lost the Bluetooth connec-\ntion to a paired device.\n\u201cPairing successful\u201d ... have successfully completed \nBluetooth pairing.\n\u201cPairing failed\u201d ... have not successfully completed \nBluetooth pairing.","6 | BT T100 Bluetooth\u00ae Audio Transmitter\nPackage includes\nPackage includes\nBluetooth transmitter\nModel: BT T100\nUSB power cable\nDigital optical cable\nAnalog audio cable\nQuick\nGuide Quick guide\nSafety\nGuide Safety guide\nA list of accessories can be found at www.sennheiser-hearing.com. \nFor information on suppliers, contact your local Sonova Consumer \nHearing partner: www.sennheiser-hearing.com\/service-support."]}
{"question":"What is the number of transmission channels in BTT100 Bluetooth Audio Transmitter?","ground_truth":"79","answer":"The number of transmission channels in the BTT100 Bluetooth Audio Transmitter is 79.","contexts":["20 | BT T100 Bluetooth\u00ae Audio Transmitter\nSpecifications\nSpecifications\nBluetooth\u00ae Audio Transmitter \nModel: BT T100\nInputs digital input: optical \nsupported data streams:  \nPCM, 44.1 - 48 kHz\/16 - 24 bit\nanalog input: 3.5 mm stereo jack \nsocket\nInput voltage & current USB power supply via USB micro \nB socket \n5 V\u2393,  500 mA\nNumber of transmission channels 79\nOccupied bandwidth 1 channel 1 MHz\nFrequency response 20 Hz - 20 kHz\nWeight 85 g\nTemperature range operation: 0 to 40\u00b0C (32 to 104\u00b0F)","Frequency response 20 Hz - 20 kHz\nWeight 85 g\nTemperature range operation: 0 to 40\u00b0C (32 to 104\u00b0F)\nDimensions 93 x 93 x 27 mm (approx.)\nBluetooth\nVersion 4.2, class 1\nTransmission frequency 2402 to 2480 MHz\nModulation type GFSK, \u03c0\/4 DQPSK, 8 DPSK\nProfile A2DP\nRF output power 10 mW (max)\nSupported codecs SBC, aptX, aptX LL*\nNumber of active connections 2\n*supported on a single pair aptX LL headphone connection.","6 | BT T100 Bluetooth\u00ae Audio Transmitter\nPackage includes\nPackage includes\nBluetooth transmitter\nModel: BT T100\nUSB power cable\nDigital optical cable\nAnalog audio cable\nQuick\nGuide Quick guide\nSafety\nGuide Safety guide\nA list of accessories can be found at www.sennheiser-hearing.com. \nFor information on suppliers, contact your local Sonova Consumer \nHearing partner: www.sennheiser-hearing.com\/service-support."]}
{"question":"What is the weight of BTT100 Bluetooth Audio Transmitter?","ground_truth":"85g.","answer":"The weight of the BTT100 Bluetooth Audio Transmitter is 85 g.","contexts":["Frequency response 20 Hz - 20 kHz\nWeight 85 g\nTemperature range operation: 0 to 40\u00b0C (32 to 104\u00b0F)\nDimensions 93 x 93 x 27 mm (approx.)\nBluetooth\nVersion 4.2, class 1\nTransmission frequency 2402 to 2480 MHz\nModulation type GFSK, \u03c0\/4 DQPSK, 8 DPSK\nProfile A2DP\nRF output power 10 mW (max)\nSupported codecs SBC, aptX, aptX LL*\nNumber of active connections 2\n*supported on a single pair aptX LL headphone connection.","20 | BT T100 Bluetooth\u00ae Audio Transmitter\nSpecifications\nSpecifications\nBluetooth\u00ae Audio Transmitter \nModel: BT T100\nInputs digital input: optical \nsupported data streams:  \nPCM, 44.1 - 48 kHz\/16 - 24 bit\nanalog input: 3.5 mm stereo jack \nsocket\nInput voltage & current USB power supply via USB micro \nB socket \n5 V\u2393,  500 mA\nNumber of transmission channels 79\nOccupied bandwidth 1 channel 1 MHz\nFrequency response 20 Hz - 20 kHz\nWeight 85 g\nTemperature range operation: 0 to 40\u00b0C (32 to 104\u00b0F)","6 | BT T100 Bluetooth\u00ae Audio Transmitter\nPackage includes\nPackage includes\nBluetooth transmitter\nModel: BT T100\nUSB power cable\nDigital optical cable\nAnalog audio cable\nQuick\nGuide Quick guide\nSafety\nGuide Safety guide\nA list of accessories can be found at www.sennheiser-hearing.com. \nFor information on suppliers, contact your local Sonova Consumer \nHearing partner: www.sennheiser-hearing.com\/service-support."]}
{"question":"What does green light in momentum sport's charging case LED indicate with earbuds inserted in? Select the correct answer from A, B, C, D. Only one answer is correct.  A) Earbuds are fully charged, charging case can still charge at least one complete cycle. B) Charging case is fully charged. C) Firmware update is being performed. D) Rechargeable battery of the charging case is almost empty.","ground_truth":"A) Earbuds are fully charged, charging case can still charge at least one complete cycle.","answer":"A) Earbuds are fully charged, charging case can still charge at least one complete cycle.","contexts":["LED Charging case WITH \nearbuds inserted\nCharging case \nWITHOUT earbuds \ninserted \npulses \nyellow\nEarbuds and \ncharging case are \nbeing charged.\nCharging case is \nbeing charged.\nlights up \ngreen\nEarbuds and \ncharging case are \nfully charged.\nCharging case is \nfully charged.\nflashes \nred\nAt least one earbud \nhas a charging error\/\nbattery error (see \npage > 60).\nCharging case has a \ncharging error\/bat-\ntery error (see page \n> 60).\nUSB-C\nUSB-A\nL\nR\n1\n2\n33","first time.\nWhen a USB cable connected to a power source is also connected to \nthe charging case or when you place the charging case on a wireless \ncharging station, the rechargeable battery of the charging case is \nbeing charged. When the earbuds are inserted into the charging \ncase, their rechargeable batteries are being charged at the same \ntime. The LED display of the charging case indicates the charging \nprocess (> 8). \nWhen the charge status of the earbuds\u2019 rechargeable batteries","first time.\nWhen a USB cable connected to a power source is also connected to \nthe charging case or when you place the charging case on a wireless \ncharging station, the rechargeable battery of the charging case is \nbeing charged. When the earbuds are inserted into the charging \ncase, their rechargeable batteries are being charged at the same \ntime. The LED display of the charging case indicates the charging \nprocess (> 8). \nWhen the charge status of the earbuds\u2019 rechargeable batteries"]}
{"question":"What does it mean when the Momentum Sport's earbud LED flashes red 3x ? Select the correct answer from A, B, C, D. Only one answer is correct.  A) Rechargeable battery is almost empty. B) Bluetooth pairing or earbud pairing failed. C) System error is present. Perform a reset (see page > 63). D) Bluetooth pairing or earbud pairing was successful.","ground_truth":"B) Bluetooth pairing or earbud pairing failed.","answer":"B) Bluetooth pairing or earbud pairing failed.","contexts":["green\nEarbuds and \ncharging case are \nfully charged.\nCharging case is \nfully charged.\nflashes \nred \nAt least one earbud \nhas a charging \nerror\/battery error \n(> 44).\nCharging case has a \ncharging error\/bat-\ntery error (> 44).\n 5s","green\nEarbuds and \ncharging case are \nfully charged.\nCharging case is \nfully charged.\nflashes \nred \nAt least one earbud \nhas a charging \nerror\/battery error \n(> 44).\nCharging case has a \ncharging error\/bat-\ntery error (> 44).\n 5s","for 3 seconds until you hear the voice prompt \u201cPairing\u201d and a \nbeep.\nThe LEDs of the earbuds flash blue and red. The earbuds are in \npairing mode.\n3. Activate Bluetooth on your Bluetooth device. \n4. Via the menu of your Bluetooth device, start the search for new \nBluetooth devices. \nAll active Bluetooth devices in the immediate vicinity are dis-\nplayed.\nFrom the list of found Bluetooth devices, select \n\u201cMOMENTUM Sport\u201d. If necessary, enter the default pin code \n\u201c0000\u201d."]}
{"question":"What does 'Podcast' voice prompt mean in Momentum Sport?","ground_truth":"Equalizer preset for podcasts is activated (improved speech intelligibility).","answer":"I don't know.","contexts":["Using the headphones\n32 | MOMENTUM 4\nUsing the Smart Pause function\nThe headphones are equipped with a sensor that automatically \ndetects whether the headphones are worn or taken off from your \nears. \nYou can use the following functions:\n\u2022 Music playback pauses when you take off the headphones and\ncontinues when you put them on again.\n\u2022 A phone call is accepted when you put on the headphones.\n\u2022 A phone call is muted when you take off the headphones during","Specifications\n64 | MOMENTUM Sport\nSpecifications\nMOMENTUM Sport\nModel: MSPORT1, MSPORT1 R, MSPORT1 L, MSPORT1 C\nWearing style True Wireless stereo earbuds\nEar coupling ear canal, semi-open\nFrequency response 15 Hz to 18 kHz\nTransducer principle dynamic\nTransducer size 10 mm\nSound pressure level (SPL) 110 dB (1 kHz\/0 dBFS)\nTHD \n(1 kHz, 94 dB SPL)\n< 0.25% (1 kHz\/94 dB)\nNoise cancellation Hybrid Adaptive ANC technology\nMicrophone principle MEMS\nMicrophone frequency \nresponse\n100 Hz to 10 kHz","Transmission frequency 2,402 MHz to 2,480 MHz\nModulation GFSK, \u03c0\/4 DQPSK, 8DPSK\nProfiles AVRCP, A2DP, HFP\nOutput power 16 mW (max)\nCodec aptX\u2122, aptX\u2122 Adaptive, AAC, SBC\nDevice name MOMENTUM Sport\nNumber of active connec-\ntions\n2\nRequired apps Sennheiser Smart Control for Android \nand iOS \nPolar Flow\u00ae for full use of the sensor \ndata"]}
{"question":"What is Momentum Sport's microphone frequency?","ground_truth":"100 Hz to 10 kHz.","answer":"100 Hz to 10 kHz","contexts":["Specifications\nMOMENTUM Sport  | 65\nBluetooth\nTemperature range operation: 0 to +40\u00b0C\ncharging: +5 to +35\u00b0C\nstorage: \u201320 to +60\u00b0C\nRelative humidity operation: 10 to 80%, non condensing\nstorage: 10 to 90%\nMagnetic field strength earbuds: 1.86 mT\ncharging case: 250 mT\nIngress protection of the \nearbuds\nearbuds: IP55\ncharging case: IP54\nWeight earbuds: 6.4 g each (with N-size ring \nand M-size ear tip)\ncharging case: 78.4 g\nboth earbuds and charging case: 91 g","Specifications\n64 | MOMENTUM Sport\nSpecifications\nMOMENTUM Sport\nModel: MSPORT1, MSPORT1 R, MSPORT1 L, MSPORT1 C\nWearing style True Wireless stereo earbuds\nEar coupling ear canal, semi-open\nFrequency response 15 Hz to 18 kHz\nTransducer principle dynamic\nTransducer size 10 mm\nSound pressure level (SPL) 110 dB (1 kHz\/0 dBFS)\nTHD \n(1 kHz, 94 dB SPL)\n< 0.25% (1 kHz\/94 dB)\nNoise cancellation Hybrid Adaptive ANC technology\nMicrophone principle MEMS\nMicrophone frequency \nresponse\n100 Hz to 10 kHz","Using the earbuds\nMOMENTUM Sport  | 41\nAdjusting the playback pause in the \nTransparency Mode\nYou can select how audio playback behaves when the Transparency \nMode is activated. To be able to adjust this setting, you require the \nSmart Control app (see page > 28).\n\u25b7 Make sure that the Transparency Mode is activated (see \npage > 39).\n\u25b7 In the Smart Control app, select the desired setting for audio play-\nback in the \u201cNoise settings\u201d area:\n*default setting\nUsing the voice assistant\/voice dialing"]}
{"question":"What is the transducer size in Momentum True Wireless 4 earbuds?","ground_truth":"7mm","answer":"The transducer size in Momentum True Wireless 4 earbuds is 7 mm.","contexts":["Specifications\n48 | MOMENTUM True Wireless 4\nSpecifications\nMOMENTUM True Wireless 4\nModel: MTW4, MTW4 R, MTW4 L, MTW4 C\nWearing style True Wireless stereo earbuds\nEar coupling ear-canal\nFrequency response 5 Hz to 21 kHz\nTransducer principle dynamic\nTransducer size 7 mm\nSound pressure level (SPL) 107 dB (1 kHz\/1 mW)\nTHD (1 kHz, 94 dB SPL) < 0.08 % (1 kHz\/94 dB)\nNoise cancellation Hybrid Adaptive ANC technology\nMicrophone principle MEMS\nMicrophone frequency \nresponse\n100 Hz to 10 kHz","Specifications\n48 | MOMENTUM True Wireless 4\nSpecifications\nMOMENTUM True Wireless 4\nModel: MTW4, MTW4 R, MTW4 L, MTW4 C\nWearing style True Wireless stereo earbuds\nEar coupling ear-canal\nFrequency response 5 Hz to 21 kHz\nTransducer principle dynamic\nTransducer size 7 mm\nSound pressure level (SPL) 107 dB (1 kHz\/1 mW)\nTHD (1 kHz, 94 dB SPL) < 0.08 % (1 kHz\/94 dB)\nNoise cancellation Hybrid Adaptive ANC technology\nMicrophone principle MEMS\nMicrophone frequency \nresponse\n100 Hz to 10 kHz","Specifications\n64 | MOMENTUM Sport\nSpecifications\nMOMENTUM Sport\nModel: MSPORT1, MSPORT1 R, MSPORT1 L, MSPORT1 C\nWearing style True Wireless stereo earbuds\nEar coupling ear canal, semi-open\nFrequency response 15 Hz to 18 kHz\nTransducer principle dynamic\nTransducer size 10 mm\nSound pressure level (SPL) 110 dB (1 kHz\/0 dBFS)\nTHD \n(1 kHz, 94 dB SPL)\n< 0.25% (1 kHz\/94 dB)\nNoise cancellation Hybrid Adaptive ANC technology\nMicrophone principle MEMS\nMicrophone frequency \nresponse\n100 Hz to 10 kHz"]}
{"question":"What should you do to reset MOMENTUM True Wireless 4 earbuds to factory settings?","ground_truth":"To reset, disconnect all Bluetooth connections, place one earbud in the charging case, and hold the touch panel of the other earbud for 15 seconds.","answer":"To reset MOMENTUM True Wireless 4 earbuds to factory settings, you can use the Smart Control app or manually proceed by following the instructions provided in the user manual.","contexts":["FAQ\/If a problem occurs ...\nMOMENTUM True Wireless 4  | 47\nResetting the earbuds to the factory default settings\nIf the function of the earbuds is disturbed and a reset (> 46) does not \nimprove, reset the earbuds to the factory default settings. This \ndeletes, among other things, all pairing settings.\nThe easiest way to reset the earbuds to the factory default settings \nis using the Smart Control app.\nAlternatively, you can manually proceed as follows:","FAQ\/If a problem occurs ...\nMOMENTUM True Wireless 4  | 47\nResetting the earbuds to the factory default settings\nIf the function of the earbuds is disturbed and a reset (> 46) does not \nimprove, reset the earbuds to the factory default settings. This \ndeletes, among other things, all pairing settings.\nThe easiest way to reset the earbuds to the factory default settings \nis using the Smart Control app.\nAlternatively, you can manually proceed as follows:","firmware (> 44).\n3. Reset the earbuds to the factory default settings (> 47).\n4. Check the list of frequently asked questions to see if there is a\nsolution to the problem (> 45).\n5. Contact your Sonova Consumer  Hearing partner to solve the\nproblem (> 45).\nCurrent list of frequently asked questions (FAQ)\nVisit the MOMENTUM True Wireless 4 product page at\nwww.sennheiser-hearing.com\nThere you will find a current list of frequently asked questions (FAQ) \nand suggested solutions."]}
{"question":"How can you switch to Transparency Mode on MOMENTUM True Wireless 4 earbuds?","ground_truth":"To switch to Transparency Mode, tap the touch control panel of the left earbud once.","answer":"To switch to Transparency Mode on MOMENTUM True Wireless 4 earbuds, you can adjust the playback pause setting in the Smart Control app by selecting the desired setting in the \"Transparency Mode\" section.","contexts":["Using the earbuds\n34 | MOMENTUM True Wireless 4\nControlling music playback\nThe music playback functions are only available when the earbuds \nand the Bluetooth device are connected. Some smartphones or \nmusic players may not support all functions. \nPlaying\/pausing music\n\u25b7 Tap the touch control panel of the right earbud 1x.\nPlaying the previous track\n\u25b7 Tap the touch control panel of the left earbud 2x.\nPlaying the next track\n\u25b7 Tap the touch control panel of the right earbud 2x.","Using the earbuds\n34 | MOMENTUM True Wireless 4\nControlling music playback\nThe music playback functions are only available when the earbuds \nand the Bluetooth device are connected. Some smartphones or \nmusic players may not support all functions. \nPlaying\/pausing music\n\u25b7 Tap the touch control panel of the right earbud 1x.\nPlaying the previous track\n\u25b7 Tap the touch control panel of the left earbud 2x.\nPlaying the next track\n\u25b7 Tap the touch control panel of the right earbud 2x.","\u25b7 Tap the touch control panel of the left earbud 1x.\nAdjusting the playback pause in the \nTransparency Mode\nYou can select how audio playback behaves when the Transparency \nMode is activated. To be able to adjust this setting, you require the \nSmart Control app (> 23).\n\u25b7 Select the desired setting in the \u201cTransparency Mode\u201d section of \nthe Smart Control app:\n*default setting\nON\/OFF\n1 x L\n\u201cAutomatic Pause\u201d Description\nactivated* Audio playback (e.g. music) is muted"]}
{"question":"In the scenario 1 in Network whitepaper what is the only component needing active configuration?","ground_truth":"The only component needing active configuration is the SRV-record in the DNS-Server","answer":"The only component needing active configuration in scenario 1 in the Network whitepaper is the MobileConnect Manager.","contexts":["Manager Mode supports several network scenarios to adapt to existing networks and lets IT choose the most suitable integration scenario for the respective network architecture.  \nIn this mode, the MobileConnect Station, the MobileConnect Manager and MobileConnect App are the system components.     Considerations  \u00fc Manager value \u00fc Effortless administration \u00fc Automatic Service Discovery via DNS \u2013 Setup effort for Manager and DNS \u2013 IT support required \n Setup Overview","can be conveniently administered and remotely managed from anywhere on the campus.           This whitepaper provides recommendations on how to integrate the MobileConnect system into your existing network. The preferred scenarios are the usage of a single network or two separate networks for streaming and control connections. All scenarios support NAT. The system can be integrated in Eduroam. Select the scenario that fits your network setup best. For more information, also see the","this configuration is recommended in the one-port setup. As an alternative to this, have a look at the other network setup scenarios."]}
{"question":"Why does the first ruleset disallow all access using IPv6?","ground_truth":"Because MobileConnect Manager is currently only supporting IPv4","answer":"I don't know.","contexts":["Additionally, connecting a device to a network without internet access limits its usability for other functions, making the system less inclusive.","Disadvantages \u2022 The solution needs two separate networks, which needs additional cabling \u2022 Every network needs to have its own DNS server configured & maintained \u2022 A minimal firewall is needed on the MobileConnect Manager to ensure the access limitation   Setup \u2022 Connect the public interface of your MobileConnect Manager to your streaming network \u2022 Connect the private interface of your MobileConnect Manager to your control network \u2022 Connect the streaming port (PoE\/Stream or LAN2) of the","as Android ignores search domains.  \u2022 For iOS \u2192 the \u201cdomain part\" can be used or if you have multiple search domains, it must be in the search domains.  \u2022 The MobileConnect station respects the domain part and the search domains."]}
{"question":"What happens when you activate 'Low Latency' mode on MOMENTUM True Wireless 4 earbuds?","ground_truth":"Activating 'Low Latency' mode minimizes delay between audio and video but may reduce Bluetooth transmission range.","answer":"Activating 'Low Latency' mode on MOMENTUM True Wireless 4 earbuds reduces the delay between audio and video for a more synchronized experience.","contexts":["Using the earbuds\nMOMENTUM True Wireless 4  | 39\n\u201cLossless Audio\u201d mode\nThe \u201cLossless Audio\u201d mode offers maximum sound quality. The audio \ndata is transmitted uncompressed and bit-accurate in CD quality via \nthe Bluetooth codec aptX\u2122 Lossless, with a sampling frequency of \n44.1 kHz and a sampling depth of 16 bits. \nA correspondingly high-resolution quality of the audio material to be \nplayed back is required.\nIf the \u201cLossless Audio\u201d mode is activated via the Smart Control app,","Using the earbuds\nMOMENTUM True Wireless 4  | 39\n\u201cLossless Audio\u201d mode\nThe \u201cLossless Audio\u201d mode offers maximum sound quality. The audio \ndata is transmitted uncompressed and bit-accurate in CD quality via \nthe Bluetooth codec aptX\u2122 Lossless, with a sampling frequency of \n44.1 kHz and a sampling depth of 16 bits. \nA correspondingly high-resolution quality of the audio material to be \nplayed back is required.\nIf the \u201cLossless Audio\u201d mode is activated via the Smart Control app,","Using the earbuds\nMOMENTUM True Wireless 4  | 31\nActivating\/deactivating the active noise \ncancellation ANC\n\u25b7 Tap the touch control panel of the left earbud 3x.\nThe active noise cancellation ANC is activated or deactivated.\nAdjusting the active noise cancellation \nANC \nTo be able to adjust settings for the active noise cancellation ANC, \nyou require the Smart Control app (> 23).\n\u25b7 In the Smart Control app, select the desired ANC mode:\n*default setting"]}
{"question":"What are the two modes of operation for MobileConnect, and how do they differ?","ground_truth":"The two modes are Standalone Mode and Manager Mode. Standalone Mode is easier to set up with minimal IT support, focusing on audio streaming via QR codes without internet connectivity. Manager Mode offers full functionality with IT infrastructure, DNS setup, and centralized administration.","answer":"The two modes of operation for MobileConnect are Manager Mode and Standalone Mode. Manager Mode involves setting up multiple rooms with live audio streams and administering all Stations in an infrastructure. Standalone Mode focuses on central audio streaming function, with simplified setup and installation effort, requiring only basic IT support. All settings and administration in Standalone Mode are done via the Local Admin Interface.","contexts":["Setup Overview  \nSetting up MobileConnect in Manager Mode requires the following steps: \n \nThe target application for Manager Mode is the equipment of multiple rooms with live audio streams & the administration of all Stations in an infrastructure.","With Standalone Mode, MobileConnect focuses on its central audio streaming function. After connecting it to a network infrastructure, it is ready to operate. Setup and installation effort are simplified in this mode, only basic IT support is required. All settings and administration are done via the Local Admin Interface. To connect to streams, users have to scan the QR-Code created in the Local Admin Interface.","There are two options for network integration scenarios from a system side:  \nOne port solution  \nIn this scenario, all components (MobileConnect Station, MobileConnect Manager, MobileConnect App clients) are part of the same network. This makes for a very simple setup, light on configuration, as the only component needing active configuration is the SRV-record in the DNS-Server."]}
{"question":"What is required for using MobileConnect in Standalone Mode?","ground_truth":"An enterprise-grade router, access point(s), and a local network with DHCP enabled are required. Streams are accessed using QR codes.","answer":"For using MobileConnect in Standalone Mode, a Wi-Fi network is required for transmission. Additionally, the minimum hardware requirements include an Enterprise Grade Router, Enterprise Grade Access Point(s), and DHCP. Internet connectivity is also necessary.","contexts":["MobileConnect Station 6.7.0\n\u00c2\u00b6\n\n\nRelease date: 5.05.2022\n\n\n\n\nThe \nMobileConnect API\n is now available for Standalone Mode. Use either the dedicated Crestron and Extron plugins or the API directly, in order to automate sharing the channel QR code or PIN code.\n\n\nBugfix for Manager 1.3.0 and Station firmware 6.4.0\/6.7.0, streaming cannot be started.\n\n\nStability improvements for Station - App connection\n\n\n\n\n\n\n\n\nMobileConnect Station v2 6.4.1\n\u00c2\u00b6\n\n\nRelease date: 22.08.2022","6 \nMobileConnect \u2013 System Modes \nHardware  Minimum hardware requirements  \nI Enterprise Grade Router  II Enterprise Grade Access Point(s)  Network  For Standalone Mode, a Wi-Fi network is required for transmission. Usage of an existing network infrastructure as well as the setup of a dedicated infrastructure is possible.   \nThe data load is 165 kbps per unique client connection.  DHCP is required.  Internet connectivity","5 \nMobileConnect \u2013 System Modes \nStandalone Mode  Standalone Mode simplifies the setup of MobileConnect. It enables a flexible solution that is applicable for a wide range of usage scenarios."]}
{"question":"How does MobileConnect handle data load per client in Standalone Mode?","ground_truth":"The data load is 165 kbps per unique client connection.","answer":"The data load per client in Standalone Mode for MobileConnect is 165 kbps.","contexts":["6 \nMobileConnect \u2013 System Modes \nHardware  Minimum hardware requirements  \nI Enterprise Grade Router  II Enterprise Grade Access Point(s)  Network  For Standalone Mode, a Wi-Fi network is required for transmission. Usage of an existing network infrastructure as well as the setup of a dedicated infrastructure is possible.   \nThe data load is 165 kbps per unique client connection.  DHCP is required.  Internet connectivity","2 \nMobileConnect Network Whitepaper \nVersion 1.0","3 \nMobileConnect Network Whitepaper \nVersion 1.0"]}
{"question":"What network recommendation is critical for using MobileConnect?","ground_truth":"The use of the 5 GHz Wi-Fi band is recommended for better performance and reduced interference.","answer":"It is critical to use the existing Wi-Fi network for MobileConnect to avoid interference and ensure quality of service.","contexts":["can be conveniently administered and remotely managed from anywhere on the campus.           This whitepaper provides recommendations on how to integrate the MobileConnect system into your existing network. The preferred scenarios are the usage of a single network or two separate networks for streaming and control connections. All scenarios support NAT. The system can be integrated in Eduroam. Select the scenario that fits your network setup best. For more information, also see the","The following latency can be expected with the system:\n\n\n\n\nOn iOS devices the latency is \n50-55ms\n\n\nOn mid-range to high-end Android devices (Wifi 5\/ac & Android Version >9) the latency is \n50-65ms\n\n\n\n\n\n\n\n\nWhich smartphones are recommended to use with MobileConnect?\n\u00c2\u00b6\n\n\nIn terms of Android we recommend to use mid-range or high-end devices that support Android Version >9 and WiFi ac.\nFor iOS we recommend all devices that support iOS version >13.","If a Wi-Fi network is existing, it is highly recommended to use the same network for MobileConnect. Adding an additional Wi-Fi network will likely cause interference and lower the quality of service. Additionally, usage of a separate network worsens user experiences because it forces users to decide between MobileConnect and the other network\u2019s functionality.  Quality of Service is recommended.  Usage of 5 GHz band is recommended.  It is recommended to make 12 Mbps the lowest mandatory data"]}
{"question":"What firmware version is required for using the Digital 6000 series with WSM?","ground_truth":"The required firmware version for the EM 6000 is 3.2.1, and for the L 6000, it is 3.0.1.","answer":"To use the Digital 6000 series with WSM, the firmware version required can be downloaded from the Sennheiser website at sennheiser.com\/wsm.","contexts":["| 2 - WSM (Wireless Systems Manager)\nSystem requirements\nThe WSM software runs on the following operating systems:\nWindows\nWindows 10 (32 Bit\/64 Bit)\nWindows 11 (32 Bit\/64 Bit)\n8 GB RAM\nMac\nmacOS 13 Ventura\nmacOS 14 Sonoma\n8 GB RAM\n9","| 4 - Working with the software\nDownloading the latest \ufb01rmware update from the Internet\nSennheiser is continuously improving the WSM software.\nSelect the current \ufb01rmware package (SENNPKG \ufb01le) on the Sennheiser website at \nsennheiser.com\/wsm  and start the download.\nClick on \u201cOpen\u201d.\nThe \ufb01le is automatically saved in the \u201cNew Releases\u201d subfolder of the program \nfolder. If this folder already contains a \ufb01le, this \ufb01le is moved to the \u201cArchive\u201d \nfolder.\n48","Con\ufb01guring devices\nRecording the \ufb01eld strength using the tools\nUpdating the \ufb01rmware of devices\nThe \u201cWireless Systems Manager\u201d allows you to update the \ufb01rmware of the connected \nSennheiser devices.\nRelated information\nDisplaying the \ufb01rmware versions of the devices\nDownloading the latest \ufb01rmware update from the Internet\nPreparing the \ufb01rmware update\nDisplaying the \ufb01rmware versions of the devices\nYou can display the \ufb01rmware versions of the connected devices.\n46"]}
{"question":"What operating systems are compatible with the WSM software?","ground_truth":"WSM is compatible with Windows 10\/11 (32\/64-bit) and macOS 13 Ventura and macOS 14 Sonoma, with a minimum of 8 GB RAM.","answer":"The WSM software is compatible with Windows operating systems.","contexts":["| 5 - Troubleshooting\nSoftware\nThe program does not launch\nCheck that your PC satis\ufb01es the system requirements (System requirements).\nCheck the settings of your \ufb01rewall; the WSM may be blocked by a setting.\nThe receiver panel does not appear\nThe \ufb01rmware in the receiver has not yet been updated.\nUpdate the \ufb01rmware in the receiver (see Updating the \ufb01rmware of devices).\nDevice is not found\nDevice is switched off\nSwitch on the device.\nFirewall blocks the WSM","| 2 - WSM (Wireless Systems Manager)\new 300 G4\n\u2022 Required Firmware Version (or higher): 1.2.0.1\new 500 G4\n\u2022 Required Firmware Version (or higher): 1.2.0.1\new IEM G4\n\u2022 Required Firmware Version (or higher): 1.2.0.1\new 300 G3\n\u2022 Required Firmware Version (or higher): 1.8.0\new 500 G3\n\u2022 Required Firmware Version (or higher): 1.8.0\new 300 G3 IEM\n\u2022 Required Firmware Version (or higher): 1.8.0\n8","| 3 - Getting started\/setting up\nRegistering a device with a static IP address\nIf you have assigned a device a static IP address, this device is not automatically detected by \nthe WSM. You must manually register these devices with each WSM.\nIn the system window, click on the \u201cDevices\u201d tab.\nIf the system window is not shown, click on \u201cView\u201d > \u201cSystem window\u201d.\nTo register the device with a WSM:\nRight-click a free area in the system window.\nClick on \u201eAdd device\u201c.\nClick on the desired device."]}
{"question":"What hardware is required for setting up MobileConnect in Standalone Mode?","ground_truth":"The hardware requirements include an enterprise-grade router, enterprise-grade access points, Server for MobileConnect Manager installation, A device providing DNS \/ DHCP in the network.","answer":"No hardware is required for setting up MobileConnect in Standalone Mode.","contexts":["In contrast to Manager Mode, internet connectivity it is not required in Standalone Mode. However, it is recommended for all MobileConnect networks. Missing internet connectivity on the network worsens user experience significantly. Mobile devices constantly try to establish internet access. If it is not available in the connected Wi-Fi, most devices will try and switch to mobile data connection. Additionally, connecting a device to a network without internet access limits its usability for","8 \nMobileConnect \u2013 System Modes \nManager Mode   Manager mode offers the full range of functionality of MobileConnect. The MobileConnect Manager software is added to the setup as a single point of administration for all MobileConnect Stations in the infrastructure. With the Manager, all settings and administration can be handled from anywhere in the network.","Standalone Mode is easier to setup. It requires less network infrastructure and IT support. All settings and administration are done via the Local Admin Interface and streams are only available after scanning a QR-Code. Standalone Mode does not require internet connectivity.  Choosing a Mode  When choosing a Mode, the most important factors are installation size and application scenario."]}
{"question":"What is the recommended Wi-Fi configuration for optimal performance of MobileConnect?","ground_truth":"It is recommended to use the 5 GHz band with a Quality of Service configuration. Each access point should ideally support a maximum of 50 clients, with a minimum data rate of 12 Mbps.","answer":"The recommended Wi-Fi configuration for optimal performance of MobileConnect includes using Quality of Service, utilizing the 5 GHz band, and limiting the number of clients per Access Point (AP) to 50.","contexts":["4 \nMobileConnect Network Whitepaper \nVersion 1.0","Wi-Fi  \nMobileConnect relies on Wi-Fi to transmit streams to connected smartphones. The quality of the Wi-Fi is directly influencing the service\u2019s quality and performance.   \nQuality of Service is recommended.  Usage of 5 GHz band is recommended.  The recommended limit of number of clients per AP is 50.  \n \nThe term Standalone Mode refers to the MobileConnect Station, not the network infrastructure. MobileConnect does not handle network organization.","12 \nMobileConnect Network Whitepaper \nVersion 1.0"]}
{"question":"What kind of delay or latency can I expect in the audio transmission for iOS devices?  Select the correct answer from A, B, C, D. Only one answer is correct. A) The latency is 50-65ms B) The latency is 50-55s C) The latency is 50-55ms D) The latency is 40-55ms","ground_truth":"C) The latency is 50-55ms","answer":"I don't know.","contexts":["When watching videos from a TV\/PC that supports aptX Low Latency \ncodec, the synchronization of sound to the visual media is automatically \noptimized. This means that the audio remains in sync with the video all \nthe time.\nWhen the transmitter is connected to 2 pairs of headphones, the audio on \nboth headphones will be played in either aptX or standard quality. With \nthis configuration and depending on other factors, such as the models of","sion range of the smartphone, the sound quality deteriorates \nincreasingly until you hear the voice prompt \u201cLost connection\u201d and \nthe connection breaks down completely. If you immediately re-enter \nthe Bluetooth transmission range, the connection is automatically \nre-established.","sion range of the smartphone, the sound quality deteriorates \nincreasingly until you hear the voice prompt \u201cLost connection\u201d and \nthe connection breaks down completely. If you immediately re-enter \nthe Bluetooth transmission range, the connection is automatically \nre-established."]}
{"question":"What is the release date of MobileConnect Manager 1.4.2?","ground_truth":"21.09.2022","answer":"I don't know.","contexts":["MobileConnect Manager 1.4.0\n\n\nMobileConnect Manager 1.3.0\n\n\nMobileConnect Manager 1.2.2\n\n\nMobileConnect Manager 1.2.1\n\n\nMobileConnect Manager 1.2.0\n\n\nMobileConnect Manager 1.1.0\n\n\nMobileConnect Manager 1.0.0\n\n\n\n\n\n\nPrevious Releases Station v2 (2020)\n\n\nMobileConnect Station 7.2.0\n\n\nMobileConnect Station 7.1.0\n\n\nMobileConnect Station 7.0.0\n\n\nMobileConnect Station 6.7.2\n\n\nMobileConnect Station 6.7.1\n\n\nMobileConnect Station 6.7.0\n\n\nMobileConnect Station v2 6.4.1\n\n\nMobileConnect Station v2 6.4.0","MobileConnect Station v2 6.4.1\n\u00c2\u00b6\n\n\nRelease date: 22.08.2022\n\n\nThis is a security release fixing a minor vulnerability. We recommend updating the firmware.\n\n\n\n\n\n\nMobileConnect Station v2 6.4.0\n\u00c2\u00b6\n\n\nRelease date: 2.09.2021\n\n\n\n\nIntroducing an improved way to \naccess and secure the streaming channels\n in Standalone Mode.\n\n\n\n\nThe streaming channels can be accessed by providing a QR code to the app user.\n\n\nThe streaming channels can be secured using a 6 digit \nPIN code\n.","MobileConnect Station 6.7.0\n\u00c2\u00b6\n\n\nRelease date: 5.05.2022\n\n\n\n\nThe \nMobileConnect API\n is now available for Standalone Mode. Use either the dedicated Crestron and Extron plugins or the API directly, in order to automate sharing the channel QR code or PIN code.\n\n\nBugfix for Manager 1.3.0 and Station firmware 6.4.0\/6.7.0, streaming cannot be started.\n\n\nStability improvements for Station - App connection\n\n\n\n\n\n\n\n\nMobileConnect Station v2 6.4.1\n\u00c2\u00b6\n\n\nRelease date: 22.08.2022"]}
{"question":"What is the release date of MobileConnect Station 7.2.0?","ground_truth":"18.01.2024","answer":"The release date of MobileConnect Station 7.2.0 is not explicitly mentioned in the provided context.","contexts":["MobileConnect Manager 1.4.0\n\n\nMobileConnect Manager 1.3.0\n\n\nMobileConnect Manager 1.2.2\n\n\nMobileConnect Manager 1.2.1\n\n\nMobileConnect Manager 1.2.0\n\n\nMobileConnect Manager 1.1.0\n\n\nMobileConnect Manager 1.0.0\n\n\n\n\n\n\nPrevious Releases Station v2 (2020)\n\n\nMobileConnect Station 7.2.0\n\n\nMobileConnect Station 7.1.0\n\n\nMobileConnect Station 7.0.0\n\n\nMobileConnect Station 6.7.2\n\n\nMobileConnect Station 6.7.1\n\n\nMobileConnect Station 6.7.0\n\n\nMobileConnect Station v2 6.4.1\n\n\nMobileConnect Station v2 6.4.0","MobileConnect Station 6.7.0\n\u00c2\u00b6\n\n\nRelease date: 5.05.2022\n\n\n\n\nThe \nMobileConnect API\n is now available for Standalone Mode. Use either the dedicated Crestron and Extron plugins or the API directly, in order to automate sharing the channel QR code or PIN code.\n\n\nBugfix for Manager 1.3.0 and Station firmware 6.4.0\/6.7.0, streaming cannot be started.\n\n\nStability improvements for Station - App connection\n\n\n\n\n\n\n\n\nMobileConnect Station v2 6.4.1\n\u00c2\u00b6\n\n\nRelease date: 22.08.2022","MobileConnect Station 6.7.0\n\n\nMobileConnect Station v2 6.4.1\n\n\nMobileConnect Station v2 6.4.0\n\n\nMobileConnect Station v2 6.3.0\n\n\nMobileConnect Station 6.2.1\n\n\nMobileConnect Station 6.2.0\n\n\nMobileConnect Station 6.1.2\n\n\nMobileConnect Station 6.1.0\n\n\nMobileConnect Station 6.0.7\n\n\nMobileConnect Station 6.0.6\n\n\nMobileConnect Station 6.0.5\n\n\n\n\n\n\nPrevious Releases Station v1\n\n\nMobileConnect Station 6.1.0\n\n\nMobileConnect Station 6.0.6\n\n\nMobileConnect Station 6.0.5\n\n\nRemoved Features"]}
{"question":"What is the battery life of the Bose QuietComfort Earbuds II during continuous playback with ANC on?","ground_truth":"I don't know","answer":"The battery life of the Bose QuietComfort Earbuds II during continuous playback with ANC on is 6 hours.","contexts":["input:\nearbuds (R and L): \n5 V , max. 100 mA\ncharging case: 5 V , max. 1000 mA\noutput:\nearbuds (R and L): none\ncharging case: \n5 V , max. 100 mA x 2 (R and L)\nCharging method via \ncharging case\nUSB charging via USB-C socket: \n5 V , 1000 mA;\nQi wireless charging\nOperating time 6 hrs with rechargeable battery of the \nearbud\n24 hrs with rechargeable battery of \nthe charging case\n(test conditions: smartphone within 1 \nm distance, Bluetooth AAC codec, \nvolume level 50%, ANC activated,","landing.\nThe active noise cancellation ANC can be fully used provided that \nthe rechargeable battery is charged (> 25).\nTo deactivate the Bluetooth wireless connection and activate flight \nmode:\n\u25b7 Press the multi-function button 5x.\nYou hear the voice prompt \u201cNo connection\u201d. The Bluetooth wire-\nless connection is deactivated. \nTo activate the Bluetooth wireless connection again:\nThe Sound Check function of the Smart Control app allows you","able battery for a complete charging cycle without interruption.\nWhen the headphones are being charged, the LED display lights up \n(> 10). Once the headphones are fully charged, the LEDs flash white \nfor approx. 5 minutes and then go off. When the battery charge drops \nto a low level, the voice prompt \u201cRecharge headset\u201d asks you to \nrecharge the headphones. If the headphones are not charged, the \nvoice prompt will be repeated every 10 minutes until the headphones \nswitch off."]}
{"question":"Does the Sony WH-1000XM5 support multi-device Bluetooth pairing, and how many devices can it connect to simultaneously?","ground_truth":"I don't know","answer":"Yes, the Sony WH-1000XM5 supports multi-device Bluetooth pairing, allowing you to connect to two devices simultaneously.","contexts":["Using the earbuds\nMOMENTUM Sport  | 45\nIf you receive a call during audio playback, playback is paused until \nyou end the call or reject the call.\nYou can also accept calls if you are connected to two Bluetooth\ndevices at the same time (multipoint function) (see page > 23). \nExample:\n\u2022 You are listening to music via the playback function of smart-\nphone 1.\n\u2022 You receive a call on smartphone 2.\nYou hear the ring tone in your earbuds.","Device name MOMENTUM 4 (individually adjust-\nable)\nLE-MOMENTUM 4 (Bluetooth Low \nEnergy only)\nNumber of active connec-\ntions\n2","Wireless calling and streaming are only possible in the Bluetooth \ntransmission range of your smartphone. The transmission range \nlargely depends on environmental conditions such as wall thickness, \nwall composition etc. With a free line of sight, the transmission \nrange of most smartphones and Bluetooth devices is up to 10 meters.\nIf you, and therefore the headphones, leave the Bluetooth transmis-\nsion range of the smartphone, the sound quality deteriorates"]}
{"question":"What is the water resistance rating of the Apple AirPods Pro 2?","ground_truth":"I don't know","answer":"The water resistance rating of the Apple AirPods Pro 2 is not explicitly mentioned in the provided context. I don't know.","contexts":["Specifications\nMOMENTUM Sport  | 65\nBluetooth\nTemperature range operation: 0 to +40\u00b0C\ncharging: +5 to +35\u00b0C\nstorage: \u201320 to +60\u00b0C\nRelative humidity operation: 10 to 80%, non condensing\nstorage: 10 to 90%\nMagnetic field strength earbuds: 1.86 mT\ncharging case: 250 mT\nIngress protection of the \nearbuds\nearbuds: IP55\ncharging case: IP54\nWeight earbuds: 6.4 g each (with N-size ring \nand M-size ear tip)\ncharging case: 78.4 g\nboth earbuds and charging case: 91 g","Specifications\n48 | MOMENTUM True Wireless 4\nSpecifications\nMOMENTUM True Wireless 4\nModel: MTW4, MTW4 R, MTW4 L, MTW4 C\nWearing style True Wireless stereo earbuds\nEar coupling ear-canal\nFrequency response 5 Hz to 21 kHz\nTransducer principle dynamic\nTransducer size 7 mm\nSound pressure level (SPL) 107 dB (1 kHz\/1 mW)\nTHD (1 kHz, 94 dB SPL) < 0.08 % (1 kHz\/94 dB)\nNoise cancellation Hybrid Adaptive ANC technology\nMicrophone principle MEMS\nMicrophone frequency \nresponse\n100 Hz to 10 kHz","Specifications\n48 | MOMENTUM True Wireless 4\nSpecifications\nMOMENTUM True Wireless 4\nModel: MTW4, MTW4 R, MTW4 L, MTW4 C\nWearing style True Wireless stereo earbuds\nEar coupling ear-canal\nFrequency response 5 Hz to 21 kHz\nTransducer principle dynamic\nTransducer size 7 mm\nSound pressure level (SPL) 107 dB (1 kHz\/1 mW)\nTHD (1 kHz, 94 dB SPL) < 0.08 % (1 kHz\/94 dB)\nNoise cancellation Hybrid Adaptive ANC technology\nMicrophone principle MEMS\nMicrophone frequency \nresponse\n100 Hz to 10 kHz"]}
