{"question":"What does it mean when the LED display flashes yellow In Accentum Wireless Around Ear Headphones? Select the correct answer from A, B, C, D. Only one answer is correct. A) Battery charge is 0 % to 20 %. B) Battery charge is 90 % to 100 %. C) Battery charge is 20 % to 90 %. D) Headphones are in Bluetooth pairing mode","ground_truth":"C) Battery charge is 20 % to 90 %.","answer":"C) Battery charge is 20 % to 90 %.","contexts":["Product overview\nACCENTUM  |  9\nDuring charging\nOverview of sound signals and voice prompts\nThe headphones output voice prompts and sound signals in case of \nvarious events.\nYou hear short sound signals when the headphones\n\u2022 are switched on or off,\n\u2022 are in pairing mode (melody),\n\u2022 detect devices in the pairing list,\nLED Meaning\nflashes red Battery charge is 0 % to 20 %.\nflashes yellow Battery charge is 20 % to 90 %.\nflashes green Battery charge is 90 % to 100 %.\nlights up green \nfor 5 minutes","display to indicate the charging process.\nR\nUSB-C\nUSB-A\nLED Meaning\nflashes red Battery charge is 0 % to 20 %.\nflashes yellow Battery charge is 20 % to 90 %.\nflashes green Battery charge is 90 % to 100 %. \nlights up green \nfor 5 minutes \nWhen the rechargeable battery is \n100% charged, the LED lights up for \n5 minutes and then goes off.\nYou can speed up the charging process by charging the head-\nphones when they are switched off. \nIf you disconnect the USB connection during or after charging,","devices (headphones and e.g. smartphone) once. This process is \ncalled pairing.\nIf operation differs from the steps mentioned, also refer to the \ninstruction manual of the Bluetooth device you are using.\nLED Meaning\n1 red Rechargeable battery is almost empty \n(less than 2% charged)\n1 white\nRechargeable battery is approx. 2-20% \ncharged \n(>1 hour of playback time)\n2 white\nRechargeable battery is approx. \n20-40% charged \n(>12 hours of playback time)\n3 white\nRechargeable battery is approx.","charged, charging \ncase is less than \n50 % charged.\nCharging case is \ncharged less than \n50 %.\nlights up \nred\nRechargeable bat-\nteries of the earbuds \nand the charging \ncase are almost \nempty.\nRechargeable bat-\ntery of the charging \ncase is almost \nempty.\nflashes \nred\nAt least one earbud \nhas a charging \nerror\/battery error \n(> 44).\nCharging case has a \ncharging error\/bat-\ntery error (> 44).\nIf the LED display does not light up:\n\u2022 Clean the contacts on the earbu ds and in the charging case","charged, charging \ncase is less than \n50 % charged.\nCharging case is \ncharged less than \n50 %.\nlights up \nred\nRechargeable bat-\nteries of the earbuds \nand the charging \ncase are almost \nempty.\nRechargeable bat-\ntery of the charging \ncase is almost \nempty.\nflashes \nred\nAt least one earbud \nhas a charging \nerror\/battery error \n(> 44).\nCharging case has a \ncharging error\/bat-\ntery error (> 44).\nIf the LED display does not light up:\n\u2022 Clean the contacts on the earbu ds and in the charging case"]}
{"question":"Is it possible to setup voice prompt? If yes, how to do that in Accentum Wireless Around Ear Headphones?","ground_truth":"Yes, it is possible. To set up the voice prompts you require the Smart Control App (>18). In the app settings, you can activate voice prompts and sound signals (also the default setting) or deactivate them.","answer":"Yes, it is possible to set up voice prompts on the Accentum Wireless Around Ear Headphones. To activate the voice prompt for muting the microphone during a call, press the main button once. You will hear the voice prompt \"Mute on\" indicating that the microphone is muted. To reactivate the microphone, press the main button again and you will hear the voice prompt \"Mute off.\"","contexts":["Using the headphones\n14  |  ACCENTUM\nConnecting the headphones to a \nBluetooth device\nTo be able to use the Bluetooth connection, you must register both \ndevices (headphones and e.g. smartphone) once. This process is \ncalled pairing.\nIf operation differs from the steps mentioned, also refer to the \ninstruction manual of the Bluetooth device you are using.\nIf you switch on the headphones for the first time (the pairing \nlist is empty), they automatically switch to pairing mode.","Using the headphones\nACCENTUM  |  29\nMuting the microphone \nTo mute the headphones\u2019 microphone during a call:\n\u25b7 Press the main button 1x.\nYou hear the voice prompt \u201cMute on\u201d. The microphone is muted. \nTo activate the microphone again:\n\u25b7 Press the main button 1x.\nYou hear the voice prompt \u201cMute off\u201d. The microphone is reacti-\nvated.\nUsing the Sidetone function\nWhen using the headphones for phone calls, you may find it more \ncomfortable if your own voice is audible in the headphones. With the","Using the headphones\nACCENTUM  |  19\nSwitching the headphones off\n\u25b7 Press the main button for 3 seconds.\nYou hear a sound signal. The LED flashes red 3x. The headphones \nswitch off.\nMake sure that Bluetooth is already activated on your Blue-\ntooth device when switching on the headphones.\nIf Bluetooth is activated and the headphones cannot find a \npaired Bluetooth device within a few minutes, you hear the \nvoice prompt \u201cNo connection\u201d. The LED flashes red 3x. The","Using the headphones\n16  |  ACCENTUM\nPairing the headphones with a Bluetooth \ndevice\n1. Switch the headphones off and place them close to the Bluetooth \ndevice (max. 20 cm).\n2. Press the main button for 3 seconds.\nThe headphones are switched on and you hear a sound signal. \nThe LED lights up white for 5 seconds. \n3. Press the main button for 5 seconds.\nThe headphones switch to pairing mode. The LED flashes alter-\nnately white and red.\n4. Activate Bluetooth on your Bluetooth device.","ACCENTUM\nWireless around-ear headphones\nModel: ACAEBT\nInstruction manual\nUse the search function, the navigation (left) or the following links:\nStart\n\u201cProduct overview\u201d\n\u201cGetting started\u201d\n\u201cUsing the headphones\u201d\n\u201cFAQ\/If a problem occurs ...\u201d\n\u201cSpecifications\u201d\nSonova Consumer Hearing GmbH\nAm Labor 1 \n30900 Wedemark \nGermany\nwww.sennheiser-hearing.com\nVersion: 11\/23 A02"]}
{"question":"When do I replace the ear pads and where can I find the replacement ear pads for Accentum Wireless Around Ear Headphones?","ground_truth":"There is no specific timeframe for ear pad replacement. For hygiene reasons, you should replace your ear pads from time to time. Replacement ear pads are available at www.sennheiser-hearing.com\/accentum-wireless.","answer":"You should replace the ear pads of the Accentum Wireless Around Ear Headphones from time to time for hygiene reasons. Replacement ear pads can be found at www.sennheiser-hearing.com\/accentum-wireless for online purchase or through your local Sonova Consumer Hearing partner.","contexts":["to time. Spare ear pads are available at  \nwww.sennheiser-hearing.com\/accentum-wireless (to purchase \nonline or contact your local Sonova Consumer Hearing partner: \nwww.sennheiser-hearing.com\/service-support)\n\u25b7 Peel the ear pad up and away from the ear cup.\n\u25b7 Assign the right ear pad to the right ear cup and the left ear pad \nto the left ear cup.\n\u25b7 Place the new ear pad onto the ear cup.\n\u25b7 Press the ear pad onto the ear cup so that the ear pad is fixed in \nthe notch of the ear cup.\nCAUTION","Care and maintenance\n34  |  ACCENTUM\nCare and maintenance\n\u25b7 Clean the parts of the product only with a soft, dry cloth.\nTo clean the charging socket:\n\u25b7 Blow vigorously over the charging socket. \n\u25b7 If necessary, carefully remove any stuck dirt from the charging \nsocket using a dry, soft brush or a dry interdental brush. Only \napply gentle pressure when doing so.\nReplacing the ear pads\nFor reasons of hygiene, you should replace your ear pads from time \nto time. Spare ear pads are available at","to time. Spare ear pads are available at \nwww.sennheiser-hearing.com\/momentum-4-wireless (to purchase \nonline or contact your local Sonova Consumer Hearing partner: \nwww.sennheiser-hearing.com\/service-support)\n\u25b7 Grab the ear pad and pull the ear pad including the fastening ring \noff the ear cup.\n\u25b7 Place the new ear pad onto the ear cup. An assignment to the \nright and left side is not necessary.\n\u25b7 Press the new ear pad firmly onto the ear cup all the way around","Using the headphones\nACCENTUM  |  33\nStoring and transporting the headphones\nHandle the headphones with care when you are not using or trans-\nporting them. Store the headphones in a clean, dust-free place out of \nreach of sharp objects.\nCAUTION\nPointed objects can damage the product!\nIf pointed objects pierce the ear pads of the product, the ear pad and \nthe function of the product may be damaged.\n\u25b7 Do not transport the product in your bag together with pointed \nobjects.","Care and maintenance\nMOMENTUM 4  | 37\nCare and maintenance\n\u25b7 Clean the parts of the product only with a soft, dry cloth.\nTo clean the charging socket:\n\u25b7 Blow vigorously over the charging socket. \n\u25b7 If necessary, carefully remove any stuck dirt from the charging \nsocket using a dry, soft brush or a dry interdental brush. Only \napply gentle pressure when doing so.\nReplacing the ear pads\nFor reasons of hygiene, you should replace your ear pads from time \nto time. Spare ear pads are available at"]}
{"question":"What is the charging temperature range of Accentum wireless around ear headphones?","ground_truth":"Between +10 \u00b0C to +40 \u00b0C","answer":"The charging temperature range of Accentum wireless around ear headphones is from +5 to +35 \u00b0C.","contexts":["storage: \u201320 \u00b0C to +60 \u00b0C\nRelative humidity\n(non condensing)\noperation: 10 to 80 %\nstorage: 10 to 90 %\nWeight (headphones) approx. 222 g\nMagnetic field strength 3.00 mT\nVersion Bluetooth 5.2 compliant, class 1\nTransmission frequency 2,402 MHz to 2,480 MHz\nModulation GFSK, \u03c0\/4 DQPSK, 8DPSK\nProfiles A2DP, AVRCP, HFP, HSP, GATT\nOutput power 10 mW (max)\nCodec aptX\u2122 HD, AAC, SBC\nDevice name ACCENTUM (individually adjustable)\nNumber of active connec-\ntions\n2","ACCENTUM\nWireless around-ear headphones\nModel: ACAEBT\nInstruction manual\nUse the search function, the navigation (left) or the following links:\nStart\n\u201cProduct overview\u201d\n\u201cGetting started\u201d\n\u201cUsing the headphones\u201d\n\u201cFAQ\/If a problem occurs ...\u201d\n\u201cSpecifications\u201d\nSonova Consumer Hearing GmbH\nAm Labor 1 \n30900 Wedemark \nGermany\nwww.sennheiser-hearing.com\nVersion: 11\/23 A02","Specifications\nMOMENTUM True Wireless 4  | 49\nBluetooth\nTemperature range operation: 0 to +40 \u00b0C\ncharging: +5 to +35 \u00b0C\nstorage: \u201320 to +60 \u00b0C\nRelative humidity operation: 25 to 75 %, non condensing\nstorage: 10 to 90 %\nMagnetic field strength earbuds: 0.95 mT\ncharging case: 105 mT\nIngress protection of the \nearbuds splash proof (IP54)\nWeight earbuds: approx. 6 g each\ncharging case: approx. 66 g\nboth earbuds and charging case: \napprox. 78 g\nVersion Bluetooth 5.4 certified, class 1","Specifications\nMOMENTUM True Wireless 4  | 49\nBluetooth\nTemperature range operation: 0 to +40 \u00b0C\ncharging: +5 to +35 \u00b0C\nstorage: \u201320 to +60 \u00b0C\nRelative humidity operation: 25 to 75 %, non condensing\nstorage: 10 to 90 %\nMagnetic field strength earbuds: 0.95 mT\ncharging case: 105 mT\nIngress protection of the \nearbuds splash proof (IP54)\nWeight earbuds: approx. 6 g each\ncharging case: approx. 66 g\nboth earbuds and charging case: \napprox. 78 g\nVersion Bluetooth 5.4 certified, class 1","Using the headphones\n12  |  ACCENTUM\nUsing the headphones\nInformation on the rechargeable battery \nand the charging process\nThe headphones have a built-in rechargeable battery. A complete \ncharging cycle takes approx. 3 hours. The charging time can vary \ndepending on the power source used and the ambient temperature. \nBefore using the headphones for the first time, charge the recharge-\nable battery for a complete charging cycle without interruption."]}
{"question":"What is the weight of the Momentum 4 Wireless Around Ear Headphones?","ground_truth":"Approximately 293g.","answer":"The weight of the Momentum 4 Wireless Around Ear Headphones is approximately 293 g.","contexts":["Specifications\nMOMENTUM True Wireless 4  | 49\nBluetooth\nTemperature range operation: 0 to +40 \u00b0C\ncharging: +5 to +35 \u00b0C\nstorage: \u201320 to +60 \u00b0C\nRelative humidity operation: 25 to 75 %, non condensing\nstorage: 10 to 90 %\nMagnetic field strength earbuds: 0.95 mT\ncharging case: 105 mT\nIngress protection of the \nearbuds splash proof (IP54)\nWeight earbuds: approx. 6 g each\ncharging case: approx. 66 g\nboth earbuds and charging case: \napprox. 78 g\nVersion Bluetooth 5.4 certified, class 1","Specifications\nMOMENTUM True Wireless 4  | 49\nBluetooth\nTemperature range operation: 0 to +40 \u00b0C\ncharging: +5 to +35 \u00b0C\nstorage: \u201320 to +60 \u00b0C\nRelative humidity operation: 25 to 75 %, non condensing\nstorage: 10 to 90 %\nMagnetic field strength earbuds: 0.95 mT\ncharging case: 105 mT\nIngress protection of the \nearbuds splash proof (IP54)\nWeight earbuds: approx. 6 g each\ncharging case: approx. 66 g\nboth earbuds and charging case: \napprox. 78 g\nVersion Bluetooth 5.4 certified, class 1","MOMENTUM 4\nWireless around-ear headphones\nModel: M4AEBT\nInstruction manual\nUse the search function, the navigation (left) or the following links:\nStart\n\u201cProduct overview\u201d\n\u201cGetting started\u201d\n\u201cUsing the headphones\u201d\n\u201cFAQ\/If a problem occurs ...\u201d\n\u201cSpecifications\u201d\nSonova Consumer Hearing GmbH\nAm Labor 1\n30900 Wedemark\nGermany\nwww.sennheiser-hearing.com\nVersion: 10\/24 A04","charging: +10\u00b0C to +40\u00b0C\nstorage: \u201320\u00b0C to +60\u00b0C\nRelative humidity\n(non condensing)\noperation: 10 to 80 %\nstorage: 10 to 90 %\nWeight (headphones) approx. 293 g\nMagnetic field strength 6.25 mT\nVersion Bluetooth 5.2 compliant, class 1\nTransmission frequency 2,402 MHz to 2,480 MHz\nModulation GFSK, \u03c0\/4 DQPSK, 8DPSK\nProfiles HFP, AVRCP, A2DP\nOutput power 10 mW (max)\nCodec aptX\u2122 Adaptive, AAC, SBC\nDevice name MOMENTUM 4 (individually adjust-\nable)\nLE-MOMENTUM 4 (Bluetooth Low \nEnergy only)","Product overview\nMOMENTUM 4  | 7\nProduct overview\nMOMENTUM 4\nModel: M4AEBT\nHeadband, steplessly adjustable\nEar cups\nMulti-function button of the headphones:\n\u2022 On\/off button\n\u2022 Voice assistant button\n\u2022 Pairing button: pressing for 5 seconds activates the \nBluetooth pairing mode\nEar pads\nMarking for the right ear (R) and for the left ear (L) \n(inside the ear cups)\nSpeech microphones (4 pcs.) for phone calls\nInput for analog audio cable, 2.5 mm;"]}
{"question":"What is the charging time of the rechargeable battery in Momentum 4 Wireless Around Ear Headphones?","ground_truth":"Approximately 2 hours","answer":"The charging time of the rechargeable battery in Momentum 4 Wireless Around Ear Headphones is approximately 2 hours.","contexts":["Using the headphones\nMOMENTUM 4  | 13\nUsing the headphones\nInformation on the rechargeable battery \nand the charging process\nThe headphones have a built-in rechargeable battery. A complete \ncharging cycle takes approx. 2 hours. The charging time can vary \ndepending on the power source used and the ambient temperature. \nBefore using the headphones for the first time, charge the recharge-\nable battery for a complete charging cycle without interruption.","Using the earbuds\n52 | MOMENTUM Sport\nBattery protection mode\nWhen the battery protection mode is activated, the rechargeable \nbatteries of the earbuds are charged in a particularly protective way \nand only up to a charge level of approx. 80% in order to extend the \nbattery life. The maximum playback time of the earbuds is reduced \naccordingly to approx. 80% of the standard playback time. \nYou can activate the battery protection mode via the Smart Control \napp (see page > 28).\nEco mode","Using the earbuds\n18 | MOMENTUM True Wireless 4\nCharging the rechargeable batteries \nwirelessly\n1. Open the charging case by over coming a slight magnetic resis-\ntance and insert the left earbud into the left charging compart-\nment and the right earbud into the right charging compartment.\nThe earbuds are magnetically pulled into the charging compart-\nments.\n2. Place the bottom of the charging case centered on a wireless \ncharging station (Qi-compatible, to be ordered separately).","Using the earbuds\n18 | MOMENTUM True Wireless 4\nCharging the rechargeable batteries \nwirelessly\n1. Open the charging case by over coming a slight magnetic resis-\ntance and insert the left earbud into the left charging compart-\nment and the right earbud into the right charging compartment.\nThe earbuds are magnetically pulled into the charging compart-\nments.\n2. Place the bottom of the charging case centered on a wireless \ncharging station (Qi-compatible, to be ordered separately).","Using the headphones\n12  |  ACCENTUM\nUsing the headphones\nInformation on the rechargeable battery \nand the charging process\nThe headphones have a built-in rechargeable battery. A complete \ncharging cycle takes approx. 3 hours. The charging time can vary \ndepending on the power source used and the ambient temperature. \nBefore using the headphones for the first time, charge the recharge-\nable battery for a complete charging cycle without interruption."]}
{"question":"What does it mean when the LED display flashes red 3x repeatedly during phone calls in Momentum 4 Wireless Headphones? Select the correct answer from A, B, C, D. Only one answer is correct.  A) Incoming call B) switch off C) Rechargeable battery is almost empty (less than 2% charged) D) incoming call with an almost empty battery.","ground_truth":"D) incoming call with an almost empty battery.","answer":"C) Rechargeable battery is almost empty (less than 2% charged)","contexts":["Product overview\n10 | MOMENTUM 4\nOverview of the LED display\nDuring operation\nDuring phone calls\nDuring charging\nLED Meaning\/headphones...\nwhite \nflashes 3x\n... switch on.\n... are connected to a device via Blue-\ntooth.\nwhite\ncontinuous \nsequence\n... are in Bluetooth pairing mode.\nred \nflashes 3x ... switch off.\nLED Meaning\nwhite \nflashes 3x \nrepeatedly\nIncoming call\nred \nflashes 3x \nrepeatedly\nIncoming call with an almost empty \nbattery\nLED Meaning\n1 red Rechargeable battery is almost empty","Incoming call with an almost empty \nbattery\nLED Meaning\n1 red Rechargeable battery is almost empty\n(less than 2% charged)\n1 white\nRechargeable battery is approx. 2-20% \ncharged \n(>1 hour of playback time)\n2 white\nRechargeable battery is approx. \n20-40% charged \n(>12 hours of playback time)\n3 white\nRechargeable battery is approx. \n40-60% charged \n(>24 hours of playback time)\n4 white\nRechargeable battery is approx \n60-80% charged\n(>36 hours of playback time)\n5 white","(inside the ear cups)\nMicrophones for the active noise cancellation ANC; \n2x directed outward, 2x directed inward (not visible)\nLED Meaning\/headphones...\nwhite\nlights up for \n5 seconds\n... switch on\nwhite \nflashes 3x\n... are connected to a device via Blue-\ntooth\nwhite-red \nflashes ... are in Bluetooth pairing mode\nred \nflashes 3x ... switch off\nLED Meaning\nwhite \nflashes 10x \nrepeatedly\nIncoming call\n3s\nHold\n5 s\n3x\n3x\n10x","Product overview\n10 | MOMENTUM True Wireless 4\nOverview of the LED indications of the \nearbuds\nLED Meaning\nflashes red-blue \nfor approx. \n2m i n u t e s  \nEarbuds are in Bluetooth pairing \nmode.\nflashes blue 3x Bluetooth pairing or earbud pairing \nwas successful.\nflashes red 3x Bluetooth pairing or earbud pairing \nfailed.\nlights up blue Earbuds are connected to a device \nvia Bluetooth.\nlights up red\nEarbuds are not connected to a \ndevice via Bluetooth or the connec-\ntion has been interrupted.","Product overview\n10 | MOMENTUM True Wireless 4\nOverview of the LED indications of the \nearbuds\nLED Meaning\nflashes red-blue \nfor approx. \n2m i n u t e s  \nEarbuds are in Bluetooth pairing \nmode.\nflashes blue 3x Bluetooth pairing or earbud pairing \nwas successful.\nflashes red 3x Bluetooth pairing or earbud pairing \nfailed.\nlights up blue Earbuds are connected to a device \nvia Bluetooth.\nlights up red\nEarbuds are not connected to a \ndevice via Bluetooth or the connec-\ntion has been interrupted."]}
{"question":"What does it mean when the LED display presents 3 white during charging in Momentum 4 wireless around ear headphones? Select the correct answer from A, B, C, D. Only one answer is correct.  A) Incoming call B) switch off C) Rechargeable battery is almost empty (less than 2% charged) D) incoming call with an almost empty battery.","ground_truth":"A) Incoming call","answer":"C) Rechargeable battery is almost empty (less than 2% charged)","contexts":["Product overview\n10 | MOMENTUM 4\nOverview of the LED display\nDuring operation\nDuring phone calls\nDuring charging\nLED Meaning\/headphones...\nwhite \nflashes 3x\n... switch on.\n... are connected to a device via Blue-\ntooth.\nwhite\ncontinuous \nsequence\n... are in Bluetooth pairing mode.\nred \nflashes 3x ... switch off.\nLED Meaning\nwhite \nflashes 3x \nrepeatedly\nIncoming call\nred \nflashes 3x \nrepeatedly\nIncoming call with an almost empty \nbattery\nLED Meaning\n1 red Rechargeable battery is almost empty","Incoming call with an almost empty \nbattery\nLED Meaning\n1 red Rechargeable battery is almost empty\n(less than 2% charged)\n1 white\nRechargeable battery is approx. 2-20% \ncharged \n(>1 hour of playback time)\n2 white\nRechargeable battery is approx. \n20-40% charged \n(>12 hours of playback time)\n3 white\nRechargeable battery is approx. \n40-60% charged \n(>24 hours of playback time)\n4 white\nRechargeable battery is approx \n60-80% charged\n(>36 hours of playback time)\n5 white","display to indicate the charging process.\nR\nUSB-C\nUSB-A\nLED Meaning\nflashes red Battery charge is 0 % to 20 %.\nflashes yellow Battery charge is 20 % to 90 %.\nflashes green Battery charge is 90 % to 100 %. \nlights up green \nfor 5 minutes \nWhen the rechargeable battery is \n100% charged, the LED lights up for \n5 minutes and then goes off.\nYou can speed up the charging process by charging the head-\nphones when they are switched off. \nIf you disconnect the USB connection during or after charging,","power source is connected to the power supply system.\nThe charging process of the headphones begins. The LED display \nindicates the charge status.\nIf the LED display does not light up:\n\u25b7 Clean the charging socket (> 34).\n\u25b7 Charge the rechargeable battery until the LED display lights up \nagain (at least 30 minutes) (> 13). If the rechargeable battery is \ncompletely discharged, it may take several minutes for the LED \ndisplay to indicate the charging process.\nR\nUSB-C\nUSB-A\nLED Meaning","devices (headphones and e.g. smartphone) once. This process is \ncalled pairing.\nIf operation differs from the steps mentioned, also refer to the \ninstruction manual of the Bluetooth device you are using.\nLED Meaning\n1 red Rechargeable battery is almost empty \n(less than 2% charged)\n1 white\nRechargeable battery is approx. 2-20% \ncharged \n(>1 hour of playback time)\n2 white\nRechargeable battery is approx. \n20-40% charged \n(>12 hours of playback time)\n3 white\nRechargeable battery is approx."]}
{"question":"How many audio sources can I connect at the same time to the BTT100 Audio transmitter?","ground_truth":"You can simultaneously connect 2 different sources to the transmitter.","answer":"You can connect two audio sources at the same time to the BTT100 Audio transmitter - one through the digital optical input and the other through the 3.5 mm analog input.","contexts":["BT T100 Bluetooth\u00ae Audio Transmitter | 9 \nGetting started\nConnection to an audio source using the digital optical cable\nTo achieve the best possible listening experience, we recommend that \nyou connect the Bluetooth\u00ae Audio Transmitter to your home cinema or hi-fi \nsystem using the supplied digital optical cable.\nYour Bluetooth\u00ae Audio Transmitter allows digital audio streaming using \nonly PCM audio output from devices connected through the digital optical","10 | BT T100 Bluetooth\u00ae Audio Transmitter\nGetting started\nConnection to an audio source using the 3.5 mm analog audio cable\nSome TV models mute the loudspeakers when you connect the transmitter \nto the headphone socket. Check in the menu of your TV to see if the muting \nfunction can be deactivated. \n X Connect the 3.5 mm plug of the analog audio cable to the Analog input \nof the transmitter. \n X Connect the other end of the analog audio cable to the 3.5 mm \nheadphone socket of the TV or PC.","14 | BT T100 Bluetooth\u00ae Audio Transmitter\nUsing the transmitter\nSelecting an audio input\nIf both the analog and the digital audio input are connected to an audio \nsource, the transmitter allows you to toggle between the two inputs.\nWARNING\nDanger due to high volume levels!\nListening at high volume levels can lead to permanent hearing \ndefects.\n X Before putting the headphones on and before toggling \nbetween your audio inputs, adjust the volume on the","18 | BT T100 Bluetooth\u00ae Audio Transmitter\nTroubleshooting\nTroubleshooting\nProblem Possible cause Possible solution Page\nTransmitter \ncannot be \nswitched on\nUSB power cable is \nnot connected to the \npower source\nCheck the USB power \nconnection.\n11\nNo audio \nsignal\nTransmitter is not \npaired with the \nheadphones\nCheck if the \nheadphones are paired. \nIf necessary, pair the \nheadphones with the \ntransmitter again.\n12\nVolume of the analog \naudio source is either \nset to the minimum \nor is muted","BT T100 Bluetooth\u00ae Audio Transmitter | 11 \nGetting started\nPowering the transmitter\n1. Connect the USB micro B plug of the supplied USB power cable to the \nUSB-B port of the transmitter.\n2. Connect the USB plug to the USB port of your TV or PC. For older TV \nmodels without built-in USB port, connect the USB plug to an external \nUSB power adapter and connect to the power source.\nThe transmitter automatically switches on.\nUSB-B\nPower\nDigital Optical\nIN\nInput\nSelection\nAnalog\n3.5 mm\nIN\nUSB\nPower"]}
{"question":"What happens to the LED light colour when I switch the transmitter on and how do I know whether a connection is established in BTT100 Bluetooth Audio Transmitter?","ground_truth":"The LED lights up red when the transmitter is switched on and once the connection is established, the LED lights up blue.","answer":"When you switch the transmitter on in the BTT100 Bluetooth Audio Transmitter, the LED initially lights up red. Once the connection is established, the LED changes to blue, indicating a successful connection.","contexts":["BT T100 Bluetooth\u00ae Audio Transmitter | 15 \nUsing the transmitter\nConnecting the transmitter to the headphones\/\nearphones\nConnect the headphones\/earphones to the transmitter to watch a movie \nor listen to music from your TV, PC, or home entertainment system. \n1. Switch the paired headphones\/earphones on.\n2. Switch the transmitter on.\nThe LED lights up red. Once the connection is established, the LED \nlights up blue.\nON 2sHold\n1 2\nConnecting the transmitter to a second pair of \nheadphones","BT T100 Bluetooth\u00ae Audio Transmitter | 13 \nUsing the transmitter\nUsing the transmitter\nSwitching the transmitter on\nThe transmitter goes into pairing mode when switched on for the \nfirst time.\n1. Press the Multifunction button for 2 seconds.\nThe LED lights up red. \nON\n2sHold\nSwitching the transmitter off\n1. Press the Multifunction button for 3 seconds.\nThe LED switches off.\nOFF\n3sHold","If you are using headphones of the Sennheiser brand, the headphones\u2019 \nLED usually flashes blue and red during pairing. \n2. Press the the Multifunction button on the transmitter for 4 seconds.\nThe transmitter goes into pairing mode and the LED flashes blue and \nred. If pairing is successful, the LED flashes and then lights up blue for \napproximately 3 minutes.\n21\nOFF\nSet to pairing mode\n4sHold\nPairing\nConnected\n... 3min\nIf no connection is established within 5 minutes, pairing mode is","18 | BT T100 Bluetooth\u00ae Audio Transmitter\nTroubleshooting\nTroubleshooting\nProblem Possible cause Possible solution Page\nTransmitter \ncannot be \nswitched on\nUSB power cable is \nnot connected to the \npower source\nCheck the USB power \nconnection.\n11\nNo audio \nsignal\nTransmitter is not \npaired with the \nheadphones\nCheck if the \nheadphones are paired. \nIf necessary, pair the \nheadphones with the \ntransmitter again.\n12\nVolume of the analog \naudio source is either \nset to the minimum \nor is muted","10 | BT T100 Bluetooth\u00ae Audio Transmitter\nGetting started\nConnection to an audio source using the 3.5 mm analog audio cable\nSome TV models mute the loudspeakers when you connect the transmitter \nto the headphone socket. Check in the menu of your TV to see if the muting \nfunction can be deactivated. \n X Connect the 3.5 mm plug of the analog audio cable to the Analog input \nof the transmitter. \n X Connect the other end of the analog audio cable to the 3.5 mm \nheadphone socket of the TV or PC."]}
{"question":"What is the number of transmission channels in BTT100 Bluetooth Audio Transmitter?","ground_truth":"79","answer":"The number of transmission channels in the BTT100 Bluetooth Audio Transmitter is 79.","contexts":["20 | BT T100 Bluetooth\u00ae Audio Transmitter\nSpecifications\nSpecifications\nBluetooth\u00ae Audio Transmitter \nModel: BT T100\nInputs digital input: optical \nsupported data streams:  \nPCM, 44.1 - 48 kHz\/16 - 24 bit\nanalog input: 3.5 mm stereo jack \nsocket\nInput voltage & current USB power supply via USB micro \nB socket \n5 V\u2393,  500 mA\nNumber of transmission channels 79\nOccupied bandwidth 1 channel 1 MHz\nFrequency response 20 Hz - 20 kHz\nWeight 85 g\nTemperature range operation: 0 to 40\u00b0C (32 to 104\u00b0F)","BT T100 Bluetooth\u00ae Audio Transmitter | 19 \nTroubleshooting\nLeaving the Bluetooth transmission range\nWireless streaming is only possible in the Bluetooth transmission range \nof your Bluetooth devices. The transmission range largely depends on \nenvironmental conditions such as wall thickness, wall composition etc. \nWith a free line of sight, the transmission range of most Bluetooth devices \nis up to 30 meters.\nIf the headphones leave the Bluetooth transmission range of the","12 | BT T100 Bluetooth\u00ae Audio Transmitter\nGetting started\nPairing the transmitter to the headphones\/earphones\nCAUTION\nDanger of malfunction!\nThe transmitted radio waves of Bluetooth devices can impair \nthe operation of sensitive and unprotected devices.\n X Only use Bluetooth devices in locations where wireless \ntransmission is permitted.\nThe transmitter can save the connection profiles of up to eight Bluetooth \nheadphones. If you pair the transmitter to the ninth headphones, the saved","BT T100 Bluetooth\u00ae Audio Transmitter | 7 \nProduct overview\nProduct overview\nOverview of the transmitter (Model: BT T100)\n1 Multifunction button 4 Input Selection switch\n2 LED 5 Digital Optical IN input\n3 Analog 3.5 mm IN input 6 USB micro-B input socket (power)\nUSB-B\nPower\nDigital Optical\nIN\nInput\nSelection\nAnalog\n3.5 mm\nIN\nUSB\nPower\nDigital Optical\nIN\nInput\nSelection\nAnalog\n3.5 mm\nIN\n2\n3\n1\n4 65\nUSB-B\nPower\nDigital Optical\nIN\nInput\nSelection\nAnalog\n3.5 mm\nIN\nUSB\nPower\nDigital Optical\nIN\nInput","BT T100 Bluetooth\u00ae Audio Transmitter | 5 \nThe Bluetooth\u00ae Audio Transmitter\nBluetooth\nThe Bluetooth\u00ae Audio Transmitter complies with the Bluetooth  4.2 standard \nand is compatible with all Bluetooth 1.1, 1.2, 2.0, 2.1, and 3.0 headphones \nwith Advanced Audio Distribution Profile (A2DP) for audio playback.\naptXTM\nWith aptXTM audio coding, you can be assured of crisp, pure and full stereo \nsound. It allows you to not only hear, but experience and feel the audio"]}
{"question":"What is the weight of BTT100 Bluetooth Audio Transmitter?","ground_truth":"85g.","answer":"The weight of the BTT100 Bluetooth Audio Transmitter is 85 g.","contexts":["20 | BT T100 Bluetooth\u00ae Audio Transmitter\nSpecifications\nSpecifications\nBluetooth\u00ae Audio Transmitter \nModel: BT T100\nInputs digital input: optical \nsupported data streams:  \nPCM, 44.1 - 48 kHz\/16 - 24 bit\nanalog input: 3.5 mm stereo jack \nsocket\nInput voltage & current USB power supply via USB micro \nB socket \n5 V\u2393,  500 mA\nNumber of transmission channels 79\nOccupied bandwidth 1 channel 1 MHz\nFrequency response 20 Hz - 20 kHz\nWeight 85 g\nTemperature range operation: 0 to 40\u00b0C (32 to 104\u00b0F)","2 | BT T100 Bluetooth\u00ae Audio Transmitter","BT T100 Bluetooth\u00ae Audio Transmitter | 7 \nProduct overview\nProduct overview\nOverview of the transmitter (Model: BT T100)\n1 Multifunction button 4 Input Selection switch\n2 LED 5 Digital Optical IN input\n3 Analog 3.5 mm IN input 6 USB micro-B input socket (power)\nUSB-B\nPower\nDigital Optical\nIN\nInput\nSelection\nAnalog\n3.5 mm\nIN\nUSB\nPower\nDigital Optical\nIN\nInput\nSelection\nAnalog\n3.5 mm\nIN\n2\n3\n1\n4 65\nUSB-B\nPower\nDigital Optical\nIN\nInput\nSelection\nAnalog\n3.5 mm\nIN\nUSB\nPower\nDigital Optical\nIN\nInput","BT T100 Bluetooth\u00ae Audio Transmitter | 3 \nImportant safety instructions\nIntended use\/Liability\nThe Bluetooth\u00ae Audio Transmitter is suitable for use with hi-fi systems, \nTV sets, PCs, and home cinema systems and supports both analog and \ndigital signals. With this product you can enable a non-Bluetooth-enabled \ndevice to playback audio through Bluetooth wireless headphones.\nIt is considered improper use when this product is used for any application","BT T100 Bluetooth\u00ae Audio Transmitter | 5 \nThe Bluetooth\u00ae Audio Transmitter\nBluetooth\nThe Bluetooth\u00ae Audio Transmitter complies with the Bluetooth  4.2 standard \nand is compatible with all Bluetooth 1.1, 1.2, 2.0, 2.1, and 3.0 headphones \nwith Advanced Audio Distribution Profile (A2DP) for audio playback.\naptXTM\nWith aptXTM audio coding, you can be assured of crisp, pure and full stereo \nsound. It allows you to not only hear, but experience and feel the audio"]}
{"question":"What does green light in momentum sport's charging case LED indicate with earbuds inserted in? Select the correct answer from A, B, C, D. Only one answer is correct.  A) Earbuds are fully charged, charging case can still charge at least one complete cycle. B) Charging case is fully charged. C) Firmware update is being performed. D) Rechargeable battery of the charging case is almost empty.","ground_truth":"A) Earbuds are fully charged, charging case can still charge at least one complete cycle.","answer":"A) Earbuds are fully charged, charging case can still charge at least one complete cycle.","contexts":["Product overview\n10 | MOMENTUM Sport\nCharging case LED Charging case WITH \nearbuds inserted\nCharging case \nWITHOUT earbuds \ninserted \nlights up \ngreen\nEarbuds are fully \ncharged, charging \ncase can still charge \nat least one com-\nplete cycle.\nCharging case is \nfully charged.\npulses \nyellow\nEarbuds are being \ncharged via the \nrechargeable bat-\ntery of the charging \ncase.\n\u2013\nlights up \nyellow\nEarbuds are fully \ncharged, charging \ncase is more than \n10% and less than \n50% charged.\nCharging case is","tery charge status of the charging case.\nIf you close the lid of the charging case, the LED display goes off \nafter 5 seconds.\nCharging case LED Charging case WITH \nearbuds inserted\nCharging case \nWITHOUT earbuds \ninserted \nlights up \ngreen\nEarbuds are fully \ncharged, charging \ncase can still charge \nat least one com-\nplete cycle.\nCharging case is \nfully charged.\npulses \nyellow\nEarbuds are being \ncharged via the \nrechargeable bat-\ntery of the charging \ncase.\n\u2013\nlights up \nyellow","The rechargeable batteries of the earbuds and the charging case \nare being charged.\nIf no earbuds are inserted into the charging case, only the \nrechargeable battery of the charging case is being charged.\nThe LED display of the charging case indicates the charge status:\nLED Charging case WITH \nearbuds inserted\nCharging case \nWITHOUT earbuds \ninserted \npulses \nyellow \nEarbuds and \ncharging case are \nbeing charged.\nCharging case is \nbeing charged.\nlights up \ngreen\nEarbuds and \ncharging case are","The rechargeable batteries of the earbuds and the charging case \nare being charged.\nIf no earbuds are inserted into the charging case, only the \nrechargeable battery of the charging case is being charged.\nThe LED display of the charging case indicates the charge status:\nLED Charging case WITH \nearbuds inserted\nCharging case \nWITHOUT earbuds \ninserted \npulses \nyellow \nEarbuds and \ncharging case are \nbeing charged.\nCharging case is \nbeing charged.\nlights up \ngreen\nEarbuds and \ncharging case are","charging station (Qi-compatible, to be ordered separately). \nThe rechargeable batteries of the earbuds and the charging case \nare being charged.\nIf no earbuds are inserted into the charging case, only the \nrechargeable battery of the charging case is being charged.\nThe LED display of the charging case indicates the charge status:\nLED Charging case WITH \nearbuds inserted\nCharging case \nWITHOUT earbuds \ninserted \npulses \nyellow\nEarbuds and \ncharging case are \nbeing charged.\nCharging case is"]}
{"question":"What does it mean when the Momentum Sport's earbud LED flashes red 3x ? Select the correct answer from A, B, C, D. Only one answer is correct.  A) Rechargeable battery is almost empty. B) Bluetooth pairing or earbud pairing failed. C) System error is present. Perform a reset (see page > 63). D) Bluetooth pairing or earbud pairing was successful.","ground_truth":"B) Bluetooth pairing or earbud pairing failed.","answer":"B) Bluetooth pairing or earbud pairing failed.","contexts":["Earbuds are not connected to a \ndevice via Bluetooth or the connec-\ntion has been interrupted.\nflashes red \nquickly\nRechargeable battery is almost \nempty.\nflashes red \nslowly\nSystem error is present. Perform a \nreset (see page > 63).\nflashes red-\ngreen\nEarbuds are in earbud pairing mode \n(peer pairing mode) to pair the right \nand left earbud.\nflashes green-\npurple\nFirmware update is being per-\nformed.\nflashes red-\npurple (left \nearbud only)\nFirmware update of the sensors is","Product overview\nMOMENTUM Sport  | 11\nOverview of the LED indications of the \nearbuds\nEarbud LED Meaning\nflashes red-blue \nfor approx. \n2m i n u t e s\nEarbuds are in Bluetooth pairing \nmode.\nflashes blue 3x Bluetooth pairing or earbud pairing \nwas successful.\nflashes red 3x Bluetooth pairing or earbud pairing \nfailed.\nlights up blue Earbuds are connected to a device \nvia Bluetooth.\nlights up red\nEarbuds are not connected to a \ndevice via Bluetooth or the connec-\ntion has been interrupted.","Earbuds are not connected to a \ndevice via Bluetooth or the connec-\ntion has been interrupted.\nflashes red \nquickly\nRechargeable battery is almost \nempty.\nflashes red \nslowly\nSystem error is present. Perform a \nreset (> 47).\nflashes red-\ngreen for \napprox. 1 minute \nEarbuds are in earbud pairing mode \n(to pair the right and left earbud).\nWhen you insert the earbuds into your ears, the LEDs of the \nearbuds automatically go off.\nWhen you do not insert the earbuds into your ears, the LEDs of","Earbuds are not connected to a \ndevice via Bluetooth or the connec-\ntion has been interrupted.\nflashes red \nquickly\nRechargeable battery is almost \nempty.\nflashes red \nslowly\nSystem error is present. Perform a \nreset (> 47).\nflashes red-\ngreen for \napprox. 1 minute \nEarbuds are in earbud pairing mode \n(to pair the right and left earbud).\nWhen you insert the earbuds into your ears, the LEDs of the \nearbuds automatically go off.\nWhen you do not insert the earbuds into your ears, the LEDs of","Product overview\n10 | MOMENTUM True Wireless 4\nOverview of the LED indications of the \nearbuds\nLED Meaning\nflashes red-blue \nfor approx. \n2m i n u t e s  \nEarbuds are in Bluetooth pairing \nmode.\nflashes blue 3x Bluetooth pairing or earbud pairing \nwas successful.\nflashes red 3x Bluetooth pairing or earbud pairing \nfailed.\nlights up blue Earbuds are connected to a device \nvia Bluetooth.\nlights up red\nEarbuds are not connected to a \ndevice via Bluetooth or the connec-\ntion has been interrupted."]}
{"question":"What does 'Podcast' voice prompt mean in Momentum Sport?","ground_truth":"Equalizer preset for podcasts is activated (improved speech intelligibility).","answer":"I don't know.","contexts":["Product overview\n14 | MOMENTUM Sport\nNotes on voice prompts\nThe earbuds output voice prompts for events (the table gives some \nexamples). Using the Smart Control app, you can choose between \nvoice prompts and beep sounds, or deactivate the status messages \nwith a few exceptions (e.g. rechargeable battery is empty). \nVoice prompt Meaning\n\u201cPower on\u201d Earbuds are switched on.\n\u201cPower off\u201d Earbuds switch off.\n\u201cConnected\u201d Earbuds are connected via Blue-\ntooth.","Product overview\nMOMENTUM True Wireless 4  | 11\nNotes on voice prompts\nThe earbuds output voice prompts for events (the table gives some \nexamples). Using the Smart Control app, you can change the lan-\nguage of the voice prompts, choose between voice prompts and \nbeep sounds, or deactivate the status messages with a few excep-\ntions (e.g. rechargeable battery is empty). \nVoice prompt Meaning\n\u201cPower on\u201d Earbuds are switched on.\n\u201cPower off\u201d Earbuds switch off.","Product overview\nMOMENTUM True Wireless 4  | 11\nNotes on voice prompts\nThe earbuds output voice prompts for events (the table gives some \nexamples). Using the Smart Control app, you can change the lan-\nguage of the voice prompts, choose between voice prompts and \nbeep sounds, or deactivate the status messages with a few excep-\ntions (e.g. rechargeable battery is empty). \nVoice prompt Meaning\n\u201cPower on\u201d Earbuds are switched on.\n\u201cPower off\u201d Earbuds switch off.","Using the earbuds\n40 | MOMENTUM Sport\nChanging the mode\nTo change the noise settings:\n\u25b7 Briefly tap 3x on the control panel or near the left earbud.\nThe earbuds switch between the modes ANC, Anti-wind and \nTransparency.\nDepending on your selection, you hear the voice prompt \u201cANC\u201d, \n\u201cAnti-wind\u201d or \u201cTransparency\u201d.\nNoise setting Effect Application example\nTranspar-\nency Mode\nAudio playback is mixed with \nambient sounds.\nDuring conversa-\ntions or when moving \nin traffic","Product overview\nMOMENTUM 4  | 11\nOverview of sound signals and voice prompts\nThe headphones output voice prompts and sound signals in case of \nvarious events.\nYou hear short sound signals when the headphones\n\u2022 are switched on or off,\n\u2022 are put on or taken off,\n\u2022 are in pairing mode (melody),\n\u2022 detect devices in the pairing list,\n\u2022 cancel the pairing process,\n\u2022 receive a gesture via the touch pad (increasing the volume, start-\ning\/pausing music playback, accepting\/holding\/rejecting calls,"]}
{"question":"What is Momentum Sport's microphone frequency?","ground_truth":"100 Hz to 10 kHz.","answer":"100 Hz to 10 kHz","contexts":["Specifications\n64 | MOMENTUM Sport\nSpecifications\nMOMENTUM Sport\nModel: MSPORT1, MSPORT1 R, MSPORT1 L, MSPORT1 C\nWearing style True Wireless stereo earbuds\nEar coupling ear canal, semi-open\nFrequency response 15 Hz to 18 kHz\nTransducer principle dynamic\nTransducer size 10 mm\nSound pressure level (SPL) 110 dB (1 kHz\/0 dBFS)\nTHD \n(1 kHz, 94 dB SPL)\n< 0.25% (1 kHz\/94 dB)\nNoise cancellation Hybrid Adaptive ANC technology\nMicrophone principle MEMS\nMicrophone frequency \nresponse\n100 Hz to 10 kHz","Specifications\nMOMENTUM 4  | 41\nSpecifications\nModel: M4AEBT\nBluetooth\nWearing style Bluetooth\u00ae around-ear, closed-back\nEar coupling circum-aural\nTransducer principle dynamic\nTransducer 42 mm\nFrequency response 6 Hz to 22,000 Hz (\u201310 dB)\nSound pressure level (SPL) 106 dB (1 kHz\/0 dBFS)\nTHD (1 kHz, 100 dB SPL) < 0.3 % (1 kHz, 100 dB SPL)\nMicrophone principle MEMS\nMicrophone frequency \nresponse\n80 Hz to 8,000 Hz (\u20133 dB)\nMicrophone pick-up pat-\ntern (speech audio)\n4 omni-directional microphones","Specifications\n48 | MOMENTUM True Wireless 4\nSpecifications\nMOMENTUM True Wireless 4\nModel: MTW4, MTW4 R, MTW4 L, MTW4 C\nWearing style True Wireless stereo earbuds\nEar coupling ear-canal\nFrequency response 5 Hz to 21 kHz\nTransducer principle dynamic\nTransducer size 7 mm\nSound pressure level (SPL) 107 dB (1 kHz\/1 mW)\nTHD (1 kHz, 94 dB SPL) < 0.08 % (1 kHz\/94 dB)\nNoise cancellation Hybrid Adaptive ANC technology\nMicrophone principle MEMS\nMicrophone frequency \nresponse\n100 Hz to 10 kHz","Specifications\n48 | MOMENTUM True Wireless 4\nSpecifications\nMOMENTUM True Wireless 4\nModel: MTW4, MTW4 R, MTW4 L, MTW4 C\nWearing style True Wireless stereo earbuds\nEar coupling ear-canal\nFrequency response 5 Hz to 21 kHz\nTransducer principle dynamic\nTransducer size 7 mm\nSound pressure level (SPL) 107 dB (1 kHz\/1 mW)\nTHD (1 kHz, 94 dB SPL) < 0.08 % (1 kHz\/94 dB)\nNoise cancellation Hybrid Adaptive ANC technology\nMicrophone principle MEMS\nMicrophone frequency \nresponse\n100 Hz to 10 kHz","Product overview\n8 | MOMENTUM Sport\nEarbuds\nModel: MSPORT1 R and MSPORT1 L\nLeft earbud L \nBuilt-in rechargeable battery\nTouch control panel\nTap control sensors\nMicrophones \nfor the active noise cancellation ANC, for the perception of \nyour surroundings (\u201cTransparency Mode\u201d) and for phone \ncalls\nChangeable ear fins \nfor the secure fit of the earbuds in the ears\nChangeable silicone ear tips, \ntransparent for sensor function\nSensors for body temperature measurement and heart rate"]}
{"question":"What is the transducer size in Momentum True Wireless 4 earbuds?","ground_truth":"7mm","answer":"Transducer size in Momentum True Wireless 4 earbuds is 7 mm.","contexts":["Specifications\n48 | MOMENTUM True Wireless 4\nSpecifications\nMOMENTUM True Wireless 4\nModel: MTW4, MTW4 R, MTW4 L, MTW4 C\nWearing style True Wireless stereo earbuds\nEar coupling ear-canal\nFrequency response 5 Hz to 21 kHz\nTransducer principle dynamic\nTransducer size 7 mm\nSound pressure level (SPL) 107 dB (1 kHz\/1 mW)\nTHD (1 kHz, 94 dB SPL) < 0.08 % (1 kHz\/94 dB)\nNoise cancellation Hybrid Adaptive ANC technology\nMicrophone principle MEMS\nMicrophone frequency \nresponse\n100 Hz to 10 kHz","Specifications\n48 | MOMENTUM True Wireless 4\nSpecifications\nMOMENTUM True Wireless 4\nModel: MTW4, MTW4 R, MTW4 L, MTW4 C\nWearing style True Wireless stereo earbuds\nEar coupling ear-canal\nFrequency response 5 Hz to 21 kHz\nTransducer principle dynamic\nTransducer size 7 mm\nSound pressure level (SPL) 107 dB (1 kHz\/1 mW)\nTHD (1 kHz, 94 dB SPL) < 0.08 % (1 kHz\/94 dB)\nNoise cancellation Hybrid Adaptive ANC technology\nMicrophone principle MEMS\nMicrophone frequency \nresponse\n100 Hz to 10 kHz","Specifications\n64 | MOMENTUM Sport\nSpecifications\nMOMENTUM Sport\nModel: MSPORT1, MSPORT1 R, MSPORT1 L, MSPORT1 C\nWearing style True Wireless stereo earbuds\nEar coupling ear canal, semi-open\nFrequency response 15 Hz to 18 kHz\nTransducer principle dynamic\nTransducer size 10 mm\nSound pressure level (SPL) 110 dB (1 kHz\/0 dBFS)\nTHD \n(1 kHz, 94 dB SPL)\n< 0.25% (1 kHz\/94 dB)\nNoise cancellation Hybrid Adaptive ANC technology\nMicrophone principle MEMS\nMicrophone frequency \nresponse\n100 Hz to 10 kHz","Specifications\nMOMENTUM True Wireless 4  | 49\nBluetooth\nTemperature range operation: 0 to +40 \u00b0C\ncharging: +5 to +35 \u00b0C\nstorage: \u201320 to +60 \u00b0C\nRelative humidity operation: 25 to 75 %, non condensing\nstorage: 10 to 90 %\nMagnetic field strength earbuds: 0.95 mT\ncharging case: 105 mT\nIngress protection of the \nearbuds splash proof (IP54)\nWeight earbuds: approx. 6 g each\ncharging case: approx. 66 g\nboth earbuds and charging case: \napprox. 78 g\nVersion Bluetooth 5.4 certified, class 1","Specifications\nMOMENTUM True Wireless 4  | 49\nBluetooth\nTemperature range operation: 0 to +40 \u00b0C\ncharging: +5 to +35 \u00b0C\nstorage: \u201320 to +60 \u00b0C\nRelative humidity operation: 25 to 75 %, non condensing\nstorage: 10 to 90 %\nMagnetic field strength earbuds: 0.95 mT\ncharging case: 105 mT\nIngress protection of the \nearbuds splash proof (IP54)\nWeight earbuds: approx. 6 g each\ncharging case: approx. 66 g\nboth earbuds and charging case: \napprox. 78 g\nVersion Bluetooth 5.4 certified, class 1"]}
{"question":"What should you do to reset MOMENTUM True Wireless 4 earbuds to factory settings?","ground_truth":"To reset, disconnect all Bluetooth connections, place one earbud in the charging case, and hold the touch panel of the other earbud for 15 seconds.","answer":"To reset MOMENTUM True Wireless 4 earbuds to factory settings, you can use the Smart Control app or manually proceed by following the steps provided in the user manual.","contexts":["FAQ\/If a problem occurs ...\nMOMENTUM True Wireless 4  | 47\nResetting the earbuds to the factory default settings\nIf the function of the earbuds is disturbed and a reset (> 46) does not \nimprove, reset the earbuds to the factory default settings. This \ndeletes, among other things, all pairing settings.\nThe easiest way to reset the earbuds to the factory default settings \nis using the Smart Control app.\nAlternatively, you can manually proceed as follows:","FAQ\/If a problem occurs ...\nMOMENTUM True Wireless 4  | 47\nResetting the earbuds to the factory default settings\nIf the function of the earbuds is disturbed and a reset (> 46) does not \nimprove, reset the earbuds to the factory default settings. This \ndeletes, among other things, all pairing settings.\nThe easiest way to reset the earbuds to the factory default settings \nis using the Smart Control app.\nAlternatively, you can manually proceed as follows:","FAQ\/If a problem occurs ...\nMOMENTUM True Wireless 4  | 45\nFAQ\/If a problem occurs ...\nIf a problem has occurred, proceed in the following order until the \nproblem is solved and you can use the earbuds again:\n1. Insert the earbuds into the char ging case and close the lid. Wait\nfor at least 10 seconds (> 46). \n2. Connect the earbuds to the Smart Control app to install the latest\nfirmware (> 44).\n3. Reset the earbuds to the factory default settings (> 47).","FAQ\/If a problem occurs ...\nMOMENTUM True Wireless 4  | 45\nFAQ\/If a problem occurs ...\nIf a problem has occurred, proceed in the following order until the \nproblem is solved and you can use the earbuds again:\n1. Insert the earbuds into the char ging case and close the lid. Wait\nfor at least 10 seconds (> 46). \n2. Connect the earbuds to the Smart Control app to install the latest\nfirmware (> 44).\n3. Reset the earbuds to the factory default settings (> 47).","firmware (> 44).\n3. Reset the earbuds to the factory default settings (> 47).\n4. Check the list of frequently asked questions to see if there is a\nsolution to the problem (> 45).\n5. Contact your Sonova Consumer  Hearing partner to solve the\nproblem (> 45).\nCurrent list of frequently asked questions (FAQ)\nVisit the MOMENTUM True Wireless 4 product page at\nwww.sennheiser-hearing.com\nThere you will find a current list of frequently asked questions (FAQ) \nand suggested solutions."]}
{"question":"How can you switch to Transparency Mode on MOMENTUM True Wireless 4 earbuds?","ground_truth":"To switch to Transparency Mode, tap the touch control panel of the left earbud once.","answer":"To switch to Transparency Mode on MOMENTUM True Wireless 4 earbuds, you can briefly tap 3x on the control panel or near the left earbud. The earbuds will switch between the modes ANC, Anti-wind, and Transparency. Depending on your selection, you will hear the voice prompt \"Transparency.\"","contexts":["Using the earbuds\n32 | MOMENTUM True Wireless 4\nListening to ambient sounds or \nconversations - activating\/deactivating \nthe Transparency Mode\nWith the Transparency Mode activated, you can hear ambient \nsounds or communicate without having to remove the earbuds from \nyour ears. This allows you to hear e.g. announcements in the train or \naircraft or to have short conversations.\nWith the Smart Control app, you can adjust the intensity of the","Using the earbuds\n32 | MOMENTUM True Wireless 4\nListening to ambient sounds or \nconversations - activating\/deactivating \nthe Transparency Mode\nWith the Transparency Mode activated, you can hear ambient \nsounds or communicate without having to remove the earbuds from \nyour ears. This allows you to hear e.g. announcements in the train or \naircraft or to have short conversations.\nWith the Smart Control app, you can adjust the intensity of the","Using the earbuds\nMOMENTUM Sport  | 41\nAdjusting the playback pause in the \nTransparency Mode\nYou can select how audio playback behaves when the Transparency \nMode is activated. To be able to adjust this setting, you require the \nSmart Control app (see page > 28).\n\u25b7 Make sure that the Transparency Mode is activated (see \npage > 39).\n\u25b7 In the Smart Control app, select the desired setting for audio play-\nback in the \u201cNoise settings\u201d area:\n*default setting\nUsing the voice assistant\/voice dialing","Using the earbuds\n40 | MOMENTUM Sport\nChanging the mode\nTo change the noise settings:\n\u25b7 Briefly tap 3x on the control panel or near the left earbud.\nThe earbuds switch between the modes ANC, Anti-wind and \nTransparency.\nDepending on your selection, you hear the voice prompt \u201cANC\u201d, \n\u201cAnti-wind\u201d or \u201cTransparency\u201d.\nNoise setting Effect Application example\nTranspar-\nency Mode\nAudio playback is mixed with \nambient sounds.\nDuring conversa-\ntions or when moving \nin traffic","Product overview\nMOMENTUM True Wireless 4  | 7\nEarbuds\nModel: MTW4 R and MTW4 L\nMicrophones for the active noise cancellation ANC, for the \nperception of your surroundings (\u201cTransparency Mode\u201d) \nand for phone calls\nTouch control panel\nStatus LED\nLeft earbud L \nRight earbud R\nChangeable silicone ear adapters\nInfra-red proximity sensor\nMagnetic holders\nCharging contacts\nBuilt-in rechargeable battery\nChangeable ear fins for a secure fit of the earbuds in the \nears\nA\nE\nH\nI\nC\nB\n0\nG G\nF\nJ\n0\nG\nH\nI\nJ\nG"]}
{"question":"In the scenario 1 in Network whitepaper what is the only component needing active configuration?","ground_truth":"The only component needing active configuration is the SRV-record in the DNS-Server","answer":"The only component needing active configuration in Scenario 1 in the Network whitepaper is the SRV-record in the DNS-Server.","contexts":["Scenarios for network integration Scenario 1 - One port solution  In this scenario, all components (MobileConnect Station, MobileConnect Manager, MobileConnect App clients) are part of the same network. This makes for a very simple setup, light on configuration, as the only component needing active configuration is the SRV-record in the DNS-Server.                 Advantages \u2022 Easy to setup \u2022 No additional hardware\/software needed  Disadvantages \u2022 The server with the MobileConnect Manager is","There are two options for network integration scenarios from a system side:  \nOne port solution  \nIn this scenario, all components (MobileConnect Station, MobileConnect Manager, MobileConnect App clients) are part of the same network. This makes for a very simple setup, light on configuration, as the only component needing active configuration is the SRV-record in the DNS-Server.","Manager Mode supports several network scenarios to adapt to existing networks and lets IT choose the most suitable integration scenario for the respective network architecture.  \nIn this mode, the MobileConnect Station, the MobileConnect Manager and MobileConnect App are the system components.     Considerations  \u00fc Manager value \u00fc Effortless administration \u00fc Automatic Service Discovery via DNS \u2013 Setup effort for Manager and DNS \u2013 IT support required \n Setup Overview","have. \u2022 When using a single network (for more see Scenario 1 - One port solution), you can use the default Docker configuration and it will work out of the box. \u2022 When using two separate networks (for more see Scenario 2 - Two port solution), for security considerations, it is important and strongly recommended, to use a firewall. Otherwise, both - streaming and administration will be accessible through both network interfaces. You will find some small firewall configuration scripts for the","can be conveniently administered and remotely managed from anywhere on the campus.           This whitepaper provides recommendations on how to integrate the MobileConnect system into your existing network. The preferred scenarios are the usage of a single network or two separate networks for streaming and control connections. All scenarios support NAT. The system can be integrated in Eduroam. Select the scenario that fits your network setup best. For more information, also see the"]}
{"question":"Why does the first ruleset disallow all access using IPv6?","ground_truth":"Because MobileConnect Manager is currently only supporting IPv4","answer":"The first ruleset disallows all access using IPv6 because the MobileConnect Manager currently only supports IPv4.","contexts":["expect a global configuration file to be located at \/etc\/mcm-iptables.conf. An example file:            Please note that not every option is used in every ruleset. The first ruleset disallows all access using IPv6, as the MobileConnect Manager is currently only supporting IPv4. Using this ruleset is recommended.","The second ruleset allows to add limitations for the ports used for accessing the MobileConnect Manager web interface and for the interfaces used by the MobileConnect Stations. This increases the maintenance overhead, as it needs all MAC addresses of the MobileConnect Stations and the IP addresses of the systems allowed access to the web interface to be added to the configuration file. Nonetheless this configuration is recommended in the one-port setup. As an alternative to this, have","In this case, the \ufb01rst WSM being registered in the network owns all access rights. In order \nto avoid any collisions, you should deactivate access to the devices for all other WSMs (see \nWithdrawing access rights from a WSM\n).\nIf you should assign \u201cExclusive\u201d access right to several WSMs, then access is \nrandom. The WSM which registers quicker with the device owns all access rights. \nThis can, under certain circumstances, lead to confusion during operation.","11 \nMobileConnect Network Whitepaper \nVersion 1.0 \n You can also add this iptables example in the following simple systemd-service.               It will automatically limit the access at boot-time after docker has established its ruleset. It is dynamically configurable, just save it to \/etc\/systemd\/system\/limit_listerinterface@.service and enable it for an interface with systemctl enable limit_listerinterface@<interfacename>.service.","# This blocks all tcp access except access to port 8000 for the interface PUBLIC_INTERFACE. iptables -I FORWARD -p tcp -i <PUBLIC_INTERFACE> ! --dport 8000 -j REJECT  # example for an interface called eno1, executed in bash iptables -I FORWARD -p tcp -i eno1 \\! --dport 8000 -j REJECT"]}
{"question":"What happens when you activate 'Low Latency' mode on MOMENTUM True Wireless 4 earbuds?","ground_truth":"Activating 'Low Latency' mode minimizes delay between audio and video but may reduce Bluetooth transmission range.","answer":"Activating 'Low Latency' mode on MOMENTUM True Wireless 4 earbuds reduces the delay between audio and video for a more synchronized experience.","contexts":["Using the earbuds\n32 | MOMENTUM True Wireless 4\nListening to ambient sounds or \nconversations - activating\/deactivating \nthe Transparency Mode\nWith the Transparency Mode activated, you can hear ambient \nsounds or communicate without having to remove the earbuds from \nyour ears. This allows you to hear e.g. announcements in the train or \naircraft or to have short conversations.\nWith the Smart Control app, you can adjust the intensity of the","Using the earbuds\n32 | MOMENTUM True Wireless 4\nListening to ambient sounds or \nconversations - activating\/deactivating \nthe Transparency Mode\nWith the Transparency Mode activated, you can hear ambient \nsounds or communicate without having to remove the earbuds from \nyour ears. This allows you to hear e.g. announcements in the train or \naircraft or to have short conversations.\nWith the Smart Control app, you can adjust the intensity of the","Using the earbuds\nMOMENTUM True Wireless 4  | 39\n\u201cLossless Audio\u201d mode\nThe \u201cLossless Audio\u201d mode offers maximum sound quality. The audio \ndata is transmitted uncompressed and bit-accurate in CD quality via \nthe Bluetooth codec aptX\u2122 Lossless, with a sampling frequency of \n44.1 kHz and a sampling depth of 16 bits. \nA correspondingly high-resolution quality of the audio material to be \nplayed back is required.\nIf the \u201cLossless Audio\u201d mode is activated via the Smart Control app,","Using the earbuds\nMOMENTUM True Wireless 4  | 39\n\u201cLossless Audio\u201d mode\nThe \u201cLossless Audio\u201d mode offers maximum sound quality. The audio \ndata is transmitted uncompressed and bit-accurate in CD quality via \nthe Bluetooth codec aptX\u2122 Lossless, with a sampling frequency of \n44.1 kHz and a sampling depth of 16 bits. \nA correspondingly high-resolution quality of the audio material to be \nplayed back is required.\nIf the \u201cLossless Audio\u201d mode is activated via the Smart Control app,","Using the earbuds\nMOMENTUM True Wireless 4  | 31\nActivating\/deactivating the active noise \ncancellation ANC\n\u25b7 Tap the touch control panel of the left earbud 3x.\nThe active noise cancellation ANC is activated or deactivated.\nAdjusting the active noise cancellation \nANC \nTo be able to adjust settings for the active noise cancellation ANC, \nyou require the Smart Control app (> 23).\n\u25b7 In the Smart Control app, select the desired ANC mode:\n*default setting"]}
{"question":"What are the two modes of operation for MobileConnect, and how do they differ?","ground_truth":"The two modes are Standalone Mode and Manager Mode. Standalone Mode is easier to set up with minimal IT support, focusing on audio streaming via QR codes without internet connectivity. Manager Mode offers full functionality with IT infrastructure, DNS setup, and centralized administration.","answer":"The two modes of operation for MobileConnect are Manager Mode and Standalone Mode. Manager Mode focuses on control and management functions, while Standalone Mode simplifies setup and operation for audio streaming.","contexts":["3 \nMobileConnect \u2013 System Modes \n \nSystem  Sennheiser MobileConnect allows streaming live audio content with low latency and in superior quality via WiFi to connected Android and iOS smart devices. To ensure low latency and superior audio quality, unicast is used for streaming.  Application Modes  To adapt to different application scenarios and network environments, MobileConnect can be operated in two Modes: Manager Mode and Standalone Mode.  Mode Differentiation","2 \nMobileConnect \u2013 System Modes","10 \nMobileConnect \u2013 System Modes \n Two port solution  In this scenario there are two separate networks. One is used for the public devices, the other is used for control of the MobileConnect Station and access to the MobileConnect Manager web interface.  \nUsing two separate networks employs a clear separation between streaming and control communication, allowing for a better confinement of the user controlled mobile devices.   Wi-Fi","With Standalone Mode, MobileConnect focuses on its central audio streaming function. After connecting it to a network infrastructure, it is ready to operate. Setup and installation effort are simplified in this mode, only basic IT support is required. All settings and administration are done via the Local Admin Interface. To connect to streams, users have to scan the QR-Code created in the Local Admin Interface.","5 \nMobileConnect \u2013 System Modes \nStandalone Mode  Standalone Mode simplifies the setup of MobileConnect. It enables a flexible solution that is applicable for a wide range of usage scenarios."]}
{"question":"What is required for using MobileConnect in Standalone Mode?","ground_truth":"An enterprise-grade router, access point(s), and a local network with DHCP enabled are required. Streams are accessed using QR codes.","answer":"For using MobileConnect in Standalone Mode, you need a Wi-Fi network for transmission, an Enterprise Grade Router, Enterprise Grade Access Point(s), and a minimum MobileConnect App version of 6.2.x for automatic channel discovery via mDNS.","contexts":["With Standalone Mode, MobileConnect focuses on its central audio streaming function. After connecting it to a network infrastructure, it is ready to operate. Setup and installation effort are simplified in this mode, only basic IT support is required. All settings and administration are done via the Local Admin Interface. To connect to streams, users have to scan the QR-Code created in the Local Admin Interface.","In this mode, the MobileConnect Station and MobileConnect App are the system components.   Considerations  \n\u00fc Ease of installation \u00fc Limited IT support required \u2013 Manager functionalities not available \u2013 Streams can only be accessed via QR-Code   \nSetup Overview  Setting up MobileConnect in Standalone Mode requires the following steps: \n The target application for Standalone Mode is the equipment of a single room (or multiple single rooms) with live audio streams.","MobileConnect Station 7.1.0\n\u00c2\u00b6\n\n\nAutomatic Channel Discovery for Standalone Mode (mDNS)\n\n\nThis major firmware release brings an important Manager Mode feature to your Standalone system: the automatic channel discovery via mDNS.\nUsing mDNS will allow your app users to view and enter audio channels without the need for scanning any QR code. Of course, you can hide and PIN secure all your audio channels for extra security.\nUsing mDNS requires a minimum MobileConnect App version of 6.2.x.","6 \nMobileConnect \u2013 System Modes \nHardware  Minimum hardware requirements  \nI Enterprise Grade Router  II Enterprise Grade Access Point(s)  Network  For Standalone Mode, a Wi-Fi network is required for transmission. Usage of an existing network infrastructure as well as the setup of a dedicated infrastructure is possible.   \nThe data load is 165 kbps per unique client connection.  DHCP is required.  Internet connectivity","5 \nMobileConnect \u2013 System Modes \nStandalone Mode  Standalone Mode simplifies the setup of MobileConnect. It enables a flexible solution that is applicable for a wide range of usage scenarios."]}
{"question":"How does MobileConnect handle data load per client in Standalone Mode?","ground_truth":"The data load is 165 kbps per unique client connection.","answer":"The data load per unique client connection in Standalone Mode for MobileConnect is 165 kbps.","contexts":["6 \nMobileConnect \u2013 System Modes \nHardware  Minimum hardware requirements  \nI Enterprise Grade Router  II Enterprise Grade Access Point(s)  Network  For Standalone Mode, a Wi-Fi network is required for transmission. Usage of an existing network infrastructure as well as the setup of a dedicated infrastructure is possible.   \nThe data load is 165 kbps per unique client connection.  DHCP is required.  Internet connectivity","Wi-Fi  \nMobileConnect relies on Wi-Fi to transmit streams to connected smartphones. The quality of the Wi-Fi is directly influencing the service\u2019s quality and performance.   \nQuality of Service is recommended.  Usage of 5 GHz band is recommended.  The recommended limit of number of clients per AP is 50.  \n \nThe term Standalone Mode refers to the MobileConnect Station, not the network infrastructure. MobileConnect does not handle network organization.","With Standalone Mode, MobileConnect focuses on its central audio streaming function. After connecting it to a network infrastructure, it is ready to operate. Setup and installation effort are simplified in this mode, only basic IT support is required. All settings and administration are done via the Local Admin Interface. To connect to streams, users have to scan the QR-Code created in the Local Admin Interface.","In this mode, the MobileConnect Station and MobileConnect App are the system components.   Considerations  \n\u00fc Ease of installation \u00fc Limited IT support required \u2013 Manager functionalities not available \u2013 Streams can only be accessed via QR-Code   \nSetup Overview  Setting up MobileConnect in Standalone Mode requires the following steps: \n The target application for Standalone Mode is the equipment of a single room (or multiple single rooms) with live audio streams.","Configuration & Access Control  Configuration  In Standalone Mode, all setup and configuration are done using the Local Admin Interface.  With the Local Admin Interface, the following features can be configured:  MobileConnect App \u2022 Rename channels. \u2022 View\/Change\/Download QR codes and Channel IDs for your streaming channels.  MobileConnect Station \u2022 Set Station audio configuration. \u2022 Configure Station network interfaces. \u2022 Update Station software. \u2022 Reset Station. \u2022 Reboot Station. \u2022"]}
{"question":"What network recommendation is critical for using MobileConnect?","ground_truth":"The use of the 5 GHz Wi-Fi band is recommended for better performance and reduced interference.","answer":"Using the same Wi-Fi network for MobileConnect is highly recommended to avoid interference and ensure quality of service.","contexts":["If a Wi-Fi network is existing, it is highly recommended to use the same network for MobileConnect. Adding an additional Wi-Fi network will likely cause interference and lower the quality of service. Additionally, usage of a separate network worsens user experiences because it forces users to decide between MobileConnect and the other network\u2019s functionality.  Quality of Service is recommended.  Usage of 5 GHz band is recommended.  It is recommended to make 12 Mbps the lowest mandatory data","Wi-Fi  \nMobileConnect relies on Wi-Fi to transmit streams to connected smartphones. The quality of the Wi-Fi is directly influencing the service\u2019s quality and performance.   \nQuality of Service is recommended.  Usage of 5 GHz band is recommended.  The recommended limit of number of clients per AP is 50.  \n \nThe term Standalone Mode refers to the MobileConnect Station, not the network infrastructure. MobileConnect does not handle network organization.","can be conveniently administered and remotely managed from anywhere on the campus.           This whitepaper provides recommendations on how to integrate the MobileConnect system into your existing network. The preferred scenarios are the usage of a single network or two separate networks for streaming and control connections. All scenarios support NAT. The system can be integrated in Eduroam. Select the scenario that fits your network setup best. For more information, also see the","The following latency can be expected with the system:\n\n\n\n\nOn iOS devices the latency is \n50-55ms\n\n\nOn mid-range to high-end Android devices (Wifi 5\/ac & Android Version >9) the latency is \n50-65ms\n\n\n\n\n\n\n\n\nWhich smartphones are recommended to use with MobileConnect?\n\u00c2\u00b6\n\n\nIn terms of Android we recommend to use mid-range or high-end devices that support Android Version >9 and WiFi ac.\nFor iOS we recommend all devices that support iOS version >13.","The quality of the offered service depends on the network and Wi-Fi infrastructure. It has to fulfil a minimum of requirements for MobileConnect. It is important to check network suitability prior to the integration."]}
{"question":"What firmware version is required for using the Digital 6000 series with WSM?","ground_truth":"The required firmware version for the EM 6000 is 3.2.1, and for the L 6000, it is 3.0.1.","answer":"The required firmware version for using the Digital 6000 series with WSM is 3.2.1 or higher.","contexts":["| 2 - WSM (Wireless Systems Manager)\nCompatible Sennheiser products\nThe following Sennheiser systems can be con\ufb01gured using the WSM:\nOnly transmitters and receivers that are equipped with the same compander \nsystem can be combined with each other.\nDigital 9000\n\u2022 Required Firmware Version (or higher): 4.0.1\nDigital 6000\n\u2022 EM 6000\n\u2022 Required Firmware Version (or higher): 3.2.1\n\u2022 L 6000\n\u2022 Required Firmware Version (or higher): 3.0.1\nEW-DX\n\u2022 EW-DX EM 2\n\u2022 Required Firmware Version (or higher): 2.0.1","| 2 - WSM (Wireless Systems Manager)\new 300 G4\n\u2022 Required Firmware Version (or higher): 1.2.0.1\new 500 G4\n\u2022 Required Firmware Version (or higher): 1.2.0.1\new IEM G4\n\u2022 Required Firmware Version (or higher): 1.2.0.1\new 300 G3\n\u2022 Required Firmware Version (or higher): 1.8.0\new 500 G3\n\u2022 Required Firmware Version (or higher): 1.8.0\new 300 G3 IEM\n\u2022 Required Firmware Version (or higher): 1.8.0\n8","EW-DX\n\u2022 EW-DX EM 2\n\u2022 Required Firmware Version (or higher): 2.0.1\n\u2022 EW-DX EM 2 DANTE\n\u2022 Required Firmware Version (or higher): 2.0.1\n\u2022 EW-DX EM 4 DANTE\n\u2022 Required Firmware Version (or higher): 2.0.1\nEM 373x (COM) + EM 373x-II (COM)\n\u2022 Required Firmware Version (or higher): 2.2.0\n\u2022 Required Firmware Version (or higher): 1.8.1\n\u2022 Required Firmware Version (or higher): 1.8.1\n7","| 2 - WSM (Wireless Systems Manager)\nSystem requirements\nThe WSM software runs on the following operating systems:\nWindows\nWindows 10 (32 Bit\/64 Bit)\nWindows 11 (32 Bit\/64 Bit)\n8 GB RAM\nMac\nmacOS 13 Ventura\nmacOS 14 Sonoma\n8 GB RAM\n9","| 4 - Working with the software\nDownloading the latest \ufb01rmware update from the Internet\nSennheiser is continuously improving the WSM software.\nSelect the current \ufb01rmware package (SENNPKG \ufb01le) on the Sennheiser website at \nsennheiser.com\/wsm  and start the download.\nClick on \u201cOpen\u201d.\nThe \ufb01le is automatically saved in the \u201cNew Releases\u201d subfolder of the program \nfolder. If this folder already contains a \ufb01le, this \ufb01le is moved to the \u201cArchive\u201d \nfolder.\n48"]}
{"question":"What operating systems are compatible with the WSM software?","ground_truth":"WSM is compatible with Windows 10\/11 (32\/64-bit) and macOS 13 Ventura and macOS 14 Sonoma, with a minimum of 8 GB RAM.","answer":"The WSM software is compatible with the following operating systems:\n- Windows 10 (32 Bit\/64 Bit)\n- Windows 11 (32 Bit\/64 Bit)\n- macOS 13 Ventura\n- macOS 14 Sonoma","contexts":["| 2 - WSM (Wireless Systems Manager)\nSystem requirements\nThe WSM software runs on the following operating systems:\nWindows\nWindows 10 (32 Bit\/64 Bit)\nWindows 11 (32 Bit\/64 Bit)\n8 GB RAM\nMac\nmacOS 13 Ventura\nmacOS 14 Sonoma\n8 GB RAM\n9","Wireless Systems Manager\n5. Troubleshooting\nThe most frequent questions and answers summarized in a chapter.\nFrequently asked questions\nIf a problem occurs\nGlossar\nFrequently asked questions\nWhich Sennheiser hardware is compatible to WSM Software?\nCompatible Sennheiser products\nWhich third party spectrum scans are supported?\nWSM supports the following frequency scans\n\u2022 Rohde & Schwarz FSH\/FPH (*.csv)\n\u2022 RF Explorer (*.csv)\n\u2022 Tektronix RSA (*.csv)\n\u2022 Aim TTi (*.csv)","| 2 - WSM (Wireless Systems Manager)\nCompatible Sennheiser products\nThe following Sennheiser systems can be con\ufb01gured using the WSM:\nOnly transmitters and receivers that are equipped with the same compander \nsystem can be combined with each other.\nDigital 9000\n\u2022 Required Firmware Version (or higher): 4.0.1\nDigital 6000\n\u2022 EM 6000\n\u2022 Required Firmware Version (or higher): 3.2.1\n\u2022 L 6000\n\u2022 Required Firmware Version (or higher): 3.0.1\nEW-DX\n\u2022 EW-DX EM 2\n\u2022 Required Firmware Version (or higher): 2.0.1","Wireless Systems Manager\n2. WSM (Wireless Systems Manager)\nInformation about supported devices and compatible Sennheiser products.\nImportant information\nCompatible Sennheiser products\nSystem requirements\nImportant information\nAdditional information on the Wireless Systems Manager software can be found at \nsennheiser.com\/wsm\n.\nAdditional information on the transmitters and receivers can be found in the individual \ninstruction manuals on the product pages at \nsennheiser.com\/download.","| 3 - Getting started\/setting up\nAdding devices to the list\nClick on \u201cApplications\u201d > \u201cDevice con\ufb01guration\u201d.\nThe window contains two lists. The left-hand list displays all WSM compatible \ndevices. The right-hand list displays your current device selection.\nIn the left-hand list, click on a receiver or a transmitter (IEM).\nClick on \u201c>>\u201d.\nThe selected receiver or transmitter (IEM) appears in the right-hand list and is \nincluded in the system. Add any number of devices to your system."]}
{"question":"What hardware is required for setting up MobileConnect in Standalone Mode?","ground_truth":"The hardware requirements include an enterprise-grade router, enterprise-grade access points, Server for MobileConnect Manager installation, A device providing DNS \/ DHCP in the network.","answer":"Enterprise Grade Router and Enterprise Grade Access Point(s) are required for setting up MobileConnect in Standalone Mode.","contexts":["6 \nMobileConnect \u2013 System Modes \nHardware  Minimum hardware requirements  \nI Enterprise Grade Router  II Enterprise Grade Access Point(s)  Network  For Standalone Mode, a Wi-Fi network is required for transmission. Usage of an existing network infrastructure as well as the setup of a dedicated infrastructure is possible.   \nThe data load is 165 kbps per unique client connection.  DHCP is required.  Internet connectivity","In this mode, the MobileConnect Station and MobileConnect App are the system components.   Considerations  \n\u00fc Ease of installation \u00fc Limited IT support required \u2013 Manager functionalities not available \u2013 Streams can only be accessed via QR-Code   \nSetup Overview  Setting up MobileConnect in Standalone Mode requires the following steps: \n The target application for Standalone Mode is the equipment of a single room (or multiple single rooms) with live audio streams.","With Standalone Mode, MobileConnect focuses on its central audio streaming function. After connecting it to a network infrastructure, it is ready to operate. Setup and installation effort are simplified in this mode, only basic IT support is required. All settings and administration are done via the Local Admin Interface. To connect to streams, users have to scan the QR-Code created in the Local Admin Interface.","MobileConnect Station 7.1.0\n\u00c2\u00b6\n\n\nAutomatic Channel Discovery for Standalone Mode (mDNS)\n\n\nThis major firmware release brings an important Manager Mode feature to your Standalone system: the automatic channel discovery via mDNS.\nUsing mDNS will allow your app users to view and enter audio channels without the need for scanning any QR code. Of course, you can hide and PIN secure all your audio channels for extra security.\nUsing mDNS requires a minimum MobileConnect App version of 6.2.x.","5 \nMobileConnect \u2013 System Modes \nStandalone Mode  Standalone Mode simplifies the setup of MobileConnect. It enables a flexible solution that is applicable for a wide range of usage scenarios."]}
{"question":"What is the recommended Wi-Fi configuration for optimal performance of MobileConnect?","ground_truth":"It is recommended to use the 5 GHz band with a Quality of Service configuration. Each access point should ideally support a maximum of 50 clients, with a minimum data rate of 12 Mbps.","answer":"Quality of Service is recommended for optimal performance of MobileConnect. Usage of the 5 GHz band is recommended. The recommended limit of clients per AP is 50.","contexts":["Wi-Fi  \nMobileConnect relies on Wi-Fi to transmit streams to connected smartphones. The quality of the Wi-Fi is directly influencing the service\u2019s quality and performance.   \nQuality of Service is recommended.  Usage of 5 GHz band is recommended.  The recommended limit of number of clients per AP is 50.  \n \nThe term Standalone Mode refers to the MobileConnect Station, not the network infrastructure. MobileConnect does not handle network organization.","If a Wi-Fi network is existing, it is highly recommended to use the same network for MobileConnect. Adding an additional Wi-Fi network will likely cause interference and lower the quality of service. Additionally, usage of a separate network worsens user experiences because it forces users to decide between MobileConnect and the other network\u2019s functionality.  Quality of Service is recommended.  Usage of 5 GHz band is recommended.  It is recommended to make 12 Mbps the lowest mandatory data","MobileConnect relies on Wi-Fi to transmit streams to connected smartphones. The quality of the Wi-Fi is directly influencing the quality and performance of service.","The following latency can be expected with the system:\n\n\n\n\nOn iOS devices the latency is \n50-55ms\n\n\nOn mid-range to high-end Android devices (Wifi 5\/ac & Android Version >9) the latency is \n50-65ms\n\n\n\n\n\n\n\n\nWhich smartphones are recommended to use with MobileConnect?\n\u00c2\u00b6\n\n\nIn terms of Android we recommend to use mid-range or high-end devices that support Android Version >9 and WiFi ac.\nFor iOS we recommend all devices that support iOS version >13.","6 \nMobileConnect \u2013 System Modes \nHardware  Minimum hardware requirements  \nI Enterprise Grade Router  II Enterprise Grade Access Point(s)  Network  For Standalone Mode, a Wi-Fi network is required for transmission. Usage of an existing network infrastructure as well as the setup of a dedicated infrastructure is possible.   \nThe data load is 165 kbps per unique client connection.  DHCP is required.  Internet connectivity"]}
{"question":"What kind of delay or latency can I expect in the audio transmission for iOS devices?  Select the correct answer from A, B, C, D. Only one answer is correct. A) The latency is 50-65ms B) The latency is 50-55s C) The latency is 50-55ms D) The latency is 40-55ms","ground_truth":"C) The latency is 50-55ms","answer":"The latency is 50-55ms (C)","contexts":["The following latency can be expected with the system:\n\n\n\n\nOn iOS devices the latency is \n50-55ms\n\n\nOn mid-range to high-end Android devices (Wifi 5\/ac & Android Version >9) the latency is \n50-65ms\n\n\n\n\n\n\n\n\nWhich smartphones are recommended to use with MobileConnect?\n\u00c2\u00b6\n\n\nIn terms of Android we recommend to use mid-range or high-end devices that support Android Version >9 and WiFi ac.\nFor iOS we recommend all devices that support iOS version >13.","scanning a specific channel QR-Code\n\n\ntyping in manually a channel ID\n\n\n\n\nLastly, the end-user can listen to the audio stream over wired headphones that are connected to the smartphone. It is also possible to listen directly over the hearing aids or the cochlea implant in T-Position with the combination of an induction neck loop that is connected to the smartphone.\n\n\n\n\n\n\n\n\nIs there a delay\/latency in the audio transmission?\n\u00c2\u00b6\n\n\nThe following latency can be expected with the system:","Is there a delay\/latency in the audio transmission?\n\n\nWhich smartphones are recommended to use with MobileConnect?\n\n\nWhich headphones do you recommend, and which induction neck loop do you recommend?\n\n\nIs it also possible to use headphones or hearing aids connected via Bluetooth?\n\n\nWhat if the smartphone does not provide a 3.5 mm headphone jack?\n\n\nCan I customize the app with my own logo or color?\n\n\nIs there an SDK (Software Development Kit) for implementation into my own app available?","MobileConnect is made for streaming live audio to mobile devices at lowest possible audio delay. In some cases, it might be beneficial to adjust the target latency to a specific value. With this release you can now set a manual latency value, for example when transmitting audio of an interpreter or a TV.\n\n\n\n\n\n\n\n\nMobileConnect Station 7.2.1\n\u00c2\u00b6\n\n\nRelease date: 15.07.2024\n\n\nThis is a security release fixing a severe vulnerability. We recommend all users to update the firmware.","MobileConnect is made for streaming live audio to mobile devices at lowest possible audio delay. In some cases, it might be beneficial to adjust the target latency to a specific value. With this release you can now set a manual latency value, for example when transmitting audio of an interpreter or a TV.\n\n\n\n\n\n\n\n\nMobileConnect Station 7.1.0\n\u00c2\u00b6\n\n\nAutomatic Channel Discovery for Standalone Mode (mDNS)"]}
{"question":"What is the release date of MobileConnect Manager 1.4.2?","ground_truth":"21.09.2022","answer":"I don't know.","contexts":["MobileConnect Manager 1.2.0\n\u00c2\u00b6\n\n\nRelease date: 24.09.2020\n\n\n\n\nImproved access to your MobileConnect Manager with support for \nmultiple members\n:\n\n\n\n\n\n\nNew owner, admin and moderator roles.\n\n\nEasy access management: control who can view and edit your MobileConnect network and audio configuration.\n\n\nFor more see the MobileConnect user guide.\n\n\n\n\n\n\n\n\nIncreased \nsecurity\n between MobileConnect Manager and Station; Station authorization\/rejection.","MobileConnect Manager 1.4.0\n\u00c2\u00b6\n\n\nRelease date: 2.09.2021\n\n\n\n\nIntroducing an improved way to \naccess and secure the streaming channels\n.\n\n\n\n\nThe streaming channels can be accessed using automatic discovery or by providing a QR code or Channel ID to the app user.\n\n\nThe streaming channels can be secured using a 6 digit \nPIN code\n.\n\n\nThe channel access methods and PIN code can be combined or used separately as you see fit.","Bugfixes and stability improvements.\n\n\n\n\n\n\n\n\nMobileConnect Manager 1.3.0\n\u00c2\u00b6\n\n\nRelease date: 28.04.2021\n\n\n\n\nWith the introduction of the \nMobileConnect API\n we offer you a new way to implement your own workflows via REST for digital signage.\n\n\n\n\n\n\nDisplay MobileConnect QR codes on digital room signage displays to help users find the MobileConnect streaming channel.","This is a hotfix release that enables the ADAT inputs for the MobileConnect Station 1 again.\n\n\nAfter updating, please turn off your MobileConnect Station v1, remove it via the MobileConnect Manager\u00e2\u0080\u0099s \u00e2\u0080\u0098Remove\u00e2\u0080\u0099 button and restart the hardware. We apologise for any inconvenience caused!\n\n\n\n\n\n\nMobileConnect Manager 1.4.1\n\u00c2\u00b6\n\n\nRelease date: 1.03.2022\n\n\n\n\nBugfix for retaining the channel configuration when updating from Manager version 1.2.2.\n\n\n\n\n\n\n\n\nMobileConnect Manager 1.4.0\n\u00c2\u00b6","MobileConnect Station 7.0.0\n\u00c2\u00b6\n\n\nRelease date: 08.03.2023\n\n\nThis major firmware release completes the feature set of the Manager 2.0.0 release:\n\n\n\n\nIt allows for using the brand new Audience Mic feature\n\n\nYour MobileConnect Station v2 can now also support IPv6 (needs to be enabled via local admin interface)\n\n\nChanging PIN codes of audio channels doesn\u00e2\u0080\u0099t change their QR codes any longer"]}
{"question":"What is the release date of MobileConnect Station 7.2.0?","ground_truth":"18.01.2024","answer":"The release date of MobileConnect Station 7.2.0 is 18.01.2024.","contexts":["It is now possible to hide streaming channels or share them via QR or numeric code.\n\n\n\n\n\n\n\n\n\n\nPrevious Releases Station v2 (2020)\n\u00c2\u00b6\n\n\n\n\nMobileConnect Station 7.2.0\n\u00c2\u00b6\n\n\nRelease date: 18.01.2024\n\n\nThis firmware release is required to support the above MobileConnect Manager 2.1.0 features. It also brings the following features to Standalone Mode:\n\n\n\n\nAudience Mic users can now queue up, allowing a smoother user experience for those who want to participate in vivid discussions.","MobileConnect Station 7.0.0\n\u00c2\u00b6\n\n\nRelease date: 08.03.2023\n\n\nThis major firmware release completes the feature set of the Manager 2.0.0 release:\n\n\n\n\nIt allows for using the brand new Audience Mic feature\n\n\nYour MobileConnect Station v2 can now also support IPv6 (needs to be enabled via local admin interface)\n\n\nChanging PIN codes of audio channels doesn\u00e2\u0080\u0099t change their QR codes any longer","MobileConnect Station 6.7.0\n\u00c2\u00b6\n\n\nRelease date: 5.05.2022\n\n\n\n\nThe \nMobileConnect API\n is now available for Standalone Mode. Use either the dedicated Crestron and Extron plugins or the API directly, in order to automate sharing the channel QR code or PIN code.\n\n\nBugfix for Manager 1.3.0 and Station firmware 6.4.0\/6.7.0, streaming cannot be started.\n\n\nStability improvements for Station - App connection\n\n\n\n\n\n\n\n\nMobileConnect Station v2 6.4.1\n\u00c2\u00b6\n\n\nRelease date: 22.08.2022","Improved error notifications.\n\n\nBugfixes.\n\n\nThis version is compatible with Manager 1.2.0 and higher. For more information see \nMobileConnect Manager and Station compatibility\n.\n\n\n\n\n\n\n\n\nMobileConnect Station 6.0.7\n\u00c2\u00b6\n\n\nRelease date: 24.08.2020\n\n\n\n\nBugfixes, MobileConnect Station v2 only.\n\n\n\n\n\n\n\n\nMobileConnect Station 6.0.6\n\u00c2\u00b6\n\n\nRelease date: 18.05.2020\n\n\n\n\nDeleting and rebooting of a MobileConnect Station.\n\n\nImproved error notifications.\n\n\nBugfixes.\n\n\n\n\n\n\n\n\nMobileConnect Station 6.0.5\n\u00c2\u00b6","MobileConnect is made for streaming live audio to mobile devices at lowest possible audio delay. In some cases, it might be beneficial to adjust the target latency to a specific value. With this release you can now set a manual latency value, for example when transmitting audio of an interpreter or a TV.\n\n\n\n\n\n\n\n\nMobileConnect Station 7.2.1\n\u00c2\u00b6\n\n\nRelease date: 15.07.2024\n\n\nThis is a security release fixing a severe vulnerability. We recommend all users to update the firmware."]}
{"question":"What is the battery life of the Bose QuietComfort Earbuds II during continuous playback with ANC on?","ground_truth":"I don't know","answer":"I don't know.","contexts":["and only up to a charge level of approx. 80 % in order to extend the \nbattery life. The maximum playback time of the earbuds is reduced \naccordingly to approx. 80 % of the standard playback time. \nYou can activate the battery protection mode via the Smart Control \napp (> 23).\nEco mode\nEco mode maximizes the playback time of your earbuds by optimiz-\ning energy consumption and can be activated via the Smart Control \napp (> 23). This mode can only be used with devices that support","and only up to a charge level of approx. 80 % in order to extend the \nbattery life. The maximum playback time of the earbuds is reduced \naccordingly to approx. 80 % of the standard playback time. \nYou can activate the battery protection mode via the Smart Control \napp (> 23).\nEco mode\nEco mode maximizes the playback time of your earbuds by optimiz-\ning energy consumption and can be activated via the Smart Control \napp (> 23). This mode can only be used with devices that support","Using the earbuds\n52 | MOMENTUM Sport\nBattery protection mode\nWhen the battery protection mode is activated, the rechargeable \nbatteries of the earbuds are charged in a particularly protective way \nand only up to a charge level of approx. 80% in order to extend the \nbattery life. The maximum playback time of the earbuds is reduced \naccordingly to approx. 80% of the standard playback time. \nYou can activate the battery protection mode via the Smart Control \napp (see page > 28).\nEco mode","of the active noise cancellation circuitry located on the outside of \nthe earbuds.\n\u2022 With active noise cancellation ANC activated, the battery life of \nthe earbuds is reduced.\nYou can also adjust the volume using the connected Bluetooth \ndevice.\nIf you have activated the voice assistant (> 33) and then change \nthe volume of the earbuds, the volume of the voice assistant is \nadjusted accordingly and saved permanently.","of the active noise cancellation circuitry located on the outside of \nthe earbuds.\n\u2022 With active noise cancellation ANC activated, the battery life of \nthe earbuds is reduced.\nYou can also adjust the volume using the connected Bluetooth \ndevice.\nIf you have activated the voice assistant (> 33) and then change \nthe volume of the earbuds, the volume of the voice assistant is \nadjusted accordingly and saved permanently."]}
{"question":"Does the Sony WH-1000XM5 support multi-device Bluetooth pairing, and how many devices can it connect to simultaneously?","ground_truth":"I don't know","answer":"The Sony WH-1000XM5 does not support multi-device Bluetooth pairing.","contexts":["operating system (see page > 28)\nPaired devices establish a Bluet ooth wireless connection immedi-\nately after switch-on and are ready for use.\nWhen switched on, the earbuds will automatically try to connect to \nthe last two Bluetooth devices used. The earbuds can save the con-\nnection profiles of up to six Bluetooth devices with which they have \nbeen paired. Audio playback is only possible from one device at a \ntime.\nIf you pair the earbuds with the seventh Bluetooth device, the con-","Getting started\nMOMENTUM True Wireless 4  | 15\n5. Connecting additional Bluetooth devices\n\u25b7 If desired, connect the earbuds to additional devices via Blue-\ntooth (> 22).\nThe earbuds can save the connection profiles of up to six Bluetooth \ndevices with which they have been paired. Audio playback is only \npossible from one device at a time.\nUsing the Smart Control app (\u201cConnections\u201d), you can view the list of \npaired devices and selectively connect and disconnect devices (> \n23).\n3s\nLR\n \u201cPairing\u201c","Getting started\nMOMENTUM True Wireless 4  | 15\n5. Connecting additional Bluetooth devices\n\u25b7 If desired, connect the earbuds to additional devices via Blue-\ntooth (> 22).\nThe earbuds can save the connection profiles of up to six Bluetooth \ndevices with which they have been paired. Audio playback is only \npossible from one device at a time.\nUsing the Smart Control app (\u201cConnections\u201d), you can view the list of \npaired devices and selectively connect and disconnect devices (> \n23).\n3s\nLR\n \u201cPairing\u201c","Using the earbuds\nMOMENTUM Sport  | 23\nConnecting the earbuds to Bluetooth \ndevices\nThe earbuds have a multipoint function, i.e. they can simultaneously \nestablish two connections via Bluetooth Classic (audio playback, \ntelephony) and two additional connections via Bluetooth Low Energy \n(sensor data transmission). You can find more information on Blue-\ntooth wireless connections here: page > 25\nAudio playback is only possible from one device at a time.","\u25b7 If desired, connect the earbuds to additional devices via Blue-\ntooth (see page > 27).\nThe earbuds can save the connection profiles of up to six Bluetooth \ndevices with which they have been paired. Audio playback is only \npossible from one device at a time.\nUsing the Smart Control app (\u201cConnection management\u201d), you can \nview the list of paired devices and selectively connect and discon-\nnect devices (see page > 29).\nSmart Control \u201cSennheiser Smart Control\u201d"]}
{"question":"What is the water resistance rating of the Apple AirPods Pro 2?","ground_truth":"I don't know","answer":"The Apple AirPods Pro 2 have an IP55 water resistance rating.","contexts":["Important safety instructions\nMOMENTUM Sport  | 3\nSafety instructions for Lithium rechargeable batteries\nNotes on the ingress protection rating of the earbuds\nThe earbuds feature an IP55 ingress protection rating which means \nthey are protected from the ingress of water (protection class \naccording to International Protection Marking (IP code), IEC standard \n60529, tested under laboratory conditions). The charging case has \nan IP54 protection rating and is protected against dust and splash","Important safety instructions\nMOMENTUM True Wireless 4  | 3\nSafety instructions for Lithium rechargeable batteries\nNotes on the ingress protection rating of the earbuds\nThe earbuds feature an IP54 ingress protection rating which means \nthey are protected from the ingress of water (protection class \naccording to International Protection Marking (IP code), IEC standard \n60529, tested under laboratory conditions).\nThe earbuds can be used in the rain, for example. However, they are","Important safety instructions\nMOMENTUM True Wireless 4  | 3\nSafety instructions for Lithium rechargeable batteries\nNotes on the ingress protection rating of the earbuds\nThe earbuds feature an IP54 ingress protection rating which means \nthey are protected from the ingress of water (protection class \naccording to International Protection Marking (IP code), IEC standard \n60529, tested under laboratory conditions).\nThe earbuds can be used in the rain, for example. However, they are","Specifications\nMOMENTUM Sport  | 65\nBluetooth\nTemperature range operation: 0 to +40\u00b0C\ncharging: +5 to +35\u00b0C\nstorage: \u201320 to +60\u00b0C\nRelative humidity operation: 10 to 80%, non condensing\nstorage: 10 to 90%\nMagnetic field strength earbuds: 1.86 mT\ncharging case: 250 mT\nIngress protection of the \nearbuds\nearbuds: IP55\ncharging case: IP54\nWeight earbuds: 6.4 g each (with N-size ring \nand M-size ear tip)\ncharging case: 78.4 g\nboth earbuds and charging case: 91 g","and M-size ear tip)\ncharging case: 78.4 g\nboth earbuds and charging case: 91 g\nDimensions earbuds: ap prox. 23.3 x 20.9 x \n26.1 mm\ncharging case: 63.7 x 64.8 x 30.0 mm\nSensors heart rate, body temperature, \n3-axis acceleration sensor, infrared \nin-ear sensor\nSensor measuring ranges heart rate: 30 ~ 220 bpm\nbody temperature: 35.5 to 42.0\u00b0C \n(accuracy: \u00b1 0.3\u00b0C)\nVersion Bluetooth 5.2 certified, class 1\nTransmission frequency 2,402 MHz to 2,480 MHz\nModulation GFSK, \u03c0\/4 DQPSK, 8DPSK"]}
