{"question":"What does it mean when the LED display flashes yellow In Accentum Wireless Around Ear Headphones? Select the correct answer from A, B, C, D. Only one answer is correct. A) Battery charge is 0 % to 20 %. B) Battery charge is 90 % to 100 %. C) Battery charge is 20 % to 90 %. D) Headphones are in Bluetooth pairing mode","ground_truth":"C) Battery charge is 20 % to 90 %.","answer":"C) Battery charge is 20% to 90%.","contexts":["Product overview\nACCENTUM  |  9\nDuring charging\nOverview of sound signals and voice prompts\nThe headphones output voice prompts and sound signals in case of \nvarious events.\nYou hear short sound signals when the headphones\n\u2022 are switched on or off,\n\u2022 are in pairing mode (melody),\n\u2022 detect devices in the pairing list,\nLED Meaning\nflashes red Battery charge is 0 % to 20 %.\nflashes yellow Battery charge is 20 % to 90 %.\nflashes green Battery charge is 90 % to 100 %.\nlights up green \nfor 5 minutes","display to indicate the charging process.\nR\nUSB-C\nUSB-A\nLED Meaning\nflashes red Battery charge is 0 % to 20 %.\nflashes yellow Battery charge is 20 % to 90 %.\nflashes green Battery charge is 90 % to 100 %. \nlights up green \nfor 5 minutes \nWhen the rechargeable battery is \n100% charged, the LED lights up for \n5 minutes and then goes off.\nYou can speed up the charging process by charging the head-\nphones when they are switched off. \nIf you disconnect the USB connection during or after charging,","devices (headphones and e.g. smartphone) once. This process is \ncalled pairing.\nIf operation differs from the steps mentioned, also refer to the \ninstruction manual of the Bluetooth device you are using.\nLED Meaning\n1 red Rechargeable battery is almost empty \n(less than 2% charged)\n1 white\nRechargeable battery is approx. 2-20% \ncharged \n(>1 hour of playback time)\n2 white\nRechargeable battery is approx. \n20-40% charged \n(>12 hours of playback time)\n3 white\nRechargeable battery is approx.","able battery for a complete charging cycle without interruption.\nWhen the headphones are being charged, the LED display lights up \n(>8). Once the headphones are 100% charged, the LED lights up \ngreen for 5 minutes and then goes off. When the battery charge \ndrops to a low level, the voice prompt \u201cRecharge headset\u201d asks you \nto recharge the headphones. If the headphones are not charged, the \nvoice prompt will be repeated every 10 minutes until the headphones \nswitch off.","able battery for a complete charging cycle without interruption.\nWhen the headphones are being charged, the LED display lights up \n(> 10). Once the headphones are fully charged, the LEDs flash white \nfor approx. 5 minutes and then go off. When the battery charge drops \nto a low level, the voice prompt \u201cRecharge headset\u201d asks you to \nrecharge the headphones. If the headphones are not charged, the \nvoice prompt will be repeated every 10 minutes until the headphones \nswitch off.","Using the headphones\nACCENTUM  |  21\nRetrieving information on the battery \ncharge status\nWhen the headphones are connected to your Bluetooth device, the \nbattery charge status can be displayed on the screen of your smart-\nphone (depending on the device and operating system used).\nThe Smart Control app also displays the battery charge status.\nOn the headphones, you can retrieve information on the battery \ncharge level via the voice prompts (also possible while listening to","earbuds inserted\nCharging case \nWITHOUT earbuds \ninserted \nlights up \ngreen\nEarbuds are fully \ncharged, charging \ncase is more than 50 \n% charged.\nCharging case is \nmore than 50 % \ncharged.\npulses \nyellow\nEarbuds are being \ncharged via the \nrechargeable bat-\ntery of the charging \ncase.\n\u2013\nlights up \nyellow\nEarbuds are fully \ncharged, charging \ncase is less than \n50 % charged.\nCharging case is \ncharged less than \n50 %.\nlights up \nred\nRechargeable bat-\nteries of the earbuds \nand the charging","earbuds inserted\nCharging case \nWITHOUT earbuds \ninserted \nlights up \ngreen\nEarbuds are fully \ncharged, charging \ncase is more than 50 \n% charged.\nCharging case is \nmore than 50 % \ncharged.\npulses \nyellow\nEarbuds are being \ncharged via the \nrechargeable bat-\ntery of the charging \ncase.\n\u2013\nlights up \nyellow\nEarbuds are fully \ncharged, charging \ncase is less than \n50 % charged.\nCharging case is \ncharged less than \n50 %.\nlights up \nred\nRechargeable bat-\nteries of the earbuds \nand the charging","charged via the \nrechargeable bat-\ntery of the charging \ncase.\n\u2013\nlights up \nyellow\nEarbuds are fully \ncharged, charging \ncase is more than \n10% and less than \n50% charged.\nCharging case is \nmore than 10% and \nless than 50% \ncharged.\n 5s","charged, charging \ncase is less than \n50 % charged.\nCharging case is \ncharged less than \n50 %.\nlights up \nred\nRechargeable bat-\nteries of the earbuds \nand the charging \ncase are almost \nempty.\nRechargeable bat-\ntery of the charging \ncase is almost \nempty.\nflashes \nred\nAt least one earbud \nhas a charging \nerror\/battery error \n(> 44).\nCharging case has a \ncharging error\/bat-\ntery error (> 44).\nIf the LED display does not light up:\n\u2022 Clean the contacts on the earbu ds and in the charging case"]}
{"question":"Is it possible to setup voice prompt? If yes, how to do that in Accentum Wireless Around Ear Headphones?","ground_truth":"Yes, it is possible. To set up the voice prompts you require the Smart Control App (>18). In the app settings, you can activate voice prompts and sound signals (also the default setting) or deactivate them.","answer":"To set up voice prompts in the Sennheiser Accentum Wireless Around Ear Headphones, you need to use the Smart Control app. In the app settings, you can activate voice prompts and sound signals or deactivate them completely.","contexts":["Using the headphones\n30  |  ACCENTUM\nUsing the voice assistant\/voice dialing\nThe voice assistant is only available when the headphones and the \nmobile device are connected via Bluetooth or USB. Some smart-\nphones or music players may not support all functions.\n\u25b7 Press the main button 1x.\nThe available voice assistant of your mobile device is activated \n(depending on the system used or app installed on your mobile \ndevice: Siri, Google Assistant or others. If no voice assistant is","settings are active even without using the Smart Control app, i.e. \nwhen you are using a different Bluetooth device.\nSetting the voice prompts\/sound signals\nTo be able to set the voice prompts and sound signals, you require \nthe Smart Control app (> 18).\nIn the app settings, you can activate voice prompts and sound sig-\nnals (default setting) or deactivate them completely.\nDeactivating the touch pad function\nTo avoid unintentional entries via the touch pad of the headphones,","Product overview\nMOMENTUM 4  | 11\nOverview of sound signals and voice prompts\nThe headphones output voice prompts and sound signals in case of \nvarious events.\nYou hear short sound signals when the headphones\n\u2022 are switched on or off,\n\u2022 are put on or taken off,\n\u2022 are in pairing mode (melody),\n\u2022 detect devices in the pairing list,\n\u2022 cancel the pairing process,\n\u2022 receive a gesture via the touch pad (increasing the volume, start-\ning\/pausing music playback, accepting\/holding\/rejecting calls,","Product overview\nMOMENTUM True Wireless 4  | 11\nNotes on voice prompts\nThe earbuds output voice prompts for events (the table gives some \nexamples). Using the Smart Control app, you can change the lan-\nguage of the voice prompts, choose between voice prompts and \nbeep sounds, or deactivate the status messages with a few excep-\ntions (e.g. rechargeable battery is empty). \nVoice prompt Meaning\n\u201cPower on\u201d Earbuds are switched on.\n\u201cPower off\u201d Earbuds switch off.","Product overview\nMOMENTUM True Wireless 4  | 11\nNotes on voice prompts\nThe earbuds output voice prompts for events (the table gives some \nexamples). Using the Smart Control app, you can change the lan-\nguage of the voice prompts, choose between voice prompts and \nbeep sounds, or deactivate the status messages with a few excep-\ntions (e.g. rechargeable battery is empty). \nVoice prompt Meaning\n\u201cPower on\u201d Earbuds are switched on.\n\u201cPower off\u201d Earbuds switch off.","ing\/pausing music playback, accepting\/holding\/rejecting calls, \nadjusting the ANC function or the Transparency Mode).\n\u2022 receive an incoming call (ring tone),\n\u2022 are connected to a device via the audio cable or USB cable,\n\u2022 are disconnected from the connection via the audio cable or USB \ncable.\nVia the Smart Control app, you can adjust settings for the voice \nprompts and sound signals (> 33).\nVoice prompt Meaning\/headphones...\nEstablishing a Bluetooth connection","Using the earbuds\nMOMENTUM True Wireless 4  | 33\nUsing the voice assistant\/voice dialing\n\u25b7 Tap the touch control panel of the right earbud 3x.\nThe available voice assistant of your Bluetooth device is activated \n(depending on the system used or app installed: Siri, Google \nAssistant or similar).\n\u25b7 Speak your request.\nTo cancel the selection or input to the voice assistant:\n\u25b7 Tap the touch control panel of the right earbud 1x.\nUsing the Smart Pause function","Using the earbuds\nMOMENTUM True Wireless 4  | 33\nUsing the voice assistant\/voice dialing\n\u25b7 Tap the touch control panel of the right earbud 3x.\nThe available voice assistant of your Bluetooth device is activated \n(depending on the system used or app installed: Siri, Google \nAssistant or similar).\n\u25b7 Speak your request.\nTo cancel the selection or input to the voice assistant:\n\u25b7 Tap the touch control panel of the right earbud 1x.\nUsing the Smart Pause function","Using the headphones\nACCENTUM  |  27\nPlaying the next\/previous track\n\u25b7 Press the music and call control button several times.\nMaking phone calls using the headphones\nThe following call functions are only available when the headphones, \nthe smartphone or the PC\/Mac are connected via Bluetooth (> 14). \nSome smartphones or communication apps may not support all \nfunctions. During a call, the active noise cancellation ANC is always \nactivated to ensure the best possible speech intelligibility. The","Using the headphones\nACCENTUM  |  19\nSwitching the headphones off\n\u25b7 Press the main button for 3 seconds.\nYou hear a sound signal. The LED flashes red 3x. The headphones \nswitch off.\nMake sure that Bluetooth is already activated on your Blue-\ntooth device when switching on the headphones.\nIf Bluetooth is activated and the headphones cannot find a \npaired Bluetooth device within a few minutes, you hear the \nvoice prompt \u201cNo connection\u201d. The LED flashes red 3x. The"]}
{"question":"When do I replace the ear pads and where can I find the replacement ear pads for Accentum Wireless Around Ear Headphones?","ground_truth":"There is no specific timeframe for ear pad replacement. For hygiene reasons, you should replace your ear pads from time to time. Replacement ear pads are available at www.sennheiser-hearing.com\/accentum-wireless.","answer":"You should replace the ear pads of the Accentum Wireless Around Ear Headphones from time to time for hygiene reasons. Replacement ear pads can be found at www.sennheiser-hearing.com\/accentum-wireless for online purchase or by contacting your local Sonova Consumer Hearing partner at www.sennheiser-hearing.com\/service-support.","contexts":["to time. Spare ear pads are available at  \nwww.sennheiser-hearing.com\/accentum-wireless (to purchase \nonline or contact your local Sonova Consumer Hearing partner: \nwww.sennheiser-hearing.com\/service-support)\n\u25b7 Peel the ear pad up and away from the ear cup.\n\u25b7 Assign the right ear pad to the right ear cup and the left ear pad \nto the left ear cup.\n\u25b7 Place the new ear pad onto the ear cup.\n\u25b7 Press the ear pad onto the ear cup so that the ear pad is fixed in \nthe notch of the ear cup.\nCAUTION","to time. Spare ear pads are available at \nwww.sennheiser-hearing.com\/momentum-4-wireless (to purchase \nonline or contact your local Sonova Consumer Hearing partner: \nwww.sennheiser-hearing.com\/service-support)\n\u25b7 Grab the ear pad and pull the ear pad including the fastening ring \noff the ear cup.\n\u25b7 Place the new ear pad onto the ear cup. An assignment to the \nright and left side is not necessary.\n\u25b7 Press the new ear pad firmly onto the ear cup all the way around","ACCENTUM\nWireless around-ear headphones\nModel: ACAEBT\nInstruction manual\nUse the search function, the navigation (left) or the following links:\nStart\n\u201cProduct overview\u201d\n\u201cGetting started\u201d\n\u201cUsing the headphones\u201d\n\u201cFAQ\/If a problem occurs ...\u201d\n\u201cSpecifications\u201d\nSonova Consumer Hearing GmbH\nAm Labor 1 \n30900 Wedemark \nGermany\nwww.sennheiser-hearing.com\nVersion: 11\/23 A02","Care and maintenance\n34  |  ACCENTUM\nCare and maintenance\n\u25b7 Clean the parts of the product only with a soft, dry cloth.\nTo clean the charging socket:\n\u25b7 Blow vigorously over the charging socket. \n\u25b7 If necessary, carefully remove any stuck dirt from the charging \nsocket using a dry, soft brush or a dry interdental brush. Only \napply gentle pressure when doing so.\nReplacing the ear pads\nFor reasons of hygiene, you should replace your ear pads from time \nto time. Spare ear pads are available at","Using the headphones\nACCENTUM  |  33\nStoring and transporting the headphones\nHandle the headphones with care when you are not using or trans-\nporting them. Store the headphones in a clean, dust-free place out of \nreach of sharp objects.\nCAUTION\nPointed objects can damage the product!\nIf pointed objects pierce the ear pads of the product, the ear pad and \nthe function of the product may be damaged.\n\u25b7 Do not transport the product in your bag together with pointed \nobjects.","to purchase online or contact your local Sonova Consumer Hear-\ning partner:  \nwww.sennheiser-hearing.com\/service-support\nACCENTUM around-ear headphones \nModel: ACAEBT\nUSB cable with USB-C and USB-A connector,\nlength approx. 1.2 m\nQuick guide\nSafety guide","Product overview\nACCENTUM  |  7\nProduct overview\nACCENTUM\nModel: ACAEBT\nEar pads\nHeadband, steplessly adjustable\nEar cups\nSpeech microphones (2 pcs.) for phone calls\nLED display\nUSB-C socket for charging, calling, streaming via PC\/Mac\nVolume + button\nMusic and voice control button\nVolume - button\nR\n3\n4\n3\n6\n21\n5\n0\n9\n8\nA A\nBB\n7\n4","Care and maintenance\nMOMENTUM 4  | 37\nCare and maintenance\n\u25b7 Clean the parts of the product only with a soft, dry cloth.\nTo clean the charging socket:\n\u25b7 Blow vigorously over the charging socket. \n\u25b7 If necessary, carefully remove any stuck dirt from the charging \nsocket using a dry, soft brush or a dry interdental brush. Only \napply gentle pressure when doing so.\nReplacing the ear pads\nFor reasons of hygiene, you should replace your ear pads from time \nto time. Spare ear pads are available at","Using the headphones\n20  |  ACCENTUM\nPutting the headphones on and adjusting \nthe headband \nFor good sound quality, the best possible noise cancellation and the \nbest possible wearing comfort, the headband can be adjusted to \nproperly fit your head. \n\u25b7 Wear the headphones so that the headband runs over the top of \nyour head. The markings for the right side (R) and for the left side \n(L) can be found on the inside of the ear cups.\n\u25b7 Move the ear cups up or down the headband slider until:","\u25b7 Move the ear cups up or down the headband slider until:\n\u2013 your ears are comfortably covered by the ear pads,\n\u2013 you feel even, gentle pressure around your ears,\n\u2013 a snug fit of the headband on the head is ensured.\nFor optimal sound quality, the ear pads must completely surround \nyour ears."]}
{"question":"What is the charging temperature range of Accentum wireless around ear headphones?","ground_truth":"Between +10 \u00b0C to +40 \u00b0C","answer":"The charging temperature range of Accentum wireless around ear headphones is from +5 to +35 \u00b0C.","contexts":["storage: \u201320 \u00b0C to +60 \u00b0C\nRelative humidity\n(non condensing)\noperation: 10 to 80 %\nstorage: 10 to 90 %\nWeight (headphones) approx. 222 g\nMagnetic field strength 3.00 mT\nVersion Bluetooth 5.2 compliant, class 1\nTransmission frequency 2,402 MHz to 2,480 MHz\nModulation GFSK, \u03c0\/4 DQPSK, 8DPSK\nProfiles A2DP, AVRCP, HFP, HSP, GATT\nOutput power 10 mW (max)\nCodec aptX\u2122 HD, AAC, SBC\nDevice name ACCENTUM (individually adjustable)\nNumber of active connec-\ntions\n2","Specifications\n38  |  ACCENTUM\nSpecifications\nModel: ACAEBT\nBluetooth\nWearing style Bluetooth\u00ae around-ear, closed-back\nEar coupling circum-aural\nTransducer principle dynamic\nTransducer 37 mm\nFrequency response 10 Hz to 22,000 Hz (\u201310 dB)\nSound pressure level (SPL) 106 dB (1 kHz\/0 dBFS)\nTHD (1 kHz, 100 dB SPL) < 0.3 % (1 kHz, 100 dB SPL)\nMicrophone principle MEMS\nMicrophone frequency \nresponse\n50 Hz to 8,000 Hz (\u20133 dB)\nMicrophone pick-up pat-\ntern (speech audio)\n2 omni-directional microphones","Specifications\nMOMENTUM True Wireless 4  | 49\nBluetooth\nTemperature range operation: 0 to +40 \u00b0C\ncharging: +5 to +35 \u00b0C\nstorage: \u201320 to +60 \u00b0C\nRelative humidity operation: 25 to 75 %, non condensing\nstorage: 10 to 90 %\nMagnetic field strength earbuds: 0.95 mT\ncharging case: 105 mT\nIngress protection of the \nearbuds splash proof (IP54)\nWeight earbuds: approx. 6 g each\ncharging case: approx. 66 g\nboth earbuds and charging case: \napprox. 78 g\nVersion Bluetooth 5.4 certified, class 1","Specifications\nMOMENTUM True Wireless 4  | 49\nBluetooth\nTemperature range operation: 0 to +40 \u00b0C\ncharging: +5 to +35 \u00b0C\nstorage: \u201320 to +60 \u00b0C\nRelative humidity operation: 25 to 75 %, non condensing\nstorage: 10 to 90 %\nMagnetic field strength earbuds: 0.95 mT\ncharging case: 105 mT\nIngress protection of the \nearbuds splash proof (IP54)\nWeight earbuds: approx. 6 g each\ncharging case: approx. 66 g\nboth earbuds and charging case: \napprox. 78 g\nVersion Bluetooth 5.4 certified, class 1","Product overview\nACCENTUM  |  9\nDuring charging\nOverview of sound signals and voice prompts\nThe headphones output voice prompts and sound signals in case of \nvarious events.\nYou hear short sound signals when the headphones\n\u2022 are switched on or off,\n\u2022 are in pairing mode (melody),\n\u2022 detect devices in the pairing list,\nLED Meaning\nflashes red Battery charge is 0 % to 20 %.\nflashes yellow Battery charge is 20 % to 90 %.\nflashes green Battery charge is 90 % to 100 %.\nlights up green \nfor 5 minutes","Specifications\nMOMENTUM Sport  | 65\nBluetooth\nTemperature range operation: 0 to +40\u00b0C\ncharging: +5 to +35\u00b0C\nstorage: \u201320 to +60\u00b0C\nRelative humidity operation: 10 to 80%, non condensing\nstorage: 10 to 90%\nMagnetic field strength earbuds: 1.86 mT\ncharging case: 250 mT\nIngress protection of the \nearbuds\nearbuds: IP55\ncharging case: IP54\nWeight earbuds: 6.4 g each (with N-size ring \nand M-size ear tip)\ncharging case: 78.4 g\nboth earbuds and charging case: 91 g","charging: +10\u00b0C to +40\u00b0C\nstorage: \u201320\u00b0C to +60\u00b0C\nRelative humidity\n(non condensing)\noperation: 10 to 80 %\nstorage: 10 to 90 %\nWeight (headphones) approx. 293 g\nMagnetic field strength 6.25 mT\nVersion Bluetooth 5.2 compliant, class 1\nTransmission frequency 2,402 MHz to 2,480 MHz\nModulation GFSK, \u03c0\/4 DQPSK, 8DPSK\nProfiles HFP, AVRCP, A2DP\nOutput power 10 mW (max)\nCodec aptX\u2122 Adaptive, AAC, SBC\nDevice name MOMENTUM 4 (individually adjust-\nable)\nLE-MOMENTUM 4 (Bluetooth Low \nEnergy only)","Using the headphones\n12  |  ACCENTUM\nUsing the headphones\nInformation on the rechargeable battery \nand the charging process\nThe headphones have a built-in rechargeable battery. A complete \ncharging cycle takes approx. 3 hours. The charging time can vary \ndepending on the power source used and the ambient temperature. \nBefore using the headphones for the first time, charge the recharge-\nable battery for a complete charging cycle without interruption.","Getting started\nACCENTUM  |  11\nGetting started\n1. Charging the rechargeable battery\nThe headphones\u2019 rechargeable battery is not fully charged upon \ndelivery. \n\u25b7 Before using the headphones for the first time, charge the \nrechargeable battery for a complete charging cycle without inter-\nruption (> 13).\n2. Connecting the headphones to a Bluetooth \ndevice\n\u25b7 Connect the headphones to your smartphone via Bluetooth (> 14).\n3. Smart Control app for your smartphone","Product overview\nACCENTUM  |  7\nProduct overview\nACCENTUM\nModel: ACAEBT\nEar pads\nHeadband, steplessly adjustable\nEar cups\nSpeech microphones (2 pcs.) for phone calls\nLED display\nUSB-C socket for charging, calling, streaming via PC\/Mac\nVolume + button\nMusic and voice control button\nVolume - button\nR\n3\n4\n3\n6\n21\n5\n0\n9\n8\nA A\nBB\n7\n4"]}
{"question":"What is the weight of the Momentum 4 Wireless Around Ear Headphones?","ground_truth":"Approximately 293g.","answer":"The weight of the Momentum 4 Wireless Around Ear Headphones is approximately 293 g.","contexts":["both earbuds and charging case: \napprox. 78 g\nVersion Bluetooth 5.4 certified, class 1\nTransmission frequency Classic BDR\/EDR and BLE 1M:\n2,402 MHz to 2,480 MHz\nBLE 2M: 2,404 MHz to 2,478 MHz \n(without 2,426 MHz)\nModulation GFSK, \u03c0\/4 DQPSK, 8DPSK\nProfiles AVRCP, A2DP, HFP, TMAP, PBP\nOutput power 10 mW (max)\nCodec aptX\u2122, aptX\u2122 Adaptive\/Lossless, \nAAC, SBC, Auracast\u2122 Broadcast \nAudio, LC3\nDevice name MOMENTUM TW 4\nNumber of active connec-\ntions\n2","both earbuds and charging case: \napprox. 78 g\nVersion Bluetooth 5.4 certified, class 1\nTransmission frequency Classic BDR\/EDR and BLE 1M:\n2,402 MHz to 2,480 MHz\nBLE 2M: 2,404 MHz to 2,478 MHz \n(without 2,426 MHz)\nModulation GFSK, \u03c0\/4 DQPSK, 8DPSK\nProfiles AVRCP, A2DP, HFP, TMAP, PBP\nOutput power 10 mW (max)\nCodec aptX\u2122, aptX\u2122 Adaptive\/Lossless, \nAAC, SBC, Auracast\u2122 Broadcast \nAudio, LC3\nDevice name MOMENTUM TW 4\nNumber of active connec-\ntions\n2","Specifications\nMOMENTUM 4  | 41\nSpecifications\nModel: M4AEBT\nBluetooth\nWearing style Bluetooth\u00ae around-ear, closed-back\nEar coupling circum-aural\nTransducer principle dynamic\nTransducer 42 mm\nFrequency response 6 Hz to 22,000 Hz (\u201310 dB)\nSound pressure level (SPL) 106 dB (1 kHz\/0 dBFS)\nTHD (1 kHz, 100 dB SPL) < 0.3 % (1 kHz, 100 dB SPL)\nMicrophone principle MEMS\nMicrophone frequency \nresponse\n80 Hz to 8,000 Hz (\u20133 dB)\nMicrophone pick-up pat-\ntern (speech audio)\n4 omni-directional microphones","Specifications\n48 | MOMENTUM True Wireless 4\nSpecifications\nMOMENTUM True Wireless 4\nModel: MTW4, MTW4 R, MTW4 L, MTW4 C\nWearing style True Wireless stereo earbuds\nEar coupling ear-canal\nFrequency response 5 Hz to 21 kHz\nTransducer principle dynamic\nTransducer size 7 mm\nSound pressure level (SPL) 107 dB (1 kHz\/1 mW)\nTHD (1 kHz, 94 dB SPL) < 0.08 % (1 kHz\/94 dB)\nNoise cancellation Hybrid Adaptive ANC technology\nMicrophone principle MEMS\nMicrophone frequency \nresponse\n100 Hz to 10 kHz","Specifications\n48 | MOMENTUM True Wireless 4\nSpecifications\nMOMENTUM True Wireless 4\nModel: MTW4, MTW4 R, MTW4 L, MTW4 C\nWearing style True Wireless stereo earbuds\nEar coupling ear-canal\nFrequency response 5 Hz to 21 kHz\nTransducer principle dynamic\nTransducer size 7 mm\nSound pressure level (SPL) 107 dB (1 kHz\/1 mW)\nTHD (1 kHz, 94 dB SPL) < 0.08 % (1 kHz\/94 dB)\nNoise cancellation Hybrid Adaptive ANC technology\nMicrophone principle MEMS\nMicrophone frequency \nresponse\n100 Hz to 10 kHz","charging: +10\u00b0C to +40\u00b0C\nstorage: \u201320\u00b0C to +60\u00b0C\nRelative humidity\n(non condensing)\noperation: 10 to 80 %\nstorage: 10 to 90 %\nWeight (headphones) approx. 293 g\nMagnetic field strength 6.25 mT\nVersion Bluetooth 5.2 compliant, class 1\nTransmission frequency 2,402 MHz to 2,480 MHz\nModulation GFSK, \u03c0\/4 DQPSK, 8DPSK\nProfiles HFP, AVRCP, A2DP\nOutput power 10 mW (max)\nCodec aptX\u2122 Adaptive, AAC, SBC\nDevice name MOMENTUM 4 (individually adjust-\nable)\nLE-MOMENTUM 4 (Bluetooth Low \nEnergy only)","Product overview\nMOMENTUM True Wireless 4  | 7\nEarbuds\nModel: MTW4 R and MTW4 L\nMicrophones for the active noise cancellation ANC, for the \nperception of your surroundings (\u201cTransparency Mode\u201d) \nand for phone calls\nTouch control panel\nStatus LED\nLeft earbud L \nRight earbud R\nChangeable silicone ear adapters\nInfra-red proximity sensor\nMagnetic holders\nCharging contacts\nBuilt-in rechargeable battery\nChangeable ear fins for a secure fit of the earbuds in the \nears\nA\nE\nH\nI\nC\nB\n0\nG G\nF\nJ\n0\nG\nH\nI\nJ\nG","Product overview\nMOMENTUM True Wireless 4  | 7\nEarbuds\nModel: MTW4 R and MTW4 L\nMicrophones for the active noise cancellation ANC, for the \nperception of your surroundings (\u201cTransparency Mode\u201d) \nand for phone calls\nTouch control panel\nStatus LED\nLeft earbud L \nRight earbud R\nChangeable silicone ear adapters\nInfra-red proximity sensor\nMagnetic holders\nCharging contacts\nBuilt-in rechargeable battery\nChangeable ear fins for a secure fit of the earbuds in the \nears\nA\nE\nH\nI\nC\nB\n0\nG G\nF\nJ\n0\nG\nH\nI\nJ\nG","Specifications\nMOMENTUM True Wireless 4  | 49\nBluetooth\nTemperature range operation: 0 to +40 \u00b0C\ncharging: +5 to +35 \u00b0C\nstorage: \u201320 to +60 \u00b0C\nRelative humidity operation: 25 to 75 %, non condensing\nstorage: 10 to 90 %\nMagnetic field strength earbuds: 0.95 mT\ncharging case: 105 mT\nIngress protection of the \nearbuds splash proof (IP54)\nWeight earbuds: approx. 6 g each\ncharging case: approx. 66 g\nboth earbuds and charging case: \napprox. 78 g\nVersion Bluetooth 5.4 certified, class 1","Specifications\nMOMENTUM True Wireless 4  | 49\nBluetooth\nTemperature range operation: 0 to +40 \u00b0C\ncharging: +5 to +35 \u00b0C\nstorage: \u201320 to +60 \u00b0C\nRelative humidity operation: 25 to 75 %, non condensing\nstorage: 10 to 90 %\nMagnetic field strength earbuds: 0.95 mT\ncharging case: 105 mT\nIngress protection of the \nearbuds splash proof (IP54)\nWeight earbuds: approx. 6 g each\ncharging case: approx. 66 g\nboth earbuds and charging case: \napprox. 78 g\nVersion Bluetooth 5.4 certified, class 1"]}
{"question":"What is the charging time of the rechargeable battery in Momentum 4 Wireless Around Ear Headphones?","ground_truth":"Approximately 2 hours","answer":"The charging time of the rechargeable battery in Momentum 4 Wireless Around Ear Headphones is approximately 2 hours for a complete charging cycle.","contexts":["Using the headphones\nMOMENTUM 4  | 13\nUsing the headphones\nInformation on the rechargeable battery \nand the charging process\nThe headphones have a built-in rechargeable battery. A complete \ncharging cycle takes approx. 2 hours. The charging time can vary \ndepending on the power source used and the ambient temperature. \nBefore using the headphones for the first time, charge the recharge-\nable battery for a complete charging cycle without interruption.","20-40% charged \n(>12 hours of playback time)\n3 white\nRechargeable battery is approx. \n40-60% charged \n(>24 hours of playback time)\n4 white\nRechargeable battery is approx. \n60-80% charged\n(>36 hours of playback time)\n5 white\nRechargeable battery is approx. \n80-100% charged \n(>48 hours of playback time)\n5 white Rechargeable battery is 100% charged \n(up to 60 hours of playback time)\nYou can speed up the charging process by charging the head-\nphones when they are switched off.","Using the earbuds\n16 | MOMENTUM True Wireless 4\nUsing the earbuds\nInformation on the rechargeable battery, \nthe charging process and the first use\nThe earbuds and the charging case each have a built-in rechargeable \nbattery. \nTo charge the rechargeable batteries, you can use one of the follow-\ning options:\n\u2022t h e  s u p p l i e d  U S B  c a b l e\n\u2022 a wireless charging station (Qi-compatible, to be ordered sepa-\nrately)\nThe earbuds must be inserted into the charging case for charging.","Using the earbuds\n16 | MOMENTUM True Wireless 4\nUsing the earbuds\nInformation on the rechargeable battery, \nthe charging process and the first use\nThe earbuds and the charging case each have a built-in rechargeable \nbattery. \nTo charge the rechargeable batteries, you can use one of the follow-\ning options:\n\u2022t h e  s u p p l i e d  U S B  c a b l e\n\u2022 a wireless charging station (Qi-compatible, to be ordered sepa-\nrately)\nThe earbuds must be inserted into the charging case for charging.","A complete charging cycle of the charging case and the earbuds \ntakes about 1.5 hours. The quick charge function gives you approx. 1 \nhour of playback time after 8 minutes of charging. The charging time \ncan vary depending on the power source used and the ambient tem-\nperature.\nWe recommend charging the earbuds and the charging case for a \ncomplete charging cycle without interruption before using for the \nfirst time.\nWhen a USB cable connected to a power source is also connected to","A complete charging cycle of the charging case and the earbuds \ntakes about 1.5 hours. The quick charge function gives you approx. 1 \nhour of playback time after 8 minutes of charging. The charging time \ncan vary depending on the power source used and the ambient tem-\nperature.\nWe recommend charging the earbuds and the charging case for a \ncomplete charging cycle without interruption before using for the \nfirst time.\nWhen a USB cable connected to a power source is also connected to","Using the earbuds\n20 | MOMENTUM Sport\nUsing the earbuds\nInformation on the rechargeable battery, \nthe charging process and the first use\nThe earbuds and the charging case each have a built-in rechargeable \nbattery. \nTo charge the rechargeable batteries, you can use one of the follow-\ning options:\n\u2022t h e  s u p p l i e d  U S B  c a b l e\n\u2022 a wireless charging pad (Qi-compatible, to be ordered separately)\nThe earbuds must be inserted into the charging case for charging.","Using the earbuds\n22 | MOMENTUM Sport\nCharging the rechargeable batteries \nwirelessly\n1. Open the charging case by over coming a slight magnetic resis-\ntance and insert the left earbud into the left charging compart-\nment and the right earbud into the right charging compartment.\nThe earbuds are magnetically pulled into the charging compart-\nments.\n2. Place the bottom of the charging case centered on a wireless \ncharging pad (Qi-compatible, to be ordered separately).","A complete charging cycle of the charging case and the earbuds \ntakes about 1.5 hours. The quick charge function gives you approx. \n1 hour of playback time after 10 minutes of charging. The charging \ntime can vary depending on the power source used and the ambient \ntemperature.\nWe recommend charging the earbuds and the charging case for a \ncomplete charging cycle without interruption before using for the \nfirst time.\nWhen a USB cable connected to a power source is also connected to","Using the earbuds\n18 | MOMENTUM True Wireless 4\nCharging the rechargeable batteries \nwirelessly\n1. Open the charging case by over coming a slight magnetic resis-\ntance and insert the left earbud into the left charging compart-\nment and the right earbud into the right charging compartment.\nThe earbuds are magnetically pulled into the charging compart-\nments.\n2. Place the bottom of the charging case centered on a wireless \ncharging station (Qi-compatible, to be ordered separately)."]}
{"question":"What does it mean when the LED display flashes red 3x repeatedly during phone calls in Momentum 4 Wireless Headphones? Select the correct answer from A, B, C, D. Only one answer is correct.  A) Incoming call B) switch off C) Rechargeable battery is almost empty (less than 2% charged) D) incoming call with an almost empty battery.","ground_truth":"D) incoming call with an almost empty battery.","answer":"C) Rechargeable battery is almost empty (less than 2% charged)","contexts":["Product overview\n10 | MOMENTUM 4\nOverview of the LED display\nDuring operation\nDuring phone calls\nDuring charging\nLED Meaning\/headphones...\nwhite \nflashes 3x\n... switch on.\n... are connected to a device via Blue-\ntooth.\nwhite\ncontinuous \nsequence\n... are in Bluetooth pairing mode.\nred \nflashes 3x ... switch off.\nLED Meaning\nwhite \nflashes 3x \nrepeatedly\nIncoming call\nred \nflashes 3x \nrepeatedly\nIncoming call with an almost empty \nbattery\nLED Meaning\n1 red Rechargeable battery is almost empty","Incoming call with an almost empty \nbattery\nLED Meaning\n1 red Rechargeable battery is almost empty\n(less than 2% charged)\n1 white\nRechargeable battery is approx. 2-20% \ncharged \n(>1 hour of playback time)\n2 white\nRechargeable battery is approx. \n20-40% charged \n(>12 hours of playback time)\n3 white\nRechargeable battery is approx. \n40-60% charged \n(>24 hours of playback time)\n4 white\nRechargeable battery is approx \n60-80% charged\n(>36 hours of playback time)\n5 white","devices (headphones and e.g. smartphone) once. This process is \ncalled pairing.\nIf operation differs from the steps mentioned, also refer to the \ninstruction manual of the Bluetooth device you are using.\nLED Meaning\n1 red Rechargeable battery is almost empty \n(less than 2% charged)\n1 white\nRechargeable battery is approx. 2-20% \ncharged \n(>1 hour of playback time)\n2 white\nRechargeable battery is approx. \n20-40% charged \n(>12 hours of playback time)\n3 white\nRechargeable battery is approx.","You hear a sound signal. One LED flashes red 3x. The headphones \nswitch off.\nMake sure that Bluetooth is already activated on your Blue-\ntooth device when switching on the headphones.\nIf Bluetooth is activated and the headphones cannot find a \npaired Bluetooth device within a few minutes, you hear the \nvoice prompt \u201cNo connection\u201d. The LED flashes red 3x. The \nheadphones switch to standby mode.\n\u201cConnected\u201c\n3s\nHold\n1.\n3s\nHold","voice prompt \u201cNo connection\u201d. The LED flashes red 3x. The \nheadphones switch to standby mode.\n1.\n3s\n3x","charge level via the voice prompts (also possible while listening to \nmusic or talking on the phone, as long as you have the headphones \non):\n\u25b7 Press the music and call control button for 3 seconds.\nYou hear a voice prompt informing you of the remaining battery life. \nThe LED flashes\/lights up depending on the battery life of the head-\nphones.\nAdjusting the volume\nYou can adjust the playback volume for music and for phone calls.","Press 3x Plays the previous track in the playlist\n2x\n3x\nIf the headphones are switched off during an active call or if the \nrechargeable battery is empty, the call is put on hold and you \ncan use your smartphone as an output device as usual.","able battery for a complete charging cycle without interruption.\nWhen the headphones are being charged, the LED display lights up \n(>8). Once the headphones are 100% charged, the LED lights up \ngreen for 5 minutes and then goes off. When the battery charge \ndrops to a low level, the voice prompt \u201cRecharge headset\u201d asks you \nto recharge the headphones. If the headphones are not charged, the \nvoice prompt will be repeated every 10 minutes until the headphones \nswitch off.","able battery for a complete charging cycle without interruption.\nWhen the headphones are being charged, the LED display lights up \n(> 10). Once the headphones are fully charged, the LEDs flash white \nfor approx. 5 minutes and then go off. When the battery charge drops \nto a low level, the voice prompt \u201cRecharge headset\u201d asks you to \nrecharge the headphones. If the headphones are not charged, the \nvoice prompt will be repeated every 10 minutes until the headphones \nswitch off.","Product overview\n10 | MOMENTUM True Wireless 4\nOverview of the LED indications of the \nearbuds\nLED Meaning\nflashes red-blue \nfor approx. \n2m i n u t e s  \nEarbuds are in Bluetooth pairing \nmode.\nflashes blue 3x Bluetooth pairing or earbud pairing \nwas successful.\nflashes red 3x Bluetooth pairing or earbud pairing \nfailed.\nlights up blue Earbuds are connected to a device \nvia Bluetooth.\nlights up red\nEarbuds are not connected to a \ndevice via Bluetooth or the connec-\ntion has been interrupted."]}
{"question":"What does it mean when the LED display presents 3 white during charging in Momentum 4 wireless around ear headphones? Select the correct answer from A, B, C, D. Only one answer is correct.  A) Incoming call B) switch off C) Rechargeable battery is almost empty (less than 2% charged) D) incoming call with an almost empty battery.","ground_truth":"A) Incoming call","answer":"C) Rechargeable battery is almost empty (less than 2% charged)","contexts":["Product overview\n10 | MOMENTUM 4\nOverview of the LED display\nDuring operation\nDuring phone calls\nDuring charging\nLED Meaning\/headphones...\nwhite \nflashes 3x\n... switch on.\n... are connected to a device via Blue-\ntooth.\nwhite\ncontinuous \nsequence\n... are in Bluetooth pairing mode.\nred \nflashes 3x ... switch off.\nLED Meaning\nwhite \nflashes 3x \nrepeatedly\nIncoming call\nred \nflashes 3x \nrepeatedly\nIncoming call with an almost empty \nbattery\nLED Meaning\n1 red Rechargeable battery is almost empty","devices (headphones and e.g. smartphone) once. This process is \ncalled pairing.\nIf operation differs from the steps mentioned, also refer to the \ninstruction manual of the Bluetooth device you are using.\nLED Meaning\n1 red Rechargeable battery is almost empty \n(less than 2% charged)\n1 white\nRechargeable battery is approx. 2-20% \ncharged \n(>1 hour of playback time)\n2 white\nRechargeable battery is approx. \n20-40% charged \n(>12 hours of playback time)\n3 white\nRechargeable battery is approx.","Incoming call with an almost empty \nbattery\nLED Meaning\n1 red Rechargeable battery is almost empty\n(less than 2% charged)\n1 white\nRechargeable battery is approx. 2-20% \ncharged \n(>1 hour of playback time)\n2 white\nRechargeable battery is approx. \n20-40% charged \n(>12 hours of playback time)\n3 white\nRechargeable battery is approx. \n40-60% charged \n(>24 hours of playback time)\n4 white\nRechargeable battery is approx \n60-80% charged\n(>36 hours of playback time)\n5 white","able battery for a complete charging cycle without interruption.\nWhen the headphones are being charged, the LED display lights up \n(> 10). Once the headphones are fully charged, the LEDs flash white \nfor approx. 5 minutes and then go off. When the battery charge drops \nto a low level, the voice prompt \u201cRecharge headset\u201d asks you to \nrecharge the headphones. If the headphones are not charged, the \nvoice prompt will be repeated every 10 minutes until the headphones \nswitch off.","Using the headphones\n14 | MOMENTUM 4\n2. Connect the USB-A connector to a corresponding socket of a USB \npower source (to be ordered separately). Make sure that the USB \npower source is connected to the power supply system.\nThe charging process of the headphones begins. The LED display \nindicates the charge status.\nIf the LED display does not light up:\n\u25b7 Clean the charging socket (> 37).\n\u25b7 Charge the rechargeable battery until the LED display lights up","able battery for a complete charging cycle without interruption.\nWhen the headphones are being charged, the LED display lights up \n(>8). Once the headphones are 100% charged, the LED lights up \ngreen for 5 minutes and then goes off. When the battery charge \ndrops to a low level, the voice prompt \u201cRecharge headset\u201d asks you \nto recharge the headphones. If the headphones are not charged, the \nvoice prompt will be repeated every 10 minutes until the headphones \nswitch off.","Product overview\nMOMENTUM True Wireless 4  | 9\nLED Charging case WITH \nearbuds inserted\nCharging case \nWITHOUT earbuds \ninserted \nlights up \ngreen\nEarbuds are fully \ncharged, charging \ncase is more than \n50 % charged.\nCharging case is \nmore than 50 % \ncharged.\npulses \nyellow\nEarbuds are being \ncharged via the \nrechargeable bat-\ntery of the charging \ncase.\n\u2013\nlights up \nyellow\nEarbuds are fully \ncharged, charging \ncase is less than \n50 % charged.\nCharging case is \ncharged less than \n50 %.","Product overview\nMOMENTUM True Wireless 4  | 9\nLED Charging case WITH \nearbuds inserted\nCharging case \nWITHOUT earbuds \ninserted \nlights up \ngreen\nEarbuds are fully \ncharged, charging \ncase is more than \n50 % charged.\nCharging case is \nmore than 50 % \ncharged.\npulses \nyellow\nEarbuds are being \ncharged via the \nrechargeable bat-\ntery of the charging \ncase.\n\u2013\nlights up \nyellow\nEarbuds are fully \ncharged, charging \ncase is less than \n50 % charged.\nCharging case is \ncharged less than \n50 %.","power source is connected to the power supply system.\nThe charging process of the headphones begins. The LED display \nindicates the charge status.\nIf the LED display does not light up:\n\u25b7 Clean the charging socket (> 34).\n\u25b7 Charge the rechargeable battery until the LED display lights up \nagain (at least 30 minutes) (> 13). If the rechargeable battery is \ncompletely discharged, it may take several minutes for the LED \ndisplay to indicate the charging process.\nR\nUSB-C\nUSB-A\nLED Meaning","Product overview\n8 | MOMENTUM True Wireless 4\nOverview of the LED display of the \ncharging case\nWhen a USB cable is connected or the charging case is placed on a \nwireless charging station, the LED of the charging case permanently \ndisplays the charging process:\nIf you open the lid of the charging case and no USB cable is con-\nnected or the charging case is not placed on a wireless charging sta-\ntion, the LED of the charging case displays the battery charge status"]}
{"question":"How many audio sources can I connect at the same time to the BTT100 Audio transmitter?","ground_truth":"You can simultaneously connect 2 different sources to the transmitter.","answer":"The BTT100 Audio transmitter can save the connection profiles of up to eight Bluetooth headphones.","contexts":["2 | BT T100 Bluetooth\u00ae Audio Transmitter","BT T100 Bluetooth\u00ae Audio Transmitter | 9 \nGetting started\nConnection to an audio source using the digital optical cable\nTo achieve the best possible listening experience, we recommend that \nyou connect the Bluetooth\u00ae Audio Transmitter to your home cinema or hi-fi \nsystem using the supplied digital optical cable.\nYour Bluetooth\u00ae Audio Transmitter allows digital audio streaming using \nonly PCM audio output from devices connected through the digital optical","14 | BT T100 Bluetooth\u00ae Audio Transmitter\nUsing the transmitter\nSelecting an audio input\nIf both the analog and the digital audio input are connected to an audio \nsource, the transmitter allows you to toggle between the two inputs.\nWARNING\nDanger due to high volume levels!\nListening at high volume levels can lead to permanent hearing \ndefects.\n X Before putting the headphones on and before toggling \nbetween your audio inputs, adjust the volume on the","12 | BT T100 Bluetooth\u00ae Audio Transmitter\nGetting started\nPairing the transmitter to the headphones\/earphones\nCAUTION\nDanger of malfunction!\nThe transmitted radio waves of Bluetooth devices can impair \nthe operation of sensitive and unprotected devices.\n X Only use Bluetooth devices in locations where wireless \ntransmission is permitted.\nThe transmitter can save the connection profiles of up to eight Bluetooth \nheadphones. If you pair the transmitter to the ninth headphones, the saved","10 | BT T100 Bluetooth\u00ae Audio Transmitter\nGetting started\nConnection to an audio source using the 3.5 mm analog audio cable\nSome TV models mute the loudspeakers when you connect the transmitter \nto the headphone socket. Check in the menu of your TV to see if the muting \nfunction can be deactivated. \n X Connect the 3.5 mm plug of the analog audio cable to the Analog input \nof the transmitter. \n X Connect the other end of the analog audio cable to the 3.5 mm \nheadphone socket of the TV or PC.","BT T100 Bluetooth\u00ae Audio Transmitter | 11 \nGetting started\nPowering the transmitter\n1. Connect the USB micro B plug of the supplied USB power cable to the \nUSB-B port of the transmitter.\n2. Connect the USB plug to the USB port of your TV or PC. For older TV \nmodels without built-in USB port, connect the USB plug to an external \nUSB power adapter and connect to the power source.\nThe transmitter automatically switches on.\nUSB-B\nPower\nDigital Optical\nIN\nInput\nSelection\nAnalog\n3.5 mm\nIN\nUSB\nPower","16 | BT T100 Bluetooth\u00ae Audio Transmitter\nUsing the transmitter\nPlaying music\/videos\nIf your audio source and headphones support the aptX or aptX LL codec, \nthe Bluetooth\u00ae Audio Transmitter plays your music wirelessly in stunning \naudio quality. If the audio source and headphones do not support any of \nthese audio codecs, the audio is played in standard quality.\nWhen watching videos from a TV\/PC that supports aptX Low Latency","BT T100 Bluetooth\u00ae Audio Transmitter | 15 \nUsing the transmitter\nConnecting the transmitter to the headphones\/\nearphones\nConnect the headphones\/earphones to the transmitter to watch a movie \nor listen to music from your TV, PC, or home entertainment system. \n1. Switch the paired headphones\/earphones on.\n2. Switch the transmitter on.\nThe LED lights up red. Once the connection is established, the LED \nlights up blue.\nON 2sHold\n1 2\nConnecting the transmitter to a second pair of \nheadphones","BT T100 Bluetooth\u00ae Audio Transmitter | 7 \nProduct overview\nProduct overview\nOverview of the transmitter (Model: BT T100)\n1 Multifunction button 4 Input Selection switch\n2 LED 5 Digital Optical IN input\n3 Analog 3.5 mm IN input 6 USB micro-B input socket (power)\nUSB-B\nPower\nDigital Optical\nIN\nInput\nSelection\nAnalog\n3.5 mm\nIN\nUSB\nPower\nDigital Optical\nIN\nInput\nSelection\nAnalog\n3.5 mm\nIN\n2\n3\n1\n4 65\nUSB-B\nPower\nDigital Optical\nIN\nInput\nSelection\nAnalog\n3.5 mm\nIN\nUSB\nPower\nDigital Optical\nIN\nInput","BT T100 Bluetooth\u00ae Audio Transmitter | 3 \nImportant safety instructions\nIntended use\/Liability\nThe Bluetooth\u00ae Audio Transmitter is suitable for use with hi-fi systems, \nTV sets, PCs, and home cinema systems and supports both analog and \ndigital signals. With this product you can enable a non-Bluetooth-enabled \ndevice to playback audio through Bluetooth wireless headphones.\nIt is considered improper use when this product is used for any application"]}
{"question":"What happens to the LED light colour when I switch the transmitter on and how do I know whether a connection is established in BTT100 Bluetooth Audio Transmitter?","ground_truth":"The LED lights up red when the transmitter is switched on and once the connection is established, the LED lights up blue.","answer":"When you switch the transmitter on in the BTT100 Bluetooth Audio Transmitter, the LED initially lights up red. Once the connection is established, the LED changes to blue, indicating a successful connection.","contexts":["BT T100 Bluetooth\u00ae Audio Transmitter | 15 \nUsing the transmitter\nConnecting the transmitter to the headphones\/\nearphones\nConnect the headphones\/earphones to the transmitter to watch a movie \nor listen to music from your TV, PC, or home entertainment system. \n1. Switch the paired headphones\/earphones on.\n2. Switch the transmitter on.\nThe LED lights up red. Once the connection is established, the LED \nlights up blue.\nON 2sHold\n1 2\nConnecting the transmitter to a second pair of \nheadphones","BT T100 Bluetooth\u00ae Audio Transmitter | 13 \nUsing the transmitter\nUsing the transmitter\nSwitching the transmitter on\nThe transmitter goes into pairing mode when switched on for the \nfirst time.\n1. Press the Multifunction button for 2 seconds.\nThe LED lights up red. \nON\n2sHold\nSwitching the transmitter off\n1. Press the Multifunction button for 3 seconds.\nThe LED switches off.\nOFF\n3sHold","The LED lights up white for 5 seconds. You hear a sound signal. If \nBluetooth is activated on the headphones and a paired device is \navailable, the LED flashes white 3x and you hear the voice prompt \n\u201cConnected\u201d. \nIf Bluetooth is deactivated on the headphones (> 31), you only \nyear a sound signal.\nWARNING\nDanger due to high volume levels!\nListening at high volume levels can lead to permanent \nhearing defects.\n\u25b7 Before putting the headphones on, adjust the volume \nto a low level (> 21).","BT T100 Bluetooth\u00ae Audio Transmitter | 11 \nGetting started\nPowering the transmitter\n1. Connect the USB micro B plug of the supplied USB power cable to the \nUSB-B port of the transmitter.\n2. Connect the USB plug to the USB port of your TV or PC. For older TV \nmodels without built-in USB port, connect the USB plug to an external \nUSB power adapter and connect to the power source.\nThe transmitter automatically switches on.\nUSB-B\nPower\nDigital Optical\nIN\nInput\nSelection\nAnalog\n3.5 mm\nIN\nUSB\nPower","BT T100 Bluetooth\u00ae Audio Transmitter | 9 \nGetting started\nConnection to an audio source using the digital optical cable\nTo achieve the best possible listening experience, we recommend that \nyou connect the Bluetooth\u00ae Audio Transmitter to your home cinema or hi-fi \nsystem using the supplied digital optical cable.\nYour Bluetooth\u00ae Audio Transmitter allows digital audio streaming using \nonly PCM audio output from devices connected through the digital optical","2 | BT T100 Bluetooth\u00ae Audio Transmitter","18 | BT T100 Bluetooth\u00ae Audio Transmitter\nTroubleshooting\nTroubleshooting\nProblem Possible cause Possible solution Page\nTransmitter \ncannot be \nswitched on\nUSB power cable is \nnot connected to the \npower source\nCheck the USB power \nconnection.\n11\nNo audio \nsignal\nTransmitter is not \npaired with the \nheadphones\nCheck if the \nheadphones are paired. \nIf necessary, pair the \nheadphones with the \ntransmitter again.\n12\nVolume of the analog \naudio source is either \nset to the minimum \nor is muted","2. Press the Multifunction button of the transmitter for 1 second.\nThe LED lights up red. Once the transmitter detects that 2 pairs of  \nheadphones are connected, the LED lights up purple for 3 minutes. \nON 1sHold\n1 2\n*1\n*1 Set to pairing mode.","BT T100 Bluetooth\u00ae Audio Transmitter | 1 \nTable of content\nTable of content\nImportant safety instructions ..................................................................... 2\nThe Bluetooth\u00ae Audio Transmitter .............................................................. 4\nFeatures .........................................................................................................4\nPackage includes ..........................................................................................6","If you are using headphones of the Sennheiser brand, the headphones\u2019 \nLED usually flashes blue and red during pairing. \n2. Press the the Multifunction button on the transmitter for 4 seconds.\nThe transmitter goes into pairing mode and the LED flashes blue and \nred. If pairing is successful, the LED flashes and then lights up blue for \napproximately 3 minutes.\n21\nOFF\nSet to pairing mode\n4sHold\nPairing\nConnected\n... 3min\nIf no connection is established within 5 minutes, pairing mode is"]}
{"question":"What is the number of transmission channels in BTT100 Bluetooth Audio Transmitter?","ground_truth":"79","answer":"The number of transmission channels in the BTT100 Bluetooth Audio Transmitter is 79.","contexts":["2 | BT T100 Bluetooth\u00ae Audio Transmitter","20 | BT T100 Bluetooth\u00ae Audio Transmitter\nSpecifications\nSpecifications\nBluetooth\u00ae Audio Transmitter \nModel: BT T100\nInputs digital input: optical \nsupported data streams:  \nPCM, 44.1 - 48 kHz\/16 - 24 bit\nanalog input: 3.5 mm stereo jack \nsocket\nInput voltage & current USB power supply via USB micro \nB socket \n5 V\u2393,  500 mA\nNumber of transmission channels 79\nOccupied bandwidth 1 channel 1 MHz\nFrequency response 20 Hz - 20 kHz\nWeight 85 g\nTemperature range operation: 0 to 40\u00b0C (32 to 104\u00b0F)","BT T100 Bluetooth\u00ae Audio Transmitter | 7 \nProduct overview\nProduct overview\nOverview of the transmitter (Model: BT T100)\n1 Multifunction button 4 Input Selection switch\n2 LED 5 Digital Optical IN input\n3 Analog 3.5 mm IN input 6 USB micro-B input socket (power)\nUSB-B\nPower\nDigital Optical\nIN\nInput\nSelection\nAnalog\n3.5 mm\nIN\nUSB\nPower\nDigital Optical\nIN\nInput\nSelection\nAnalog\n3.5 mm\nIN\n2\n3\n1\n4 65\nUSB-B\nPower\nDigital Optical\nIN\nInput\nSelection\nAnalog\n3.5 mm\nIN\nUSB\nPower\nDigital Optical\nIN\nInput","12 | BT T100 Bluetooth\u00ae Audio Transmitter\nGetting started\nPairing the transmitter to the headphones\/earphones\nCAUTION\nDanger of malfunction!\nThe transmitted radio waves of Bluetooth devices can impair \nthe operation of sensitive and unprotected devices.\n X Only use Bluetooth devices in locations where wireless \ntransmission is permitted.\nThe transmitter can save the connection profiles of up to eight Bluetooth \nheadphones. If you pair the transmitter to the ninth headphones, the saved","BT T100 Bluetooth\u00ae Audio Transmitter | 9 \nGetting started\nConnection to an audio source using the digital optical cable\nTo achieve the best possible listening experience, we recommend that \nyou connect the Bluetooth\u00ae Audio Transmitter to your home cinema or hi-fi \nsystem using the supplied digital optical cable.\nYour Bluetooth\u00ae Audio Transmitter allows digital audio streaming using \nonly PCM audio output from devices connected through the digital optical","Instruction Manual\nBT T100 \nBluetooth\u00ae\nAudio Transmitter \nModel: BT T100","BT T100 Bluetooth\u00ae Audio Transmitter | 1 \nTable of content\nTable of content\nImportant safety instructions ..................................................................... 2\nThe Bluetooth\u00ae Audio Transmitter .............................................................. 4\nFeatures .........................................................................................................4\nPackage includes ..........................................................................................6","BT T100 Bluetooth\u00ae Audio Transmitter | 11 \nGetting started\nPowering the transmitter\n1. Connect the USB micro B plug of the supplied USB power cable to the \nUSB-B port of the transmitter.\n2. Connect the USB plug to the USB port of your TV or PC. For older TV \nmodels without built-in USB port, connect the USB plug to an external \nUSB power adapter and connect to the power source.\nThe transmitter automatically switches on.\nUSB-B\nPower\nDigital Optical\nIN\nInput\nSelection\nAnalog\n3.5 mm\nIN\nUSB\nPower","BT T100 Bluetooth\u00ae Audio Transmitter | 5 \nThe Bluetooth\u00ae Audio Transmitter\nBluetooth\nThe Bluetooth\u00ae Audio Transmitter complies with the Bluetooth  4.2 standard \nand is compatible with all Bluetooth 1.1, 1.2, 2.0, 2.1, and 3.0 headphones \nwith Advanced Audio Distribution Profile (A2DP) for audio playback.\naptXTM\nWith aptXTM audio coding, you can be assured of crisp, pure and full stereo \nsound. It allows you to not only hear, but experience and feel the audio","16 | BT T100 Bluetooth\u00ae Audio Transmitter\nUsing the transmitter\nPlaying music\/videos\nIf your audio source and headphones support the aptX or aptX LL codec, \nthe Bluetooth\u00ae Audio Transmitter plays your music wirelessly in stunning \naudio quality. If the audio source and headphones do not support any of \nthese audio codecs, the audio is played in standard quality.\nWhen watching videos from a TV\/PC that supports aptX Low Latency"]}
{"question":"What is the weight of BTT100 Bluetooth Audio Transmitter?","ground_truth":"85g.","answer":"The weight of the BTT100 Bluetooth Audio Transmitter is 85 g.","contexts":["2 | BT T100 Bluetooth\u00ae Audio Transmitter","20 | BT T100 Bluetooth\u00ae Audio Transmitter\nSpecifications\nSpecifications\nBluetooth\u00ae Audio Transmitter \nModel: BT T100\nInputs digital input: optical \nsupported data streams:  \nPCM, 44.1 - 48 kHz\/16 - 24 bit\nanalog input: 3.5 mm stereo jack \nsocket\nInput voltage & current USB power supply via USB micro \nB socket \n5 V\u2393,  500 mA\nNumber of transmission channels 79\nOccupied bandwidth 1 channel 1 MHz\nFrequency response 20 Hz - 20 kHz\nWeight 85 g\nTemperature range operation: 0 to 40\u00b0C (32 to 104\u00b0F)","BT T100 Bluetooth\u00ae Audio Transmitter | 1 \nTable of content\nTable of content\nImportant safety instructions ..................................................................... 2\nThe Bluetooth\u00ae Audio Transmitter .............................................................. 4\nFeatures .........................................................................................................4\nPackage includes ..........................................................................................6","BT T100 Bluetooth\u00ae Audio Transmitter | 7 \nProduct overview\nProduct overview\nOverview of the transmitter (Model: BT T100)\n1 Multifunction button 4 Input Selection switch\n2 LED 5 Digital Optical IN input\n3 Analog 3.5 mm IN input 6 USB micro-B input socket (power)\nUSB-B\nPower\nDigital Optical\nIN\nInput\nSelection\nAnalog\n3.5 mm\nIN\nUSB\nPower\nDigital Optical\nIN\nInput\nSelection\nAnalog\n3.5 mm\nIN\n2\n3\n1\n4 65\nUSB-B\nPower\nDigital Optical\nIN\nInput\nSelection\nAnalog\n3.5 mm\nIN\nUSB\nPower\nDigital Optical\nIN\nInput","BT T100 Bluetooth\u00ae Audio Transmitter | 5 \nThe Bluetooth\u00ae Audio Transmitter\nBluetooth\nThe Bluetooth\u00ae Audio Transmitter complies with the Bluetooth  4.2 standard \nand is compatible with all Bluetooth 1.1, 1.2, 2.0, 2.1, and 3.0 headphones \nwith Advanced Audio Distribution Profile (A2DP) for audio playback.\naptXTM\nWith aptXTM audio coding, you can be assured of crisp, pure and full stereo \nsound. It allows you to not only hear, but experience and feel the audio","BT T100 Bluetooth\u00ae Audio Transmitter | 3 \nImportant safety instructions\nIntended use\/Liability\nThe Bluetooth\u00ae Audio Transmitter is suitable for use with hi-fi systems, \nTV sets, PCs, and home cinema systems and supports both analog and \ndigital signals. With this product you can enable a non-Bluetooth-enabled \ndevice to playback audio through Bluetooth wireless headphones.\nIt is considered improper use when this product is used for any application","6 | BT T100 Bluetooth\u00ae Audio Transmitter\nPackage includes\nPackage includes\nBluetooth transmitter\nModel: BT T100\nUSB power cable\nDigital optical cable\nAnalog audio cable\nQuick\nGuide Quick guide\nSafety\nGuide Safety guide\nA list of accessories can be found at www.sennheiser-hearing.com. \nFor information on suppliers, contact your local Sonova Consumer \nHearing partner: www.sennheiser-hearing.com\/service-support.","Instruction Manual\nBT T100 \nBluetooth\u00ae\nAudio Transmitter \nModel: BT T100","BT T100 Bluetooth\u00ae Audio Transmitter | 11 \nGetting started\nPowering the transmitter\n1. Connect the USB micro B plug of the supplied USB power cable to the \nUSB-B port of the transmitter.\n2. Connect the USB plug to the USB port of your TV or PC. For older TV \nmodels without built-in USB port, connect the USB plug to an external \nUSB power adapter and connect to the power source.\nThe transmitter automatically switches on.\nUSB-B\nPower\nDigital Optical\nIN\nInput\nSelection\nAnalog\n3.5 mm\nIN\nUSB\nPower","4 | BT T100 Bluetooth\u00ae Audio Transmitter\nThe Bluetooth\u00ae Audio Transmitter\nThe Bluetooth\u00ae Audio Transmitter\nThe Bluetooth\u00ae Audio Transmitter delivers precise sound reproduction \nthrough Qualcomm\u00ae aptX\u2122 audio technology. \nExpect an even better audio-video experience at home through your \nfavorite headphones. \nFeatures\n\u2022 Supports Qualcomm\u00ae aptX\u2122 for true Hi-Fi sound\n\u2022 Supports Qualcomm\u00ae aptX\u2122 Low Latency for optimized audio-visual \nexperience"]}
{"question":"What does green light in momentum sport's charging case LED indicate with earbuds inserted in? Select the correct answer from A, B, C, D. Only one answer is correct.  A) Earbuds are fully charged, charging case can still charge at least one complete cycle. B) Charging case is fully charged. C) Firmware update is being performed. D) Rechargeable battery of the charging case is almost empty.","ground_truth":"A) Earbuds are fully charged, charging case can still charge at least one complete cycle.","answer":"A) Earbuds are fully charged, charging case can still charge at least one complete cycle.","contexts":["The rechargeable batteries of the earbuds and the charging case \nare being charged.\nIf no earbuds are inserted into the charging case, only the \nrechargeable battery of the charging case is being charged.\nThe LED display of the charging case indicates the charge status:\nLED Charging case WITH \nearbuds inserted\nCharging case \nWITHOUT earbuds \ninserted \npulses \nyellow \nEarbuds and \ncharging case are \nbeing charged.\nCharging case is \nbeing charged.\nlights up \ngreen\nEarbuds and \ncharging case are","The rechargeable batteries of the earbuds and the charging case \nare being charged.\nIf no earbuds are inserted into the charging case, only the \nrechargeable battery of the charging case is being charged.\nThe LED display of the charging case indicates the charge status:\nLED Charging case WITH \nearbuds inserted\nCharging case \nWITHOUT earbuds \ninserted \npulses \nyellow \nEarbuds and \ncharging case are \nbeing charged.\nCharging case is \nbeing charged.\nlights up \ngreen\nEarbuds and \ncharging case are","Product overview\n10 | MOMENTUM Sport\nCharging case LED Charging case WITH \nearbuds inserted\nCharging case \nWITHOUT earbuds \ninserted \nlights up \ngreen\nEarbuds are fully \ncharged, charging \ncase can still charge \nat least one com-\nplete cycle.\nCharging case is \nfully charged.\npulses \nyellow\nEarbuds are being \ncharged via the \nrechargeable bat-\ntery of the charging \ncase.\n\u2013\nlights up \nyellow\nEarbuds are fully \ncharged, charging \ncase is more than \n10% and less than \n50% charged.\nCharging case is","being charged.\nCharging case is \nbeing charged.\nlights up \ngreen\nEarbuds and \ncharging case are \nfully charged.\nCharging case is \nfully charged.\nflashes \nred\nAt least one earbud \nhas a charging \nerror\/battery error \n(> 44).\nCharging case has a \ncharging error\/bat-\ntery error (> 44).\nIf the LED display does not light up:\n\u2022 Clean the contacts on the earbu ds and in the charging case \n(> 41).\n\u2022 Clean the USB-C socket of the charging case.","being charged.\nCharging case is \nbeing charged.\nlights up \ngreen\nEarbuds and \ncharging case are \nfully charged.\nCharging case is \nfully charged.\nflashes \nred\nAt least one earbud \nhas a charging \nerror\/battery error \n(> 44).\nCharging case has a \ncharging error\/bat-\ntery error (> 44).\nIf the LED display does not light up:\n\u2022 Clean the contacts on the earbu ds and in the charging case \n(> 41).\n\u2022 Clean the USB-C socket of the charging case.","inserted \npulses \nyellow\nEarbuds and \ncharging case are \nbeing charged.\nCharging case is \nbeing charged.\nlights up \ngreen\nEarbuds and \ncharging case are \nfully charged.\nCharging case is \nfully charged.\nflashes \nred\nAt least one earbud \nhas a charging \nerror\/battery error \n(> 44).\nCharging case has a \ncharging error\/bat-\ntery error (> 44).\nIf the LED display does not light up:\n\u2022 Clean the contacts on the earbu ds and in the charging case \n(> 41).","inserted \npulses \nyellow\nEarbuds and \ncharging case are \nbeing charged.\nCharging case is \nbeing charged.\nlights up \ngreen\nEarbuds and \ncharging case are \nfully charged.\nCharging case is \nfully charged.\nflashes \nred\nAt least one earbud \nhas a charging \nerror\/battery error \n(> 44).\nCharging case has a \ncharging error\/bat-\ntery error (> 44).\nIf the LED display does not light up:\n\u2022 Clean the contacts on the earbu ds and in the charging case \n(> 41).","earbuds inserted\nCharging case \nWITHOUT earbuds \ninserted \nlights up \ngreen\nEarbuds are fully \ncharged, charging \ncase is more than 50 \n% charged.\nCharging case is \nmore than 50 % \ncharged.\npulses \nyellow\nEarbuds are being \ncharged via the \nrechargeable bat-\ntery of the charging \ncase.\n\u2013\nlights up \nyellow\nEarbuds are fully \ncharged, charging \ncase is less than \n50 % charged.\nCharging case is \ncharged less than \n50 %.\nlights up \nred\nRechargeable bat-\nteries of the earbuds \nand the charging","earbuds inserted\nCharging case \nWITHOUT earbuds \ninserted \nlights up \ngreen\nEarbuds are fully \ncharged, charging \ncase is more than 50 \n% charged.\nCharging case is \nmore than 50 % \ncharged.\npulses \nyellow\nEarbuds are being \ncharged via the \nrechargeable bat-\ntery of the charging \ncase.\n\u2013\nlights up \nyellow\nEarbuds are fully \ncharged, charging \ncase is less than \n50 % charged.\nCharging case is \ncharged less than \n50 %.\nlights up \nred\nRechargeable bat-\nteries of the earbuds \nand the charging","tery charge status of the charging case.\nIf you close the lid of the charging case, the LED display goes off \nafter 5 seconds.\nCharging case LED Charging case WITH \nearbuds inserted\nCharging case \nWITHOUT earbuds \ninserted \nlights up \ngreen\nEarbuds are fully \ncharged, charging \ncase can still charge \nat least one com-\nplete cycle.\nCharging case is \nfully charged.\npulses \nyellow\nEarbuds are being \ncharged via the \nrechargeable bat-\ntery of the charging \ncase.\n\u2013\nlights up \nyellow"]}
{"question":"What does it mean when the Momentum Sport's earbud LED flashes red 3x ? Select the correct answer from A, B, C, D. Only one answer is correct.  A) Rechargeable battery is almost empty. B) Bluetooth pairing or earbud pairing failed. C) System error is present. Perform a reset (see page > 63). D) Bluetooth pairing or earbud pairing was successful.","ground_truth":"B) Bluetooth pairing or earbud pairing failed.","answer":"B) Bluetooth pairing or earbud pairing failed.","contexts":["Earbuds are not connected to a \ndevice via Bluetooth or the connec-\ntion has been interrupted.\nflashes red \nquickly\nRechargeable battery is almost \nempty.\nflashes red \nslowly\nSystem error is present. Perform a \nreset (see page > 63).\nflashes red-\ngreen\nEarbuds are in earbud pairing mode \n(peer pairing mode) to pair the right \nand left earbud.\nflashes green-\npurple\nFirmware update is being per-\nformed.\nflashes red-\npurple (left \nearbud only)\nFirmware update of the sensors is","Product overview\nMOMENTUM Sport  | 11\nOverview of the LED indications of the \nearbuds\nEarbud LED Meaning\nflashes red-blue \nfor approx. \n2m i n u t e s\nEarbuds are in Bluetooth pairing \nmode.\nflashes blue 3x Bluetooth pairing or earbud pairing \nwas successful.\nflashes red 3x Bluetooth pairing or earbud pairing \nfailed.\nlights up blue Earbuds are connected to a device \nvia Bluetooth.\nlights up red\nEarbuds are not connected to a \ndevice via Bluetooth or the connec-\ntion has been interrupted.","Earbuds are not connected to a \ndevice via Bluetooth or the connec-\ntion has been interrupted.\nflashes red \nquickly\nRechargeable battery is almost \nempty.\nflashes red \nslowly\nSystem error is present. Perform a \nreset (> 47).\nflashes red-\ngreen for \napprox. 1 minute \nEarbuds are in earbud pairing mode \n(to pair the right and left earbud).\nWhen you insert the earbuds into your ears, the LEDs of the \nearbuds automatically go off.\nWhen you do not insert the earbuds into your ears, the LEDs of","Earbuds are not connected to a \ndevice via Bluetooth or the connec-\ntion has been interrupted.\nflashes red \nquickly\nRechargeable battery is almost \nempty.\nflashes red \nslowly\nSystem error is present. Perform a \nreset (> 47).\nflashes red-\ngreen for \napprox. 1 minute \nEarbuds are in earbud pairing mode \n(to pair the right and left earbud).\nWhen you insert the earbuds into your ears, the LEDs of the \nearbuds automatically go off.\nWhen you do not insert the earbuds into your ears, the LEDs of","Product overview\n10 | MOMENTUM True Wireless 4\nOverview of the LED indications of the \nearbuds\nLED Meaning\nflashes red-blue \nfor approx. \n2m i n u t e s  \nEarbuds are in Bluetooth pairing \nmode.\nflashes blue 3x Bluetooth pairing or earbud pairing \nwas successful.\nflashes red 3x Bluetooth pairing or earbud pairing \nfailed.\nlights up blue Earbuds are connected to a device \nvia Bluetooth.\nlights up red\nEarbuds are not connected to a \ndevice via Bluetooth or the connec-\ntion has been interrupted.","Product overview\n10 | MOMENTUM True Wireless 4\nOverview of the LED indications of the \nearbuds\nLED Meaning\nflashes red-blue \nfor approx. \n2m i n u t e s  \nEarbuds are in Bluetooth pairing \nmode.\nflashes blue 3x Bluetooth pairing or earbud pairing \nwas successful.\nflashes red 3x Bluetooth pairing or earbud pairing \nfailed.\nlights up blue Earbuds are connected to a device \nvia Bluetooth.\nlights up red\nEarbuds are not connected to a \ndevice via Bluetooth or the connec-\ntion has been interrupted.","Product overview\n10 | MOMENTUM 4\nOverview of the LED display\nDuring operation\nDuring phone calls\nDuring charging\nLED Meaning\/headphones...\nwhite \nflashes 3x\n... switch on.\n... are connected to a device via Blue-\ntooth.\nwhite\ncontinuous \nsequence\n... are in Bluetooth pairing mode.\nred \nflashes 3x ... switch off.\nLED Meaning\nwhite \nflashes 3x \nrepeatedly\nIncoming call\nred \nflashes 3x \nrepeatedly\nIncoming call with an almost empty \nbattery\nLED Meaning\n1 red Rechargeable battery is almost empty","apps. Minimal effort with no additional equipment. \nlights up \nred\nRechargeable bat-\ntery of the charging \ncase is almost \nempty. The earbuds \ncannot be charged.\nRechargeable bat-\ntery of the charging \ncase is almost \nempty.\nflashes \nred\nAt least one earbud \nhas a charging \nerror\/battery error \n(see page > 60).\nCharging case has a \ncharging error\/bat-\ntery error (see page \n> 60).\nCharging case LED Charging case WITH \nearbuds inserted\nCharging case \nWITHOUT earbuds \ninserted","devices (headphones and e.g. smartphone) once. This process is \ncalled pairing.\nIf operation differs from the steps mentioned, also refer to the \ninstruction manual of the Bluetooth device you are using.\nLED Meaning\n1 red Rechargeable battery is almost empty \n(less than 2% charged)\n1 white\nRechargeable battery is approx. 2-20% \ncharged \n(>1 hour of playback time)\n2 white\nRechargeable battery is approx. \n20-40% charged \n(>12 hours of playback time)\n3 white\nRechargeable battery is approx.","green\nEarbuds and \ncharging case are \nfully charged.\nCharging case is \nfully charged.\nflashes \nred \nAt least one earbud \nhas a charging \nerror\/battery error \n(> 44).\nCharging case has a \ncharging error\/bat-\ntery error (> 44).\n 5s"]}
{"question":"What does 'Podcast' voice prompt mean in Momentum Sport?","ground_truth":"Equalizer preset for podcasts is activated (improved speech intelligibility).","answer":"I don't know.","contexts":["Product overview\n14 | MOMENTUM Sport\nNotes on voice prompts\nThe earbuds output voice prompts for events (the table gives some \nexamples). Using the Smart Control app, you can choose between \nvoice prompts and beep sounds, or deactivate the status messages \nwith a few exceptions (e.g. rechargeable battery is empty). \nVoice prompt Meaning\n\u201cPower on\u201d Earbuds are switched on.\n\u201cPower off\u201d Earbuds switch off.\n\u201cConnected\u201d Earbuds are connected via Blue-\ntooth.","Product overview\nMOMENTUM True Wireless 4  | 11\nNotes on voice prompts\nThe earbuds output voice prompts for events (the table gives some \nexamples). Using the Smart Control app, you can change the lan-\nguage of the voice prompts, choose between voice prompts and \nbeep sounds, or deactivate the status messages with a few excep-\ntions (e.g. rechargeable battery is empty). \nVoice prompt Meaning\n\u201cPower on\u201d Earbuds are switched on.\n\u201cPower off\u201d Earbuds switch off.","Product overview\nMOMENTUM True Wireless 4  | 11\nNotes on voice prompts\nThe earbuds output voice prompts for events (the table gives some \nexamples). Using the Smart Control app, you can change the lan-\nguage of the voice prompts, choose between voice prompts and \nbeep sounds, or deactivate the status messages with a few excep-\ntions (e.g. rechargeable battery is empty). \nVoice prompt Meaning\n\u201cPower on\u201d Earbuds are switched on.\n\u201cPower off\u201d Earbuds switch off.","Product overview\nMOMENTUM 4  | 11\nOverview of sound signals and voice prompts\nThe headphones output voice prompts and sound signals in case of \nvarious events.\nYou hear short sound signals when the headphones\n\u2022 are switched on or off,\n\u2022 are put on or taken off,\n\u2022 are in pairing mode (melody),\n\u2022 detect devices in the pairing list,\n\u2022 cancel the pairing process,\n\u2022 receive a gesture via the touch pad (increasing the volume, start-\ning\/pausing music playback, accepting\/holding\/rejecting calls,","Using the earbuds\nMOMENTUM Sport  | 41\nAdjusting the playback pause in the \nTransparency Mode\nYou can select how audio playback behaves when the Transparency \nMode is activated. To be able to adjust this setting, you require the \nSmart Control app (see page > 28).\n\u25b7 Make sure that the Transparency Mode is activated (see \npage > 39).\n\u25b7 In the Smart Control app, select the desired setting for audio play-\nback in the \u201cNoise settings\u201d area:\n*default setting\nUsing the voice assistant\/voice dialing","Using the earbuds\nMOMENTUM Sport  | 45\nIf you receive a call during audio playback, playback is paused until \nyou end the call or reject the call.\nYou can also accept calls if you are connected to two Bluetooth\ndevices at the same time (multipoint function) (see page > 23). \nExample:\n\u2022 You are listening to music via the playback function of smart-\nphone 1.\n\u2022 You receive a call on smartphone 2.\nYou hear the ring tone in your earbuds.","Voice prompt Meaning\n\u201cPower on\u201d Earbuds are switched on.\n\u201cPower off\u201d Earbuds switch off.\n\u201cConnected\u201d Earbuds are connected via Blue-\ntooth.\n\u201cNo connection\u201d Earbuds are not connected via \nBluetooth.\n\u201cPairing\u201d Earbuds are in Bluetooth pairing \nmode.\n\u201cPairing cancelled\u201d Bluetooth pairing mode was can-\ncelled.\n\u201cPairing successful\u201d Bluetooth pairing was successful.\n\u201cPairing failed\u201d Bluetooth pairing was not success-\nful.\n\u201cRecharge headset\u201d Rechargeable battery is almost","Voice prompt Meaning\n\u201cPower on\u201d Earbuds are switched on.\n\u201cPower off\u201d Earbuds switch off.\n\u201cConnected\u201d Earbuds are connected via Blue-\ntooth.\n\u201cNo connection\u201d Earbuds are not connected via \nBluetooth.\n\u201cPairing\u201d Earbuds are in Bluetooth pairing \nmode.\n\u201cPairing cancelled\u201d Bluetooth pairing mode was can-\ncelled.\n\u201cPairing successful\u201d Bluetooth pairing was successful.\n\u201cPairing failed\u201d Bluetooth pairing was not success-\nful.\n\u201cRecharge headset\u201d Rechargeable battery is almost","Product overview\n8 | MOMENTUM Sport\nEarbuds\nModel: MSPORT1 R and MSPORT1 L\nLeft earbud L \nBuilt-in rechargeable battery\nTouch control panel\nTap control sensors\nMicrophones \nfor the active noise cancellation ANC, for the perception of \nyour surroundings (\u201cTransparency Mode\u201d) and for phone \ncalls\nChangeable ear fins \nfor the secure fit of the earbuds in the ears\nChangeable silicone ear tips, \ntransparent for sensor function\nSensors for body temperature measurement and heart rate","Specifications\n64 | MOMENTUM Sport\nSpecifications\nMOMENTUM Sport\nModel: MSPORT1, MSPORT1 R, MSPORT1 L, MSPORT1 C\nWearing style True Wireless stereo earbuds\nEar coupling ear canal, semi-open\nFrequency response 15 Hz to 18 kHz\nTransducer principle dynamic\nTransducer size 10 mm\nSound pressure level (SPL) 110 dB (1 kHz\/0 dBFS)\nTHD \n(1 kHz, 94 dB SPL)\n< 0.25% (1 kHz\/94 dB)\nNoise cancellation Hybrid Adaptive ANC technology\nMicrophone principle MEMS\nMicrophone frequency \nresponse\n100 Hz to 10 kHz"]}
{"question":"What is Momentum Sport's microphone frequency?","ground_truth":"100 Hz to 10 kHz.","answer":"100 Hz to 10 kHz","contexts":["Specifications\n64 | MOMENTUM Sport\nSpecifications\nMOMENTUM Sport\nModel: MSPORT1, MSPORT1 R, MSPORT1 L, MSPORT1 C\nWearing style True Wireless stereo earbuds\nEar coupling ear canal, semi-open\nFrequency response 15 Hz to 18 kHz\nTransducer principle dynamic\nTransducer size 10 mm\nSound pressure level (SPL) 110 dB (1 kHz\/0 dBFS)\nTHD \n(1 kHz, 94 dB SPL)\n< 0.25% (1 kHz\/94 dB)\nNoise cancellation Hybrid Adaptive ANC technology\nMicrophone principle MEMS\nMicrophone frequency \nresponse\n100 Hz to 10 kHz","Specifications\nMOMENTUM 4  | 41\nSpecifications\nModel: M4AEBT\nBluetooth\nWearing style Bluetooth\u00ae around-ear, closed-back\nEar coupling circum-aural\nTransducer principle dynamic\nTransducer 42 mm\nFrequency response 6 Hz to 22,000 Hz (\u201310 dB)\nSound pressure level (SPL) 106 dB (1 kHz\/0 dBFS)\nTHD (1 kHz, 100 dB SPL) < 0.3 % (1 kHz, 100 dB SPL)\nMicrophone principle MEMS\nMicrophone frequency \nresponse\n80 Hz to 8,000 Hz (\u20133 dB)\nMicrophone pick-up pat-\ntern (speech audio)\n4 omni-directional microphones","Transmission frequency 2,402 MHz to 2,480 MHz\nModulation GFSK, \u03c0\/4 DQPSK, 8DPSK\nProfiles AVRCP, A2DP, HFP\nOutput power 16 mW (max)\nCodec aptX\u2122, aptX\u2122 Adaptive, AAC, SBC\nDevice name MOMENTUM Sport\nNumber of active connec-\ntions\n2\nRequired apps Sennheiser Smart Control for Android \nand iOS \nPolar Flow\u00ae for full use of the sensor \ndata","Specifications\n48 | MOMENTUM True Wireless 4\nSpecifications\nMOMENTUM True Wireless 4\nModel: MTW4, MTW4 R, MTW4 L, MTW4 C\nWearing style True Wireless stereo earbuds\nEar coupling ear-canal\nFrequency response 5 Hz to 21 kHz\nTransducer principle dynamic\nTransducer size 7 mm\nSound pressure level (SPL) 107 dB (1 kHz\/1 mW)\nTHD (1 kHz, 94 dB SPL) < 0.08 % (1 kHz\/94 dB)\nNoise cancellation Hybrid Adaptive ANC technology\nMicrophone principle MEMS\nMicrophone frequency \nresponse\n100 Hz to 10 kHz","Specifications\n48 | MOMENTUM True Wireless 4\nSpecifications\nMOMENTUM True Wireless 4\nModel: MTW4, MTW4 R, MTW4 L, MTW4 C\nWearing style True Wireless stereo earbuds\nEar coupling ear-canal\nFrequency response 5 Hz to 21 kHz\nTransducer principle dynamic\nTransducer size 7 mm\nSound pressure level (SPL) 107 dB (1 kHz\/1 mW)\nTHD (1 kHz, 94 dB SPL) < 0.08 % (1 kHz\/94 dB)\nNoise cancellation Hybrid Adaptive ANC technology\nMicrophone principle MEMS\nMicrophone frequency \nresponse\n100 Hz to 10 kHz","Product overview\n8 | MOMENTUM Sport\nEarbuds\nModel: MSPORT1 R and MSPORT1 L\nLeft earbud L \nBuilt-in rechargeable battery\nTouch control panel\nTap control sensors\nMicrophones \nfor the active noise cancellation ANC, for the perception of \nyour surroundings (\u201cTransparency Mode\u201d) and for phone \ncalls\nChangeable ear fins \nfor the secure fit of the earbuds in the ears\nChangeable silicone ear tips, \ntransparent for sensor function\nSensors for body temperature measurement and heart rate","Microphone principle MEMS\nMicrophone frequency \nresponse\n100 Hz to 10 kHz\nMicrophone pick-up pattern \n(speech and ANC)\n3 microphones per earbud\nbeamforming array for active noise \ncancellation \nPower supply built-in lithium rechargeable \nbatteries:\nearbuds (R and L): \n3.8 V , 72 mAh, 0.274 Wh or \n3.85 V , 87 mAh, 0.335 Wh\ncharging case: \n3.6 V , 820 mAh, 2.952 Wh or\n3.6 V , 900 mAh, 3.24 Wh\ninput:\nearbuds (R and L): \n5 V , max. 100 mA\ncharging case: 5 V , max. 1000 mA\noutput:","Specifications\nMOMENTUM Sport  | 65\nBluetooth\nTemperature range operation: 0 to +40\u00b0C\ncharging: +5 to +35\u00b0C\nstorage: \u201320 to +60\u00b0C\nRelative humidity operation: 10 to 80%, non condensing\nstorage: 10 to 90%\nMagnetic field strength earbuds: 1.86 mT\ncharging case: 250 mT\nIngress protection of the \nearbuds\nearbuds: IP55\ncharging case: IP54\nWeight earbuds: 6.4 g each (with N-size ring \nand M-size ear tip)\ncharging case: 78.4 g\nboth earbuds and charging case: 91 g","Microphone principle MEMS\nMicrophone frequency \nresponse\n100 Hz to 10 kHz\nMicrophone pick-up pattern \n(speech and ANC)\n3 microphones per earbud\nbeamforming array for active noise \ncancellation \nPower supply built-in lithium rechargeable batter-\nies:\nearbuds (R and L): \n3.66 V , 75 mAh, 0.28 Wh or\n3.8 V , 72 mAh, 0.274 Wh\ncharging case: \n3.6 V , 820 mAh, 2.952 Wh\ninput:\nearbuds (R and L): \n5 V , max. 100 mA\ncharging case: 5 V , max. 1000 mA\noutput:\nearbuds (R and L): none\ncharging case:","Microphone principle MEMS\nMicrophone frequency \nresponse\n100 Hz to 10 kHz\nMicrophone pick-up pattern \n(speech and ANC)\n3 microphones per earbud\nbeamforming array for active noise \ncancellation \nPower supply built-in lithium rechargeable batter-\nies:\nearbuds (R and L): \n3.66 V , 75 mAh, 0.28 Wh or\n3.8 V , 72 mAh, 0.274 Wh\ncharging case: \n3.6 V , 820 mAh, 2.952 Wh\ninput:\nearbuds (R and L): \n5 V , max. 100 mA\ncharging case: 5 V , max. 1000 mA\noutput:\nearbuds (R and L): none\ncharging case:"]}
{"question":"What is the transducer size in Momentum True Wireless 4 earbuds?","ground_truth":"7mm","answer":"The transducer size in Momentum True Wireless 4 earbuds is 7 mm.","contexts":["Specifications\n48 | MOMENTUM True Wireless 4\nSpecifications\nMOMENTUM True Wireless 4\nModel: MTW4, MTW4 R, MTW4 L, MTW4 C\nWearing style True Wireless stereo earbuds\nEar coupling ear-canal\nFrequency response 5 Hz to 21 kHz\nTransducer principle dynamic\nTransducer size 7 mm\nSound pressure level (SPL) 107 dB (1 kHz\/1 mW)\nTHD (1 kHz, 94 dB SPL) < 0.08 % (1 kHz\/94 dB)\nNoise cancellation Hybrid Adaptive ANC technology\nMicrophone principle MEMS\nMicrophone frequency \nresponse\n100 Hz to 10 kHz","Specifications\n48 | MOMENTUM True Wireless 4\nSpecifications\nMOMENTUM True Wireless 4\nModel: MTW4, MTW4 R, MTW4 L, MTW4 C\nWearing style True Wireless stereo earbuds\nEar coupling ear-canal\nFrequency response 5 Hz to 21 kHz\nTransducer principle dynamic\nTransducer size 7 mm\nSound pressure level (SPL) 107 dB (1 kHz\/1 mW)\nTHD (1 kHz, 94 dB SPL) < 0.08 % (1 kHz\/94 dB)\nNoise cancellation Hybrid Adaptive ANC technology\nMicrophone principle MEMS\nMicrophone frequency \nresponse\n100 Hz to 10 kHz","Product overview\nMOMENTUM True Wireless 4  | 7\nEarbuds\nModel: MTW4 R and MTW4 L\nMicrophones for the active noise cancellation ANC, for the \nperception of your surroundings (\u201cTransparency Mode\u201d) \nand for phone calls\nTouch control panel\nStatus LED\nLeft earbud L \nRight earbud R\nChangeable silicone ear adapters\nInfra-red proximity sensor\nMagnetic holders\nCharging contacts\nBuilt-in rechargeable battery\nChangeable ear fins for a secure fit of the earbuds in the \nears\nA\nE\nH\nI\nC\nB\n0\nG G\nF\nJ\n0\nG\nH\nI\nJ\nG","Product overview\nMOMENTUM True Wireless 4  | 7\nEarbuds\nModel: MTW4 R and MTW4 L\nMicrophones for the active noise cancellation ANC, for the \nperception of your surroundings (\u201cTransparency Mode\u201d) \nand for phone calls\nTouch control panel\nStatus LED\nLeft earbud L \nRight earbud R\nChangeable silicone ear adapters\nInfra-red proximity sensor\nMagnetic holders\nCharging contacts\nBuilt-in rechargeable battery\nChangeable ear fins for a secure fit of the earbuds in the \nears\nA\nE\nH\nI\nC\nB\n0\nG G\nF\nJ\n0\nG\nH\nI\nJ\nG","both earbuds and charging case: \napprox. 78 g\nVersion Bluetooth 5.4 certified, class 1\nTransmission frequency Classic BDR\/EDR and BLE 1M:\n2,402 MHz to 2,480 MHz\nBLE 2M: 2,404 MHz to 2,478 MHz \n(without 2,426 MHz)\nModulation GFSK, \u03c0\/4 DQPSK, 8DPSK\nProfiles AVRCP, A2DP, HFP, TMAP, PBP\nOutput power 10 mW (max)\nCodec aptX\u2122, aptX\u2122 Adaptive\/Lossless, \nAAC, SBC, Auracast\u2122 Broadcast \nAudio, LC3\nDevice name MOMENTUM TW 4\nNumber of active connec-\ntions\n2","both earbuds and charging case: \napprox. 78 g\nVersion Bluetooth 5.4 certified, class 1\nTransmission frequency Classic BDR\/EDR and BLE 1M:\n2,402 MHz to 2,480 MHz\nBLE 2M: 2,404 MHz to 2,478 MHz \n(without 2,426 MHz)\nModulation GFSK, \u03c0\/4 DQPSK, 8DPSK\nProfiles AVRCP, A2DP, HFP, TMAP, PBP\nOutput power 10 mW (max)\nCodec aptX\u2122, aptX\u2122 Adaptive\/Lossless, \nAAC, SBC, Auracast\u2122 Broadcast \nAudio, LC3\nDevice name MOMENTUM TW 4\nNumber of active connec-\ntions\n2","Specifications\n64 | MOMENTUM Sport\nSpecifications\nMOMENTUM Sport\nModel: MSPORT1, MSPORT1 R, MSPORT1 L, MSPORT1 C\nWearing style True Wireless stereo earbuds\nEar coupling ear canal, semi-open\nFrequency response 15 Hz to 18 kHz\nTransducer principle dynamic\nTransducer size 10 mm\nSound pressure level (SPL) 110 dB (1 kHz\/0 dBFS)\nTHD \n(1 kHz, 94 dB SPL)\n< 0.25% (1 kHz\/94 dB)\nNoise cancellation Hybrid Adaptive ANC technology\nMicrophone principle MEMS\nMicrophone frequency \nresponse\n100 Hz to 10 kHz","Specifications\nMOMENTUM 4  | 41\nSpecifications\nModel: M4AEBT\nBluetooth\nWearing style Bluetooth\u00ae around-ear, closed-back\nEar coupling circum-aural\nTransducer principle dynamic\nTransducer 42 mm\nFrequency response 6 Hz to 22,000 Hz (\u201310 dB)\nSound pressure level (SPL) 106 dB (1 kHz\/0 dBFS)\nTHD (1 kHz, 100 dB SPL) < 0.3 % (1 kHz, 100 dB SPL)\nMicrophone principle MEMS\nMicrophone frequency \nresponse\n80 Hz to 8,000 Hz (\u20133 dB)\nMicrophone pick-up pat-\ntern (speech audio)\n4 omni-directional microphones","Specifications\nMOMENTUM True Wireless 4  | 49\nBluetooth\nTemperature range operation: 0 to +40 \u00b0C\ncharging: +5 to +35 \u00b0C\nstorage: \u201320 to +60 \u00b0C\nRelative humidity operation: 25 to 75 %, non condensing\nstorage: 10 to 90 %\nMagnetic field strength earbuds: 0.95 mT\ncharging case: 105 mT\nIngress protection of the \nearbuds splash proof (IP54)\nWeight earbuds: approx. 6 g each\ncharging case: approx. 66 g\nboth earbuds and charging case: \napprox. 78 g\nVersion Bluetooth 5.4 certified, class 1","Specifications\nMOMENTUM True Wireless 4  | 49\nBluetooth\nTemperature range operation: 0 to +40 \u00b0C\ncharging: +5 to +35 \u00b0C\nstorage: \u201320 to +60 \u00b0C\nRelative humidity operation: 25 to 75 %, non condensing\nstorage: 10 to 90 %\nMagnetic field strength earbuds: 0.95 mT\ncharging case: 105 mT\nIngress protection of the \nearbuds splash proof (IP54)\nWeight earbuds: approx. 6 g each\ncharging case: approx. 66 g\nboth earbuds and charging case: \napprox. 78 g\nVersion Bluetooth 5.4 certified, class 1"]}
{"question":"What should you do to reset MOMENTUM True Wireless 4 earbuds to factory settings?","ground_truth":"To reset, disconnect all Bluetooth connections, place one earbud in the charging case, and hold the touch panel of the other earbud for 15 seconds.","answer":"To reset MOMENTUM True Wireless 4 earbuds to factory settings, you can either use the Smart Control app or manually by inserting the earbuds into the charging case, closing the lid, and waiting for at least 10 seconds for the earbuds to restart.","contexts":["FAQ\/If a problem occurs ...\nMOMENTUM True Wireless 4  | 47\nResetting the earbuds to the factory default settings\nIf the function of the earbuds is disturbed and a reset (> 46) does not \nimprove, reset the earbuds to the factory default settings. This \ndeletes, among other things, all pairing settings.\nThe easiest way to reset the earbuds to the factory default settings \nis using the Smart Control app.\nAlternatively, you can manually proceed as follows:","FAQ\/If a problem occurs ...\nMOMENTUM True Wireless 4  | 47\nResetting the earbuds to the factory default settings\nIf the function of the earbuds is disturbed and a reset (> 46) does not \nimprove, reset the earbuds to the factory default settings. This \ndeletes, among other things, all pairing settings.\nThe easiest way to reset the earbuds to the factory default settings \nis using the Smart Control app.\nAlternatively, you can manually proceed as follows:","FAQ\/If a problem occurs ...\n46 | MOMENTUM True Wireless 4\nResetting the earbuds\nIf the function of the earbuds is disturbed, perform a reset. Individual \nsettings such as the pairing settings are not deleted.\n\u25b7 Insert the earbuds into the charging case and close the lid. \nAfter 10 seconds, the earbuds will restart (reset).\n10s","FAQ\/If a problem occurs ...\n46 | MOMENTUM True Wireless 4\nResetting the earbuds\nIf the function of the earbuds is disturbed, perform a reset. Individual \nsettings such as the pairing settings are not deleted.\n\u25b7 Insert the earbuds into the charging case and close the lid. \nAfter 10 seconds, the earbuds will restart (reset).\n10s","FAQ\/If a problem occurs ...\nMOMENTUM Sport  | 63\nResetting the earbuds to the factory default settings\nIf the function of the earbuds is disturbed and a reset (see page > 62) \ndoes not improve, reset the earbuds to the factory default settings. \nThis deletes, among other things, all pairing settings.\nThe easiest way to reset the earbuds to the factory default settings \nis using the Smart Control app.\nAlternatively, you can manually proceed as follows:","FAQ\/If a problem occurs ...\nMOMENTUM True Wireless 4  | 45\nFAQ\/If a problem occurs ...\nIf a problem has occurred, proceed in the following order until the \nproblem is solved and you can use the earbuds again:\n1. Insert the earbuds into the char ging case and close the lid. Wait\nfor at least 10 seconds (> 46). \n2. Connect the earbuds to the Smart Control app to install the latest\nfirmware (> 44).\n3. Reset the earbuds to the factory default settings (> 47).","FAQ\/If a problem occurs ...\nMOMENTUM True Wireless 4  | 45\nFAQ\/If a problem occurs ...\nIf a problem has occurred, proceed in the following order until the \nproblem is solved and you can use the earbuds again:\n1. Insert the earbuds into the char ging case and close the lid. Wait\nfor at least 10 seconds (> 46). \n2. Connect the earbuds to the Smart Control app to install the latest\nfirmware (> 44).\n3. Reset the earbuds to the factory default settings (> 47).","FAQ\/If a problem occurs ...\n62 | MOMENTUM Sport\nResetting the earbuds\nIf the function of the earbuds is disturbed, perform a reset. Individual \nsettings such as the pairing settings are not deleted.\n\u25b7 Insert the earbuds into the charging case and close the lid. \nAfter 10 seconds, the earbuds will restart (reset).\n10s\nL\nR","firmware (> 44).\n3. Reset the earbuds to the factory default settings (> 47).\n4. Check the list of frequently asked questions to see if there is a\nsolution to the problem (> 45).\n5. Contact your Sonova Consumer  Hearing partner to solve the\nproblem (> 45).\nCurrent list of frequently asked questions (FAQ)\nVisit the MOMENTUM True Wireless 4 product page at\nwww.sennheiser-hearing.com\nThere you will find a current list of frequently asked questions (FAQ) \nand suggested solutions.","firmware (> 44).\n3. Reset the earbuds to the factory default settings (> 47).\n4. Check the list of frequently asked questions to see if there is a\nsolution to the problem (> 45).\n5. Contact your Sonova Consumer  Hearing partner to solve the\nproblem (> 45).\nCurrent list of frequently asked questions (FAQ)\nVisit the MOMENTUM True Wireless 4 product page at\nwww.sennheiser-hearing.com\nThere you will find a current list of frequently asked questions (FAQ) \nand suggested solutions."]}
{"question":"How can you switch to Transparency Mode on MOMENTUM True Wireless 4 earbuds?","ground_truth":"To switch to Transparency Mode, tap the touch control panel of the left earbud once.","answer":"To switch to Transparency Mode on MOMENTUM True Wireless 4 earbuds, tap the touch control panel of the left earbud once.","contexts":["Using the earbuds\nMOMENTUM Sport  | 41\nAdjusting the playback pause in the \nTransparency Mode\nYou can select how audio playback behaves when the Transparency \nMode is activated. To be able to adjust this setting, you require the \nSmart Control app (see page > 28).\n\u25b7 Make sure that the Transparency Mode is activated (see \npage > 39).\n\u25b7 In the Smart Control app, select the desired setting for audio play-\nback in the \u201cNoise settings\u201d area:\n*default setting\nUsing the voice assistant\/voice dialing","Using the earbuds\n32 | MOMENTUM True Wireless 4\nListening to ambient sounds or \nconversations - activating\/deactivating \nthe Transparency Mode\nWith the Transparency Mode activated, you can hear ambient \nsounds or communicate without having to remove the earbuds from \nyour ears. This allows you to hear e.g. announcements in the train or \naircraft or to have short conversations.\nWith the Smart Control app, you can adjust the intensity of the","Using the earbuds\n32 | MOMENTUM True Wireless 4\nListening to ambient sounds or \nconversations - activating\/deactivating \nthe Transparency Mode\nWith the Transparency Mode activated, you can hear ambient \nsounds or communicate without having to remove the earbuds from \nyour ears. This allows you to hear e.g. announcements in the train or \naircraft or to have short conversations.\nWith the Smart Control app, you can adjust the intensity of the","Using the earbuds\n40 | MOMENTUM Sport\nChanging the mode\nTo change the noise settings:\n\u25b7 Briefly tap 3x on the control panel or near the left earbud.\nThe earbuds switch between the modes ANC, Anti-wind and \nTransparency.\nDepending on your selection, you hear the voice prompt \u201cANC\u201d, \n\u201cAnti-wind\u201d or \u201cTransparency\u201d.\nNoise setting Effect Application example\nTranspar-\nency Mode\nAudio playback is mixed with \nambient sounds.\nDuring conversa-\ntions or when moving \nin traffic","Using the earbuds\n28 | MOMENTUM True Wireless 4\nSwitching the earbuds on\n\u25b7 Open the lid of the charging case and take out both earbuds.\n\u25b7 Insert the earbuds into your ears (> 27). \nIf a paired Bluetooth device is within the transmission range, you \nhear the voice prompts \u201cPower On\u201d and \u201cConnected\u201d. The LEDs \nof the earbuds light up blue.\nWARNING\nDanger due to high volume levels!\nListening at high volume levels can lead to permanent \nhearing defects.","Using the earbuds\n28 | MOMENTUM True Wireless 4\nSwitching the earbuds on\n\u25b7 Open the lid of the charging case and take out both earbuds.\n\u25b7 Insert the earbuds into your ears (> 27). \nIf a paired Bluetooth device is within the transmission range, you \nhear the voice prompts \u201cPower On\u201d and \u201cConnected\u201d. The LEDs \nof the earbuds light up blue.\nWARNING\nDanger due to high volume levels!\nListening at high volume levels can lead to permanent \nhearing defects.","Using the headphones\n24 | MOMENTUM 4\nThe Transparency Mode optimally complements the active noise \ncancellation ANC. Via the adjustable intensity of the Transparency \nMode and the active noise cancellation ANC, you can determine how \nmuch ambient noise reaches your ears or whether you want to listen \nexclusively to your music (ANC at full intensity). \nIf you use the Transparency Mode at full intensity, disturbing sounds, \ne.g. low-frequency noise such as aircraft noise, are always sup-","With the Smart Control app, you can adjust the intensity of the \nTransparency Mode. This allows you to determine to which extent \nambient noise reaches your ears. \n\u25b7 Tap the touch control panel of the left earbud 1x.\nThe Transparency Mode set in the Smart Control app is activated. \nYou can hear ambient sounds without having to remove the ear-\nbuds from your ears.\nTo deactivate the Transparency Mode:\n\u25b7 Tap the touch control panel of the left earbud 1x.\nAdjusting the playback pause in the","With the Smart Control app, you can adjust the intensity of the \nTransparency Mode. This allows you to determine to which extent \nambient noise reaches your ears. \n\u25b7 Tap the touch control panel of the left earbud 1x.\nThe Transparency Mode set in the Smart Control app is activated. \nYou can hear ambient sounds without having to remove the ear-\nbuds from your ears.\nTo deactivate the Transparency Mode:\n\u25b7 Tap the touch control panel of the left earbud 1x.\nAdjusting the playback pause in the","Product overview\nMOMENTUM True Wireless 4  | 7\nEarbuds\nModel: MTW4 R and MTW4 L\nMicrophones for the active noise cancellation ANC, for the \nperception of your surroundings (\u201cTransparency Mode\u201d) \nand for phone calls\nTouch control panel\nStatus LED\nLeft earbud L \nRight earbud R\nChangeable silicone ear adapters\nInfra-red proximity sensor\nMagnetic holders\nCharging contacts\nBuilt-in rechargeable battery\nChangeable ear fins for a secure fit of the earbuds in the \nears\nA\nE\nH\nI\nC\nB\n0\nG G\nF\nJ\n0\nG\nH\nI\nJ\nG"]}
{"question":"In the scenario 1 in Network whitepaper what is the only component needing active configuration?","ground_truth":"The only component needing active configuration is the SRV-record in the DNS-Server","answer":"The only component needing active configuration in Scenario 1 in the Network whitepaper is the SRV-record in the DNS-Server.","contexts":["2 \nMobileConnect Network Whitepaper \nVersion 1.0","3 \nMobileConnect Network Whitepaper \nVersion 1.0","Scenarios for network integration Scenario 1 - One port solution  In this scenario, all components (MobileConnect Station, MobileConnect Manager, MobileConnect App clients) are part of the same network. This makes for a very simple setup, light on configuration, as the only component needing active configuration is the SRV-record in the DNS-Server.                 Advantages \u2022 Easy to setup \u2022 No additional hardware\/software needed  Disadvantages \u2022 The server with the MobileConnect Manager is","6 \nMobileConnect Network Whitepaper \nVersion 1.0","4 \nMobileConnect Network Whitepaper \nVersion 1.0","There are two options for network integration scenarios from a system side:  \nOne port solution  \nIn this scenario, all components (MobileConnect Station, MobileConnect Manager, MobileConnect App clients) are part of the same network. This makes for a very simple setup, light on configuration, as the only component needing active configuration is the SRV-record in the DNS-Server.","7 \nMobileConnect Network Whitepaper \nVersion 1.0","12 \nMobileConnect Network Whitepaper \nVersion 1.0","9 \nMobileConnect Network Whitepaper \nVersion 1.0","10 \nMobileConnect Network Whitepaper \nVersion 1.0"]}
{"question":"Why does the first ruleset disallow all access using IPv6?","ground_truth":"Because MobileConnect Manager is currently only supporting IPv4","answer":"The first ruleset disallows all access using IPv6 because the MobileConnect Manager currently only supports IPv4.","contexts":["expect a global configuration file to be located at \/etc\/mcm-iptables.conf. An example file:            Please note that not every option is used in every ruleset. The first ruleset disallows all access using IPv6, as the MobileConnect Manager is currently only supporting IPv4. Using this ruleset is recommended.","The second ruleset allows to add limitations for the ports used for accessing the MobileConnect Manager web interface and for the interfaces used by the MobileConnect Stations. This increases the maintenance overhead, as it needs all MAC addresses of the MobileConnect Stations and the IP addresses of the systems allowed access to the web interface to be added to the configuration file. Nonetheless this configuration is recommended in the one-port setup. As an alternative to this, have","Additionally, connecting a device to a network without internet access limits its usability for other functions, making the system less inclusive.","11 \nMobileConnect Network Whitepaper \nVersion 1.0 \n You can also add this iptables example in the following simple systemd-service.               It will automatically limit the access at boot-time after docker has established its ruleset. It is dynamically configurable, just save it to \/etc\/systemd\/system\/limit_listerinterface@.service and enable it for an interface with systemctl enable limit_listerinterface@<interfacename>.service.","# executable for iptables IPTABLES=\/sbin\/iptables   #executable for ip6tables IP6TABLES=\/sbin\/ip6tables   # space separated list of Mac addresses of MobileConnect Stations CS_MAC_LIST=\"\"   # space separated list of IP addresses allowed to access the web interface ADMIN_IP_LIST=\"\"","#!\/bin\/bash   source \/etc\/mcm-iptables.conf   IP6TABLES=${IP6TABLES:-\/sbin\/ip6tables} PORTS_TO_CLOSE_TCP=\"80 433 8000\"   for PORT in ${PORTS_TO_CLOSE_TCP}; do     ${IP6TABLES} -I FORWARD -p tcp --dport ${PORT} -j REJECT done","\u201cExclusive\u201d for the \ufb01rst WSM?).\n\u2022 The access rights cannot be shared with other WSMs.\n\u2022 \u201cShared\u201d:\n\u2022 All WSMs have the same access rights (see Have you selected \u201cShared\u201d for \nthe \ufb01rst WSM?).\n\u2022 While one WSM is accessing a device (remotely), this device is locked for all \nother WSMs until this action is terminated.\n\u2022 \u201cRemote disable\u201d (no access rights):\n\u2022 The WSM has no access rights.\n\u2022 The WSM is solely used for monitoring.\n15","In this case, the \ufb01rst WSM being registered in the network owns all access rights. In order \nto avoid any collisions, you should deactivate access to the devices for all other WSMs (see \nWithdrawing access rights from a WSM\n).\nIf you should assign \u201cExclusive\u201d access right to several WSMs, then access is \nrandom. The WSM which registers quicker with the device owns all access rights. \nThis can, under certain circumstances, lead to confusion during operation.","configuration as it suits you.  Additional configuration In this scenario the MobileConnect Manager should be additionally secured by using a firewall. The following example uses iptables to implement a simple firewall, limiting access to the MobileConnect Manager and reducing the attack surface. The example consists of several rulesets which are implemented as a set of bash-scripts. The bash-scripts expect a global configuration file to be located at \/etc\/mcm-iptables.conf. An example file:","through both network interfaces. You will find some small firewall configuration scripts for the MobileConnect Manager host inside this document. However, you are encouraged to use your own firewall rules or any external firewall to adapt as best as possible to your specific network situation.  Feel free to send us feedback and information about your final implementation, so we can improve this document."]}
{"question":"What happens when you activate 'Low Latency' mode on MOMENTUM True Wireless 4 earbuds?","ground_truth":"Activating 'Low Latency' mode minimizes delay between audio and video but may reduce Bluetooth transmission range.","answer":"Activating 'Low Latency' mode on MOMENTUM True Wireless 4 earbuds reduces the delay between audio and video synchronization, providing a more seamless and real-time audio experience.","contexts":["Using the earbuds\nMOMENTUM True Wireless 4  | 39\n\u201cLossless Audio\u201d mode\nThe \u201cLossless Audio\u201d mode offers maximum sound quality. The audio \ndata is transmitted uncompressed and bit-accurate in CD quality via \nthe Bluetooth codec aptX\u2122 Lossless, with a sampling frequency of \n44.1 kHz and a sampling depth of 16 bits. \nA correspondingly high-resolution quality of the audio material to be \nplayed back is required.\nIf the \u201cLossless Audio\u201d mode is activated via the Smart Control app,","Using the earbuds\nMOMENTUM True Wireless 4  | 39\n\u201cLossless Audio\u201d mode\nThe \u201cLossless Audio\u201d mode offers maximum sound quality. The audio \ndata is transmitted uncompressed and bit-accurate in CD quality via \nthe Bluetooth codec aptX\u2122 Lossless, with a sampling frequency of \n44.1 kHz and a sampling depth of 16 bits. \nA correspondingly high-resolution quality of the audio material to be \nplayed back is required.\nIf the \u201cLossless Audio\u201d mode is activated via the Smart Control app,","Using the earbuds\n32 | MOMENTUM True Wireless 4\nListening to ambient sounds or \nconversations - activating\/deactivating \nthe Transparency Mode\nWith the Transparency Mode activated, you can hear ambient \nsounds or communicate without having to remove the earbuds from \nyour ears. This allows you to hear e.g. announcements in the train or \naircraft or to have short conversations.\nWith the Smart Control app, you can adjust the intensity of the","Using the earbuds\n32 | MOMENTUM True Wireless 4\nListening to ambient sounds or \nconversations - activating\/deactivating \nthe Transparency Mode\nWith the Transparency Mode activated, you can hear ambient \nsounds or communicate without having to remove the earbuds from \nyour ears. This allows you to hear e.g. announcements in the train or \naircraft or to have short conversations.\nWith the Smart Control app, you can adjust the intensity of the","Product overview\nMOMENTUM True Wireless 4  | 11\nNotes on voice prompts\nThe earbuds output voice prompts for events (the table gives some \nexamples). Using the Smart Control app, you can change the lan-\nguage of the voice prompts, choose between voice prompts and \nbeep sounds, or deactivate the status messages with a few excep-\ntions (e.g. rechargeable battery is empty). \nVoice prompt Meaning\n\u201cPower on\u201d Earbuds are switched on.\n\u201cPower off\u201d Earbuds switch off.","Product overview\nMOMENTUM True Wireless 4  | 11\nNotes on voice prompts\nThe earbuds output voice prompts for events (the table gives some \nexamples). Using the Smart Control app, you can change the lan-\nguage of the voice prompts, choose between voice prompts and \nbeep sounds, or deactivate the status messages with a few excep-\ntions (e.g. rechargeable battery is empty). \nVoice prompt Meaning\n\u201cPower on\u201d Earbuds are switched on.\n\u201cPower off\u201d Earbuds switch off.","Using the earbuds\n20 | MOMENTUM True Wireless 4\nInformation on the Bluetooth wireless \nconnection\nThe earbuds are Bluetooth 5.4, LE Audio and Auracast\u2122 broadcast \naudio certified.\nBluetooth\nIf your audio source supports one of the following high-resolution \naudio encoding methods, music is automatically played in high audio \nquality: aptX\u2122 Adaptive or AAC. Otherwise the earbuds will play \nback your music in normal audio quality (SBC). Depending on the","Using the earbuds\n20 | MOMENTUM True Wireless 4\nInformation on the Bluetooth wireless \nconnection\nThe earbuds are Bluetooth 5.4, LE Audio and Auracast\u2122 broadcast \naudio certified.\nBluetooth\nIf your audio source supports one of the following high-resolution \naudio encoding methods, music is automatically played in high audio \nquality: aptX\u2122 Adaptive or AAC. Otherwise the earbuds will play \nback your music in normal audio quality (SBC). Depending on the","Product overview\nMOMENTUM True Wireless 4  | 7\nEarbuds\nModel: MTW4 R and MTW4 L\nMicrophones for the active noise cancellation ANC, for the \nperception of your surroundings (\u201cTransparency Mode\u201d) \nand for phone calls\nTouch control panel\nStatus LED\nLeft earbud L \nRight earbud R\nChangeable silicone ear adapters\nInfra-red proximity sensor\nMagnetic holders\nCharging contacts\nBuilt-in rechargeable battery\nChangeable ear fins for a secure fit of the earbuds in the \nears\nA\nE\nH\nI\nC\nB\n0\nG G\nF\nJ\n0\nG\nH\nI\nJ\nG","Product overview\nMOMENTUM True Wireless 4  | 7\nEarbuds\nModel: MTW4 R and MTW4 L\nMicrophones for the active noise cancellation ANC, for the \nperception of your surroundings (\u201cTransparency Mode\u201d) \nand for phone calls\nTouch control panel\nStatus LED\nLeft earbud L \nRight earbud R\nChangeable silicone ear adapters\nInfra-red proximity sensor\nMagnetic holders\nCharging contacts\nBuilt-in rechargeable battery\nChangeable ear fins for a secure fit of the earbuds in the \nears\nA\nE\nH\nI\nC\nB\n0\nG G\nF\nJ\n0\nG\nH\nI\nJ\nG"]}
{"question":"What are the two modes of operation for MobileConnect, and how do they differ?","ground_truth":"The two modes are Standalone Mode and Manager Mode. Standalone Mode is easier to set up with minimal IT support, focusing on audio streaming via QR codes without internet connectivity. Manager Mode offers full functionality with IT infrastructure, DNS setup, and centralized administration.","answer":"The two modes of operation for MobileConnect are Standalone Mode and Manager Mode. Standalone Mode simplifies the setup and is flexible for various scenarios, while Manager Mode offers full functionality with the need for MobileConnect Manager Software and constant internet connectivity.","contexts":["2 \nMobileConnect \u2013 System Modes","10 \nMobileConnect \u2013 System Modes \n Two port solution  In this scenario there are two separate networks. One is used for the public devices, the other is used for control of the MobileConnect Station and access to the MobileConnect Manager web interface.  \nUsing two separate networks employs a clear separation between streaming and control communication, allowing for a better confinement of the user controlled mobile devices.   Wi-Fi","5 \nMobileConnect \u2013 System Modes \nStandalone Mode  Standalone Mode simplifies the setup of MobileConnect. It enables a flexible solution that is applicable for a wide range of usage scenarios.","7 \nMobileConnect \u2013 System Modes","8 \nMobileConnect \u2013 System Modes \nManager Mode   Manager mode offers the full range of functionality of MobileConnect. The MobileConnect Manager software is added to the setup as a single point of administration for all MobileConnect Stations in the infrastructure. With the Manager, all settings and administration can be handled from anywhere in the network.","4 \nMobileConnect \u2013 System Modes \n Standalone Mode              Manager Mode                \n  A decision for a mode is not final. A switch in any direction is possible at any time. In many cases it is advisable to use the Standalone Mode as entry mode for testing streaming functionality and switch to Manager Mode once the system is tested and its function has been approved.","Sennheiser MobileConnect System Modes Standalone Mode & Manager Mode","3 \nMobileConnect \u2013 System Modes \n \nSystem  Sennheiser MobileConnect allows streaming live audio content with low latency and in superior quality via WiFi to connected Android and iOS smart devices. To ensure low latency and superior audio quality, unicast is used for streaming.  Application Modes  To adapt to different application scenarios and network environments, MobileConnect can be operated in two Modes: Manager Mode and Standalone Mode.  Mode Differentiation","Manager Mode offers the full range of functions but requires the setup of the MobileConnect Manager Software and DNS entries. This Mode therefor requires IT support. Settings and administration for all MobileConnect Stations in the network can be done using the Manager as single point of administration from anywhere in the network. Manager Mode requires constant internet connectivity.","11 \nMobileConnect \u2013 System Modes \n MobileConnect Stations  \n\u2022 Renaming a MobileConnect Station. \u2022 Setting Station audio configuration. \u2022 Configuring Station network interfaces. \u2022 Updating software of MobileConnect Stations. \u2022 Resetting of MobileConnect Stations. \u2022 Removing a Station from the Manager.  Additionally, the Local Admin interface is available."]}
{"question":"What is required for using MobileConnect in Standalone Mode?","ground_truth":"An enterprise-grade router, access point(s), and a local network with DHCP enabled are required. Streams are accessed using QR codes.","answer":"For using MobileConnect in Standalone Mode, you need to connect it to a network infrastructure, and it is ready to operate. Basic IT support is required, and all settings and administration are done via the Local Admin Interface. Users have to scan the QR-Code created in the Local Admin Interface to connect to streams. Internet connectivity is not required in Standalone Mode.","contexts":["5 \nMobileConnect \u2013 System Modes \nStandalone Mode  Standalone Mode simplifies the setup of MobileConnect. It enables a flexible solution that is applicable for a wide range of usage scenarios.","With Standalone Mode, MobileConnect focuses on its central audio streaming function. After connecting it to a network infrastructure, it is ready to operate. Setup and installation effort are simplified in this mode, only basic IT support is required. All settings and administration are done via the Local Admin Interface. To connect to streams, users have to scan the QR-Code created in the Local Admin Interface.","In this mode, the MobileConnect Station and MobileConnect App are the system components.   Considerations  \n\u00fc Ease of installation \u00fc Limited IT support required \u2013 Manager functionalities not available \u2013 Streams can only be accessed via QR-Code   \nSetup Overview  Setting up MobileConnect in Standalone Mode requires the following steps: \n The target application for Standalone Mode is the equipment of a single room (or multiple single rooms) with live audio streams.","Does the system require an internet connection?\n\u00c2\u00b6\n\n\nThe MobileConnect system itself only requires internet connectivity when it is used in the so called \u00e2\u0080\u009cManager Mode\u00e2\u0080\u009d because the MobileConnect Manager handles the authentication and updates over the cloud.\n\n\nIn \u00e2\u0080\u009cStandalone Mode\u00e2\u0080\u009d the MobileConnect system does not require an internet connection.","In contrast to Manager Mode, internet connectivity it is not required in Standalone Mode. However, it is recommended for all MobileConnect networks. Missing internet connectivity on the network worsens user experience significantly. Mobile devices constantly try to establish internet access. If it is not available in the connected Wi-Fi, most devices will try and switch to mobile data connection. Additionally, connecting a device to a network without internet access limits its usability for","4 \nMobileConnect \u2013 System Modes \n Standalone Mode              Manager Mode                \n  A decision for a mode is not final. A switch in any direction is possible at any time. In many cases it is advisable to use the Standalone Mode as entry mode for testing streaming functionality and switch to Manager Mode once the system is tested and its function has been approved.","The MobileConnect Manager requires internet connectivity in order to create and authenticate administration accounts and update connected MobileConnect Stations.","In \u00e2\u0080\u009cStandalone Mode\u00e2\u0080\u009d the MobileConnect system does not require an internet connection.\n\n\nFor the end-users smartphone we recommend to offer an internet connection on the WiFi-side because some smartphones will automatically disconnect from a WiFi that is not providing internet connectivity and this will lead to audio dropouts.\n\n\n\n\n\n\nCan I use my old CinemaConnect system with the new MobileConnect App?\n\u00c2\u00b6\n\n\nYes, the MobileConnect App supports CinemaConnect systems including subtitles.","Sennheiser MobileConnect System Modes Standalone Mode & Manager Mode","Wi-Fi  \nMobileConnect relies on Wi-Fi to transmit streams to connected smartphones. The quality of the Wi-Fi is directly influencing the service\u2019s quality and performance.   \nQuality of Service is recommended.  Usage of 5 GHz band is recommended.  The recommended limit of number of clients per AP is 50.  \n \nThe term Standalone Mode refers to the MobileConnect Station, not the network infrastructure. MobileConnect does not handle network organization."]}
{"question":"How does MobileConnect handle data load per client in Standalone Mode?","ground_truth":"The data load is 165 kbps per unique client connection.","answer":"The data load per client in Standalone Mode for MobileConnect is 165 kbps.","contexts":["5 \nMobileConnect \u2013 System Modes \nStandalone Mode  Standalone Mode simplifies the setup of MobileConnect. It enables a flexible solution that is applicable for a wide range of usage scenarios.","With Standalone Mode, MobileConnect focuses on its central audio streaming function. After connecting it to a network infrastructure, it is ready to operate. Setup and installation effort are simplified in this mode, only basic IT support is required. All settings and administration are done via the Local Admin Interface. To connect to streams, users have to scan the QR-Code created in the Local Admin Interface.","4 \nMobileConnect \u2013 System Modes \n Standalone Mode              Manager Mode                \n  A decision for a mode is not final. A switch in any direction is possible at any time. In many cases it is advisable to use the Standalone Mode as entry mode for testing streaming functionality and switch to Manager Mode once the system is tested and its function has been approved.","Wi-Fi  \nMobileConnect relies on Wi-Fi to transmit streams to connected smartphones. The quality of the Wi-Fi is directly influencing the service\u2019s quality and performance.   \nQuality of Service is recommended.  Usage of 5 GHz band is recommended.  The recommended limit of number of clients per AP is 50.  \n \nThe term Standalone Mode refers to the MobileConnect Station, not the network infrastructure. MobileConnect does not handle network organization.","In this mode, the MobileConnect Station and MobileConnect App are the system components.   Considerations  \n\u00fc Ease of installation \u00fc Limited IT support required \u2013 Manager functionalities not available \u2013 Streams can only be accessed via QR-Code   \nSetup Overview  Setting up MobileConnect in Standalone Mode requires the following steps: \n The target application for Standalone Mode is the equipment of a single room (or multiple single rooms) with live audio streams.","In contrast to Manager Mode, internet connectivity it is not required in Standalone Mode. However, it is recommended for all MobileConnect networks. Missing internet connectivity on the network worsens user experience significantly. Mobile devices constantly try to establish internet access. If it is not available in the connected Wi-Fi, most devices will try and switch to mobile data connection. Additionally, connecting a device to a network without internet access limits its usability for","What is the maximum required data rate for one MobileConnect Station?\n\u00c2\u00b6\n\n\nThe required data rate per mono or stereo stream is 165 kbps. For 100 simultaneous listening clients (max. number per MobileConnect Station) please reserve at least 20 Mbps in your network to ensure the stability of streaming.\n\n\n\n\n\n\nDoes the system require an internet connection?\n\u00c2\u00b6","2 \nMobileConnect \u2013 System Modes","6 \nMobileConnect \u2013 System Modes \nHardware  Minimum hardware requirements  \nI Enterprise Grade Router  II Enterprise Grade Access Point(s)  Network  For Standalone Mode, a Wi-Fi network is required for transmission. Usage of an existing network infrastructure as well as the setup of a dedicated infrastructure is possible.   \nThe data load is 165 kbps per unique client connection.  DHCP is required.  Internet connectivity","Does the system require an internet connection?\n\u00c2\u00b6\n\n\nThe MobileConnect system itself only requires internet connectivity when it is used in the so called \u00e2\u0080\u009cManager Mode\u00e2\u0080\u009d because the MobileConnect Manager handles the authentication and updates over the cloud.\n\n\nIn \u00e2\u0080\u009cStandalone Mode\u00e2\u0080\u009d the MobileConnect system does not require an internet connection."]}
{"question":"What network recommendation is critical for using MobileConnect?","ground_truth":"The use of the 5 GHz Wi-Fi band is recommended for better performance and reduced interference.","answer":"The critical network recommendation for using MobileConnect is to use the same Wi-Fi network for MobileConnect if it already exists. Adding an additional Wi-Fi network may cause interference and lower the quality of service. Additionally, it is recommended to use the 5 GHz band and ensure a minimum data rate of 12 Mbps.","contexts":["The quality of the offered service depends on the network and Wi-Fi infrastructure. It has to fulfil a minimum of requirements for MobileConnect.","If a Wi-Fi network is existing, it is highly recommended to use the same network for MobileConnect. Adding an additional Wi-Fi network will likely cause interference and lower the quality of service. Additionally, usage of a separate network worsens user experiences because it forces users to decide between MobileConnect and the other network\u2019s functionality.  Quality of Service is recommended.  Usage of 5 GHz band is recommended.  It is recommended to make 12 Mbps the lowest mandatory data","The quality of the offered service depends on the network and Wi-Fi infrastructure. It has to fulfil a minimum of requirements for MobileConnect. It is important to check network suitability prior to the integration.","8 \nMobileConnect Network Whitepaper \nVersion 1.0","9 \nMobileConnect Network Whitepaper \nVersion 1.0","6 \nMobileConnect Network Whitepaper \nVersion 1.0","MobileConnect relies on Wi-Fi to transmit streams to connected smartphones. The quality of the Wi-Fi is directly influencing the quality and performance of service.","2 \nMobileConnect Network Whitepaper \nVersion 1.0","12 \nMobileConnect Network Whitepaper \nVersion 1.0","10 \nMobileConnect Network Whitepaper \nVersion 1.0"]}
{"question":"What firmware version is required for using the Digital 6000 series with WSM?","ground_truth":"The required firmware version for the EM 6000 is 3.2.1, and for the L 6000, it is 3.0.1.","answer":"The required firmware version for using the Digital 6000 series with WSM is 3.2.1 or higher.","contexts":["| 2 - WSM (Wireless Systems Manager)\nCompatible Sennheiser products\nThe following Sennheiser systems can be con\ufb01gured using the WSM:\nOnly transmitters and receivers that are equipped with the same compander \nsystem can be combined with each other.\nDigital 9000\n\u2022 Required Firmware Version (or higher): 4.0.1\nDigital 6000\n\u2022 EM 6000\n\u2022 Required Firmware Version (or higher): 3.2.1\n\u2022 L 6000\n\u2022 Required Firmware Version (or higher): 3.0.1\nEW-DX\n\u2022 EW-DX EM 2\n\u2022 Required Firmware Version (or higher): 2.0.1","| 2 - WSM (Wireless Systems Manager)\new 300 G4\n\u2022 Required Firmware Version (or higher): 1.2.0.1\new 500 G4\n\u2022 Required Firmware Version (or higher): 1.2.0.1\new IEM G4\n\u2022 Required Firmware Version (or higher): 1.2.0.1\new 300 G3\n\u2022 Required Firmware Version (or higher): 1.8.0\new 500 G3\n\u2022 Required Firmware Version (or higher): 1.8.0\new 300 G3 IEM\n\u2022 Required Firmware Version (or higher): 1.8.0\n8","| 2 - WSM (Wireless Systems Manager)\nSystem requirements\nThe WSM software runs on the following operating systems:\nWindows\nWindows 10 (32 Bit\/64 Bit)\nWindows 11 (32 Bit\/64 Bit)\n8 GB RAM\nMac\nmacOS 13 Ventura\nmacOS 14 Sonoma\n8 GB RAM\n9","EW-DX\n\u2022 EW-DX EM 2\n\u2022 Required Firmware Version (or higher): 2.0.1\n\u2022 EW-DX EM 2 DANTE\n\u2022 Required Firmware Version (or higher): 2.0.1\n\u2022 EW-DX EM 4 DANTE\n\u2022 Required Firmware Version (or higher): 2.0.1\nEM 373x (COM) + EM 373x-II (COM)\n\u2022 Required Firmware Version (or higher): 2.2.0\n\u2022 Required Firmware Version (or higher): 1.8.1\n\u2022 Required Firmware Version (or higher): 1.8.1\n7","If the WSM is in online mode and an EM 9046 is connected to your computer, you \ncan stream audio using the RTP\/RTSP protocol and listen to it by clicking on the \nheadphone icon on the EM 9046 channel strip.\nA gray headphone icon indicates that the EM 9046 receiver is offline or that the \nfirmware of the EM 9046 does not support RTP\/RTSP streaming.\nRTP\/RTSP streaming is supported from the following EM 9046 \ufb01rmware version: \nEM9046_3_0_3 (for how to update the EM 9046 \ufb01rmware, see","please refer to the individual instruction manuals.\nIf you want to use several WSMs in a network, please follow the instructions in \nchapter \nUsing several WSM software in a network.\n11","| 4 - Working with the software\nDownloading the latest \ufb01rmware update from the Internet\nSennheiser is continuously improving the WSM software.\nSelect the current \ufb01rmware package (SENNPKG \ufb01le) on the Sennheiser website at \nsennheiser.com\/wsm  and start the download.\nClick on \u201cOpen\u201d.\nThe \ufb01le is automatically saved in the \u201cNew Releases\u201d subfolder of the program \nfolder. If this folder already contains a \ufb01le, this \ufb01le is moved to the \u201cArchive\u201d \nfolder.\n48","Contents\n1. Preface............................................................................................................................................5\n2. WSM (Wireless Systems Manager)............................................................................................6\nImportant information...............................................................................................................6","Wireless Systems Manager\n5. Troubleshooting\nThe most frequent questions and answers summarized in a chapter.\nFrequently asked questions\nIf a problem occurs\nGlossar\nFrequently asked questions\nWhich Sennheiser hardware is compatible to WSM Software?\nCompatible Sennheiser products\nWhich third party spectrum scans are supported?\nWSM supports the following frequency scans\n\u2022 Rohde & Schwarz FSH\/FPH (*.csv)\n\u2022 RF Explorer (*.csv)\n\u2022 Tektronix RSA (*.csv)\n\u2022 Aim TTi (*.csv)","Wireless Systems Manager\n2. WSM (Wireless Systems Manager)\nInformation about supported devices and compatible Sennheiser products.\nImportant information\nCompatible Sennheiser products\nSystem requirements\nImportant information\nAdditional information on the Wireless Systems Manager software can be found at \nsennheiser.com\/wsm\n.\nAdditional information on the transmitters and receivers can be found in the individual \ninstruction manuals on the product pages at \nsennheiser.com\/download."]}
{"question":"What operating systems are compatible with the WSM software?","ground_truth":"WSM is compatible with Windows 10\/11 (32\/64-bit) and macOS 13 Ventura and macOS 14 Sonoma, with a minimum of 8 GB RAM.","answer":"The WSM software is compatible with the following operating systems:\n- Windows 10 (32 Bit\/64 Bit)\n- Windows 11 (32 Bit\/64 Bit)\n- macOS 13 Ventura\n- macOS 14 Sonoma","contexts":["| 2 - WSM (Wireless Systems Manager)\nSystem requirements\nThe WSM software runs on the following operating systems:\nWindows\nWindows 10 (32 Bit\/64 Bit)\nWindows 11 (32 Bit\/64 Bit)\n8 GB RAM\nMac\nmacOS 13 Ventura\nmacOS 14 Sonoma\n8 GB RAM\n9","Putting the system in operation............................................................................................10\nInstalling the WSM software..........................................................................................10\nCon\ufb01guring the network..................................................................................................11\nLaunching the WSM software........................................................................................12","| 2 - WSM (Wireless Systems Manager)\nCompatible Sennheiser products\nThe following Sennheiser systems can be con\ufb01gured using the WSM:\nOnly transmitters and receivers that are equipped with the same compander \nsystem can be combined with each other.\nDigital 9000\n\u2022 Required Firmware Version (or higher): 4.0.1\nDigital 6000\n\u2022 EM 6000\n\u2022 Required Firmware Version (or higher): 3.2.1\n\u2022 L 6000\n\u2022 Required Firmware Version (or higher): 3.0.1\nEW-DX\n\u2022 EW-DX EM 2\n\u2022 Required Firmware Version (or higher): 2.0.1","| 3 - Getting started\/setting up\nLaunching the WSM software\nWhen you have connected the devices:\nSwitch on all connected devices.\nTo launch the WSM software:\nDouble-click on the program icon on the desktop.\nOr\nClick on Start  > Programs  > Wireless Systems Manager.\n12","| 3 - Getting started\/setting up\nYou can install the WSM software on several computers in a network. For the individual \napplication scenarios you can assign different rights for accessing the devices in the network \n(e.g. for the parameters):\n\u2022 \u201cExklusive\u201d:\n\u2022 All access rights are assigned to only one WSM (see \nHave you selected \n\u201cExclusive\u201d for the \ufb01rst WSM?).\n\u2022 The access rights cannot be shared with other WSMs.\n\u2022 \u201cShared\u201d:","Wireless Systems Manager\n2. WSM (Wireless Systems Manager)\nInformation about supported devices and compatible Sennheiser products.\nImportant information\nCompatible Sennheiser products\nSystem requirements\nImportant information\nAdditional information on the Wireless Systems Manager software can be found at \nsennheiser.com\/wsm\n.\nAdditional information on the transmitters and receivers can be found in the individual \ninstruction manuals on the product pages at \nsennheiser.com\/download.","Wireless Systems Manager\n3. Getting started\/setting up\nFirst steps for starting the software, description of the interface and of\ufb02ine mode.\nPutting the system in operation\nThe operator interface of WSM\nCon\ufb01guring the system in Of\ufb02ine mode\nPutting the system in operation\nRelated information\nInstalling the WSM software\nCon\ufb01guring the network\nLaunching the WSM software\nSetting the language\nUsing several WSM software in a network\nInstalling the WSM software","xx.dmg\" (Mac).\nFollow the wizard\u2019s instructions.\nYou can install the WSM software on several computers in a network (see Using \nseveral WSM software in a network).\n10","please refer to the individual instruction manuals.\nIf you want to use several WSMs in a network, please follow the instructions in \nchapter \nUsing several WSM software in a network.\n11","Setting the language\nUsing several WSM software in a network\nInstalling the WSM software\nTo install the WSM software on your computer:\nDownload the current version of the WSM software from the product page at \nsennheiser.com\/wsm.\nClose all currently running programs, including those running in the background (e.g. \nanti-virus programs).\nStart the installation by double-clicking on \"x.x.x-xx.exe\" (Windows) or \"x.x.x-\nxx.dmg\" (Mac).\nFollow the wizard\u2019s instructions."]}
{"question":"What hardware is required for setting up MobileConnect in Standalone Mode?","ground_truth":"The hardware requirements include an enterprise-grade router, enterprise-grade access points, Server for MobileConnect Manager installation, A device providing DNS \/ DHCP in the network.","answer":"For setting up MobileConnect in Standalone Mode, the required hardware includes an Enterprise Grade Router, Enterprise Grade Access Point(s), and a Wi-Fi network for transmission.","contexts":["In this mode, the MobileConnect Station and MobileConnect App are the system components.   Considerations  \n\u00fc Ease of installation \u00fc Limited IT support required \u2013 Manager functionalities not available \u2013 Streams can only be accessed via QR-Code   \nSetup Overview  Setting up MobileConnect in Standalone Mode requires the following steps: \n The target application for Standalone Mode is the equipment of a single room (or multiple single rooms) with live audio streams.","5 \nMobileConnect \u2013 System Modes \nStandalone Mode  Standalone Mode simplifies the setup of MobileConnect. It enables a flexible solution that is applicable for a wide range of usage scenarios.","With Standalone Mode, MobileConnect focuses on its central audio streaming function. After connecting it to a network infrastructure, it is ready to operate. Setup and installation effort are simplified in this mode, only basic IT support is required. All settings and administration are done via the Local Admin Interface. To connect to streams, users have to scan the QR-Code created in the Local Admin Interface.","6 \nMobileConnect \u2013 System Modes \nHardware  Minimum hardware requirements  \nI Enterprise Grade Router  II Enterprise Grade Access Point(s)  Network  For Standalone Mode, a Wi-Fi network is required for transmission. Usage of an existing network infrastructure as well as the setup of a dedicated infrastructure is possible.   \nThe data load is 165 kbps per unique client connection.  DHCP is required.  Internet connectivity","9 \nMobileConnect \u2013 System Modes \n Hardware  Minimum hardware requirements","Does the system require an internet connection?\n\u00c2\u00b6\n\n\nThe MobileConnect system itself only requires internet connectivity when it is used in the so called \u00e2\u0080\u009cManager Mode\u00e2\u0080\u009d because the MobileConnect Manager handles the authentication and updates over the cloud.\n\n\nIn \u00e2\u0080\u009cStandalone Mode\u00e2\u0080\u009d the MobileConnect system does not require an internet connection.","Setup Overview  \nSetting up MobileConnect in Manager Mode requires the following steps: \n \nThe target application for Manager Mode is the equipment of multiple rooms with live audio streams & the administration of all Stations in an infrastructure.","4 \nMobileConnect \u2013 System Modes \n Standalone Mode              Manager Mode                \n  A decision for a mode is not final. A switch in any direction is possible at any time. In many cases it is advisable to use the Standalone Mode as entry mode for testing streaming functionality and switch to Manager Mode once the system is tested and its function has been approved.","Configuration & Access Control  Configuration  In Standalone Mode, all setup and configuration are done using the Local Admin Interface.  With the Local Admin Interface, the following features can be configured:  MobileConnect App \u2022 Rename channels. \u2022 View\/Change\/Download QR codes and Channel IDs for your streaming channels.  MobileConnect Station \u2022 Set Station audio configuration. \u2022 Configure Station network interfaces. \u2022 Update Station software. \u2022 Reset Station. \u2022 Reboot Station. \u2022","Sennheiser MobileConnect System Modes Standalone Mode & Manager Mode"]}
{"question":"What is the recommended Wi-Fi configuration for optimal performance of MobileConnect?","ground_truth":"It is recommended to use the 5 GHz band with a Quality of Service configuration. Each access point should ideally support a maximum of 50 clients, with a minimum data rate of 12 Mbps.","answer":"Quality of Service is recommended for optimal performance of MobileConnect. Usage of the 5 GHz band is recommended. The recommended minimum data rate is 12 Mbps.","contexts":["If a Wi-Fi network is existing, it is highly recommended to use the same network for MobileConnect. Adding an additional Wi-Fi network will likely cause interference and lower the quality of service. Additionally, usage of a separate network worsens user experiences because it forces users to decide between MobileConnect and the other network\u2019s functionality.  Quality of Service is recommended.  Usage of 5 GHz band is recommended.  It is recommended to make 12 Mbps the lowest mandatory data","MobileConnect relies on Wi-Fi to transmit streams to connected smartphones. The quality of the Wi-Fi is directly influencing the quality and performance of service.","Wi-Fi  \nMobileConnect relies on Wi-Fi to transmit streams to connected smartphones. The quality of the Wi-Fi is directly influencing the service\u2019s quality and performance.   \nQuality of Service is recommended.  Usage of 5 GHz band is recommended.  The recommended limit of number of clients per AP is 50.  \n \nThe term Standalone Mode refers to the MobileConnect Station, not the network infrastructure. MobileConnect does not handle network organization.","The quality of the offered service depends on the network and Wi-Fi infrastructure. It has to fulfil a minimum of requirements for MobileConnect.","The following latency can be expected with the system:\n\n\n\n\nOn iOS devices the latency is \n50-55ms\n\n\nOn mid-range to high-end Android devices (Wifi 5\/ac & Android Version >9) the latency is \n50-65ms\n\n\n\n\n\n\n\n\nWhich smartphones are recommended to use with MobileConnect?\n\u00c2\u00b6\n\n\nIn terms of Android we recommend to use mid-range or high-end devices that support Android Version >9 and WiFi ac.\nFor iOS we recommend all devices that support iOS version >13.","The quality of the offered service depends on the network and Wi-Fi infrastructure. It has to fulfil a minimum of requirements for MobileConnect. It is important to check network suitability prior to the integration.","8 \nMobileConnect Network Whitepaper \nVersion 1.0","2 \nMobileConnect Network Whitepaper \nVersion 1.0","6 \nMobileConnect Network Whitepaper \nVersion 1.0","12 \nMobileConnect Network Whitepaper \nVersion 1.0"]}
{"question":"What kind of delay or latency can I expect in the audio transmission for iOS devices?  Select the correct answer from A, B, C, D. Only one answer is correct. A) The latency is 50-65ms B) The latency is 50-55s C) The latency is 50-55ms D) The latency is 40-55ms","ground_truth":"C) The latency is 50-55ms","answer":"C) The latency is 50-55ms","contexts":["The following latency can be expected with the system:\n\n\n\n\nOn iOS devices the latency is \n50-55ms\n\n\nOn mid-range to high-end Android devices (Wifi 5\/ac & Android Version >9) the latency is \n50-65ms\n\n\n\n\n\n\n\n\nWhich smartphones are recommended to use with MobileConnect?\n\u00c2\u00b6\n\n\nIn terms of Android we recommend to use mid-range or high-end devices that support Android Version >9 and WiFi ac.\nFor iOS we recommend all devices that support iOS version >13.","delay and improves end-to-end speed of the audio transmission, resulting \nin a high quality, synchronized audio-visual experience. With aptX\u2122 Low \nLatency you can enjoy the freedom of wireless for applications such as \ngaming and watching videos.","Is there a delay\/latency in the audio transmission?\n\n\nWhich smartphones are recommended to use with MobileConnect?\n\n\nWhich headphones do you recommend, and which induction neck loop do you recommend?\n\n\nIs it also possible to use headphones or hearing aids connected via Bluetooth?\n\n\nWhat if the smartphone does not provide a 3.5 mm headphone jack?\n\n\nCan I customize the app with my own logo or color?\n\n\nIs there an SDK (Software Development Kit) for implementation into my own app available?","scanning a specific channel QR-Code\n\n\ntyping in manually a channel ID\n\n\n\n\nLastly, the end-user can listen to the audio stream over wired headphones that are connected to the smartphone. It is also possible to listen directly over the hearing aids or the cochlea implant in T-Position with the combination of an induction neck loop that is connected to the smartphone.\n\n\n\n\n\n\n\n\nIs there a delay\/latency in the audio transmission?\n\u00c2\u00b6\n\n\nThe following latency can be expected with the system:","MobileConnect is made for streaming live audio to mobile devices at lowest possible audio delay. In some cases, it might be beneficial to adjust the target latency to a specific value. With this release you can now set a manual latency value, for example when transmitting audio of an interpreter or a TV.\n\n\n\n\n\n\n\n\nMobileConnect Station 7.2.1\n\u00c2\u00b6\n\n\nRelease date: 15.07.2024\n\n\nThis is a security release fixing a severe vulnerability. We recommend all users to update the firmware.","MobileConnect is made for streaming live audio to mobile devices at lowest possible audio delay. In some cases, it might be beneficial to adjust the target latency to a specific value. With this release you can now set a manual latency value, for example when transmitting audio of an interpreter or a TV.\n\n\n\n\n\n\n\n\nMobileConnect Station 7.1.0\n\u00c2\u00b6\n\n\nAutomatic Channel Discovery for Standalone Mode (mDNS)","In the following you can find a list of selected devices that we can recommend in terms of audio stability and latency:\n\n\niOS:\n\n\n\n\niPhone 8 - present\n\n\niPod Touch (7th Gen.)\n\n\n\n\nAndroid:\n\n\n\n\nGoogle Pixel 3 - present\n\n\nSamsung S-Series 8 - present\n\n\nSamsung Note Series 8 - present\n\n\n\n\n\n\n\n\nWhich headphones do you recommend, and which induction neck loop do you recommend?\n\u00c2\u00b6\n\n\nHeadphones: \nSennheiser HD 280 Pro\n\n\nInduction neck loop: \nGeemarc iLoop+","matically.\nThe Bluetooth transmission is also affected if you have acti-\nvated a special audio transmission mode for your earbuds. In \n\u201cHigh Resolution Audio\u201d mode and in \u201cLossless Audio\u201d mode, \nthe stability of the Bluetooth connection may be reduced. The \n\u201cLow Latency\u201d mode can cause a reduced transmission range.","matically.\nThe Bluetooth transmission is also affected if you have acti-\nvated a special audio transmission mode for your earbuds. In \n\u201cHigh Resolution Audio\u201d mode and in \u201cLossless Audio\u201d mode, \nthe stability of the Bluetooth connection may be reduced. The \n\u201cLow Latency\u201d mode can cause a reduced transmission range.","played back is required.\nIf the \u201cLossless Audio\u201d mode is activated via the Smart Control app, \nthe Bluetooth transmission range may be slightly reduced.\n\u201cLow Latency\u201d mode\nYour earbuds feature latency compensation as standard. The \u201cLow \nLatency\u201d mode can also be used to reduce the latency between the \naudio and video signal (e.g. when streaming video on your smart-\nphone) to a minimum. \nYou can use this mode for all Bluetooth codecs."]}
{"question":"What is the release date of MobileConnect Manager 1.4.2?","ground_truth":"21.09.2022","answer":"The release date of MobileConnect Manager 1.4.2 is 21.09.2022.","contexts":["MobileConnect Manager 1.4.0\n\n\nMobileConnect Manager 1.3.0\n\n\nMobileConnect Manager 1.2.2\n\n\nMobileConnect Manager 1.2.1\n\n\nMobileConnect Manager 1.2.0\n\n\nMobileConnect Manager 1.1.0\n\n\nMobileConnect Manager 1.0.0\n\n\n\n\n\n\nPrevious Releases Station v2 (2020)\n\n\nMobileConnect Station 7.2.0\n\n\nMobileConnect Station 7.1.0\n\n\nMobileConnect Station 7.0.0\n\n\nMobileConnect Station 6.7.2\n\n\nMobileConnect Station 6.7.1\n\n\nMobileConnect Station 6.7.0\n\n\nMobileConnect Station v2 6.4.1\n\n\nMobileConnect Station v2 6.4.0","Previous Releases Manager\n\u00c2\u00b6\n\n\n\n\nMobileConnect Manager 2.0.0\n\u00c2\u00b6\n\n\nThis release introduces major changes to your MobileConnect setup:","Manager 1.2.x and Station 6.2.x\n\n\nManager 1.2.x and Station 6.1.x\n\n\nManager 1.0.0\/1.1.0 and Station 6.0.x\n\n\n\n\n\n\n\n\n\n\n\n\n\n\n\n\n\n\n\n\n\n\n\n\n\n\n\n\nRelease Notes\n\n\nCurrent Releases\n\n\nMobileConnect Manager 2.1.0\n\n\nMobileConnect Station 7.2.1\n\n\n\n\n\n\nMobileConnect Manager and Station compatibility\n\n\nPrevious Releases Manager\n\n\nMobileConnect Manager 2.0.0\n\n\nMobileConnect Manager 1.4.2\n\n\nMobileConnect Manager 1.4.1\n\n\nMobileConnect Manager 1.4.0\n\n\nMobileConnect Manager 1.3.0\n\n\nMobileConnect Manager 1.2.2","MobileConnect Manager 1.2.0\n\u00c2\u00b6\n\n\nRelease date: 24.09.2020\n\n\n\n\nImproved access to your MobileConnect Manager with support for \nmultiple members\n:\n\n\n\n\n\n\nNew owner, admin and moderator roles.\n\n\nEasy access management: control who can view and edit your MobileConnect network and audio configuration.\n\n\nFor more see the MobileConnect user guide.\n\n\n\n\n\n\n\n\nIncreased \nsecurity\n between MobileConnect Manager and Station; Station authorization\/rejection.","Bugfixes and stability improvements.\n\n\n\n\n\n\n\n\nMobileConnect Manager 1.3.0\n\u00c2\u00b6\n\n\nRelease date: 28.04.2021\n\n\n\n\nWith the introduction of the \nMobileConnect API\n we offer you a new way to implement your own workflows via REST for digital signage.\n\n\n\n\n\n\nDisplay MobileConnect QR codes on digital room signage displays to help users find the MobileConnect streaming channel.","With the new App Customization feature, you can customize the MobileConnect App design, upload your custom app logo\nand create up to three onboarding screens to interact with your app users.\n\n\nMobileConnect now supports IPv6 which allows for usage in state-of-the-art network environments\n\n\n\n\n\n\n\n\nMobileConnect Manager 1.4.2\n\u00c2\u00b6\n\n\nRelease date: 21.09.2022\n\n\nThis is a hotfix release that enables the ADAT inputs for the MobileConnect Station 1 again.","MobileConnect Manager 1.4.0\n\u00c2\u00b6\n\n\nRelease date: 2.09.2021\n\n\n\n\nIntroducing an improved way to \naccess and secure the streaming channels\n.\n\n\n\n\nThe streaming channels can be accessed using automatic discovery or by providing a QR code or Channel ID to the app user.\n\n\nThe streaming channels can be secured using a 6 digit \nPIN code\n.\n\n\nThe channel access methods and PIN code can be combined or used separately as you see fit.","MobileConnect Station 7.0.0\n\u00c2\u00b6\n\n\nRelease date: 08.03.2023\n\n\nThis major firmware release completes the feature set of the Manager 2.0.0 release:\n\n\n\n\nIt allows for using the brand new Audience Mic feature\n\n\nYour MobileConnect Station v2 can now also support IPv6 (needs to be enabled via local admin interface)\n\n\nChanging PIN codes of audio channels doesn\u00e2\u0080\u0099t change their QR codes any longer","This is a hotfix release that enables the ADAT inputs for the MobileConnect Station 1 again.\n\n\nAfter updating, please turn off your MobileConnect Station v1, remove it via the MobileConnect Manager\u00e2\u0080\u0099s \u00e2\u0080\u0098Remove\u00e2\u0080\u0099 button and restart the hardware. We apologise for any inconvenience caused!\n\n\n\n\n\n\nMobileConnect Manager 1.4.1\n\u00c2\u00b6\n\n\nRelease date: 1.03.2022\n\n\n\n\nBugfix for retaining the channel configuration when updating from Manager version 1.2.2.\n\n\n\n\n\n\n\n\nMobileConnect Manager 1.4.0\n\u00c2\u00b6","MobileConnect Documentation\n\n\n\n\n\n\n\n\n\n\n\n\n \u00bb\n\n\nRelease Notes\n\n\n\n\n\n\n\n\n\n\n\n\n\n\n\n\n\n\nRelease Notes\n\u00c2\u00b6\n\n\nThe Sennheiser MobileConnect team in Hamburg is constantly delivering new features via software updates. Check out the release notes and the user documentation for more details on how to install and use the MobileConnect system.\n\n\n\n\nCurrent Releases\n\u00c2\u00b6\n\n\n\n\nMobileConnect Manager 2.1.0\n\u00c2\u00b6\n\n\nRelease date: 18.01.2024\n\n\nWith the new MobileConnect Manager version we introduce the following updates:"]}
{"question":"What is the release date of MobileConnect Station 7.2.0?","ground_truth":"18.01.2024","answer":"The release date of MobileConnect Station 7.2.0 is not explicitly mentioned in the retrieved context.","contexts":["Manager 1.2.x and Station 6.2.x\n\n\nManager 1.2.x and Station 6.1.x\n\n\nManager 1.0.0\/1.1.0 and Station 6.0.x\n\n\n\n\n\n\n\n\n\n\n\n\n\n\n\n\n\n\n\n\n\n\n\n\n\n\n\n\nRelease Notes\n\n\nCurrent Releases\n\n\nMobileConnect Manager 2.1.0\n\n\nMobileConnect Station 7.2.1\n\n\n\n\n\n\nMobileConnect Manager and Station compatibility\n\n\nPrevious Releases Manager\n\n\nMobileConnect Manager 2.0.0\n\n\nMobileConnect Manager 1.4.2\n\n\nMobileConnect Manager 1.4.1\n\n\nMobileConnect Manager 1.4.0\n\n\nMobileConnect Manager 1.3.0\n\n\nMobileConnect Manager 1.2.2","Previous Releases Station v1\n\u00c2\u00b6\n\n\n\n\nMobileConnect Station 6.1.0\n\u00c2\u00b6\n\n\nRelease date: 24.09.2020\n\n\n\n\nIncreased \nsecurity\n between MobileConnect Manager and Station; Station authorization\/rejection.\n\n\nImproved error notifications.\n\n\nBugfixes.\n\n\nThis version is compatible with Manager 1.2.0 and higher. For more information see \nMobileConnect Manager and Station compatibility\n.\n\n\n\n\n\n\n\n\nMobileConnect Station 6.0.6\n\u00c2\u00b6\n\n\nRelease date: 18.05.2020\n\n\n\n\nDeleting and rebooting of a MobileConnect Station.","MobileConnect Station 7.0.0\n\u00c2\u00b6\n\n\nRelease date: 08.03.2023\n\n\nThis major firmware release completes the feature set of the Manager 2.0.0 release:\n\n\n\n\nIt allows for using the brand new Audience Mic feature\n\n\nYour MobileConnect Station v2 can now also support IPv6 (needs to be enabled via local admin interface)\n\n\nChanging PIN codes of audio channels doesn\u00e2\u0080\u0099t change their QR codes any longer","MobileConnect Station 6.7.0\n\u00c2\u00b6\n\n\nRelease date: 5.05.2022\n\n\n\n\nThe \nMobileConnect API\n is now available for Standalone Mode. Use either the dedicated Crestron and Extron plugins or the API directly, in order to automate sharing the channel QR code or PIN code.\n\n\nBugfix for Manager 1.3.0 and Station firmware 6.4.0\/6.7.0, streaming cannot be started.\n\n\nStability improvements for Station - App connection\n\n\n\n\n\n\n\n\nMobileConnect Station v2 6.4.1\n\u00c2\u00b6\n\n\nRelease date: 22.08.2022","Release date: 18.05.2020\n\n\n\n\nDeleting and rebooting of a MobileConnect Station.\n\n\nImproved error notifications.\n\n\nBugfixes.\n\n\n\n\n\n\n\n\nMobileConnect Station 6.0.5\n\u00c2\u00b6\n\n\nRelease date: 9.04.2020\n\n\n\n\nNew redesigned firmware available for both MobileConnect Station v1 and v2.\n\n\nCan be updated OTA using the MobileConnect Manager.\n\n\nBetter network integration.\n\n\nNAT is now being supported.\n\n\nDNS service discovery.\n\n\n\n\n\n\n\n\nRemoved Features\n\u00c2\u00b6","MobileConnect Station 6.7.0\n\n\nMobileConnect Station v2 6.4.1\n\n\nMobileConnect Station v2 6.4.0\n\n\nMobileConnect Station v2 6.3.0\n\n\nMobileConnect Station 6.2.1\n\n\nMobileConnect Station 6.2.0\n\n\nMobileConnect Station 6.1.2\n\n\nMobileConnect Station 6.1.0\n\n\nMobileConnect Station 6.0.7\n\n\nMobileConnect Station 6.0.6\n\n\nMobileConnect Station 6.0.5\n\n\n\n\n\n\nPrevious Releases Station v1\n\n\nMobileConnect Station 6.1.0\n\n\nMobileConnect Station 6.0.6\n\n\nMobileConnect Station 6.0.5\n\n\nRemoved Features","Release date: 10.06.2022\n\n\nThis is a small bugfix release for the following:\n\n\n\n\nSwitching from Standalone to Manager Mode does not always work\n\n\nClients are not disconnected when a channel is disabled or PIN is set via the Standalone Mode API\n\n\nOther Standalone API improvements\n\n\n\n\nWe recommend updating the firmware to this version, especially in case you are using the \nStandalone Mode API\n.\n\n\n\n\n\n\nMobileConnect Station 6.7.0\n\u00c2\u00b6\n\n\nRelease date: 5.05.2022","MobileConnect Manager 1.4.0\n\n\nMobileConnect Manager 1.3.0\n\n\nMobileConnect Manager 1.2.2\n\n\nMobileConnect Manager 1.2.1\n\n\nMobileConnect Manager 1.2.0\n\n\nMobileConnect Manager 1.1.0\n\n\nMobileConnect Manager 1.0.0\n\n\n\n\n\n\nPrevious Releases Station v2 (2020)\n\n\nMobileConnect Station 7.2.0\n\n\nMobileConnect Station 7.1.0\n\n\nMobileConnect Station 7.0.0\n\n\nMobileConnect Station 6.7.2\n\n\nMobileConnect Station 6.7.1\n\n\nMobileConnect Station 6.7.0\n\n\nMobileConnect Station v2 6.4.1\n\n\nMobileConnect Station v2 6.4.0","Release Notes \u2014 MobileConnect Documentation \n\n\n\n\n\n\n\n\n\n\n\n\n\n\n\n\n\n\n\n\n\n\n\n\n\n\n\n\n\n\n\n\n\n\n\n\n\n\n\n\n\n\n\n\n\n\n\n\n\n\n\n\n MobileConnect Documentation\n          \n\n          \n          \n\n\n\n\n\n\n\n    Manager 2.1.x and Station 7.2.x\n    \n\n\n\n\n\n\n\n\nVersions\n\n\n\n\nManager 2.1.x and Station 7.2.x\n\n\n\n\nManager 2.0.x and Station 7.x.x\n\n\nManager 1.4.x and Station 6.7.0\n\n\nManager 1.4.x and Station 6.4.0\n\n\nManager 1.3.0 and Station 6.3.0\n\n\nManager 1.2.x and Station 6.2.x\n\n\nManager 1.2.x and Station 6.1.x","MobileConnect Station v2 6.4.1\n\u00c2\u00b6\n\n\nRelease date: 22.08.2022\n\n\nThis is a security release fixing a minor vulnerability. We recommend updating the firmware.\n\n\n\n\n\n\nMobileConnect Station v2 6.4.0\n\u00c2\u00b6\n\n\nRelease date: 2.09.2021\n\n\n\n\nIntroducing an improved way to \naccess and secure the streaming channels\n in Standalone Mode.\n\n\n\n\nThe streaming channels can be accessed by providing a QR code to the app user.\n\n\nThe streaming channels can be secured using a 6 digit \nPIN code\n."]}
{"question":"What is the battery life of the Bose QuietComfort Earbuds II during continuous playback with ANC on?","ground_truth":"I don't know","answer":"I don't know.","contexts":["m distance, Bluetooth AAC codec, \nvolume level 50%, ANC activated, \nhealth data sensors activated)\nCharging time of recharge-\nable batteries\napprox. 1.5 hours for full charge\napprox. 10 minutes for 1 hour of music \nplayback (ANC mode)","of the active noise cancellation circuitry located on the outside of \nthe earbuds.\n\u2022 With active noise cancellation ANC activated, the battery life of \nthe earbuds is reduced.\nYou can also adjust the volume using the connected Bluetooth \ndevice.\nIf you have activated the voice assistant (> 33) and then change \nthe volume of the earbuds, the volume of the voice assistant is \nadjusted accordingly and saved permanently.","of the active noise cancellation circuitry located on the outside of \nthe earbuds.\n\u2022 With active noise cancellation ANC activated, the battery life of \nthe earbuds is reduced.\nYou can also adjust the volume using the connected Bluetooth \ndevice.\nIf you have activated the voice assistant (> 33) and then change \nthe volume of the earbuds, the volume of the voice assistant is \nadjusted accordingly and saved permanently.","Using the earbuds\n52 | MOMENTUM Sport\nBattery protection mode\nWhen the battery protection mode is activated, the rechargeable \nbatteries of the earbuds are charged in a particularly protective way \nand only up to a charge level of approx. 80% in order to extend the \nbattery life. The maximum playback time of the earbuds is reduced \naccordingly to approx. 80% of the standard playback time. \nYou can activate the battery protection mode via the Smart Control \napp (see page > 28).\nEco mode","20-40% charged \n(>12 hours of playback time)\n3 white\nRechargeable battery is approx. \n40-60% charged \n(>24 hours of playback time)\n4 white\nRechargeable battery is approx. \n60-80% charged\n(>36 hours of playback time)\n5 white\nRechargeable battery is approx. \n80-100% charged \n(>48 hours of playback time)\n5 white Rechargeable battery is 100% charged \n(up to 60 hours of playback time)\nYou can speed up the charging process by charging the head-\nphones when they are switched off.","and only up to a charge level of approx. 80 % in order to extend the \nbattery life. The maximum playback time of the earbuds is reduced \naccordingly to approx. 80 % of the standard playback time. \nYou can activate the battery protection mode via the Smart Control \napp (> 23).\nEco mode\nEco mode maximizes the playback time of your earbuds by optimiz-\ning energy consumption and can be activated via the Smart Control \napp (> 23). This mode can only be used with devices that support","and only up to a charge level of approx. 80 % in order to extend the \nbattery life. The maximum playback time of the earbuds is reduced \naccordingly to approx. 80 % of the standard playback time. \nYou can activate the battery protection mode via the Smart Control \napp (> 23).\nEco mode\nEco mode maximizes the playback time of your earbuds by optimiz-\ning energy consumption and can be activated via the Smart Control \napp (> 23). This mode can only be used with devices that support","5 V , max. 100 mA\ncharging case: 5 V , max. 1000 mA\noutput:\nearbuds (R and L): none\ncharging case: \n5 V , max. 100 mA x 2 (R and L)\nCharging method via \ncharging case\nUSB charging via USB-C socket: \n5 V , 1000 mA max;\nQi wireless charging\nOperating time 7.5 hrs with rechargeable battery of \nthe earbud (ANC activated)\n7 hrs with rechargeable battery of the \nearbud (ANC deactivated)\n30 hrs with rechargeable battery of \nthe charging case\n(test conditions: iPhone, volume at \n50%)","5 V , max. 100 mA\ncharging case: 5 V , max. 1000 mA\noutput:\nearbuds (R and L): none\ncharging case: \n5 V , max. 100 mA x 2 (R and L)\nCharging method via \ncharging case\nUSB charging via USB-C socket: \n5 V , 1000 mA max;\nQi wireless charging\nOperating time 7.5 hrs with rechargeable battery of \nthe earbud (ANC activated)\n7 hrs with rechargeable battery of the \nearbud (ANC deactivated)\n30 hrs with rechargeable battery of \nthe charging case\n(test conditions: iPhone, volume at \n50%)","input:\nearbuds (R and L): \n5 V , max. 100 mA\ncharging case: 5 V , max. 1000 mA\noutput:\nearbuds (R and L): none\ncharging case: \n5 V , max. 100 mA x 2 (R and L)\nCharging method via \ncharging case\nUSB charging via USB-C socket: \n5 V , 1000 mA;\nQi wireless charging\nOperating time 6 hrs with rechargeable battery of the \nearbud\n24 hrs with rechargeable battery of \nthe charging case\n(test conditions: smartphone within 1 \nm distance, Bluetooth AAC codec, \nvolume level 50%, ANC activated,"]}
{"question":"Does the Sony WH-1000XM5 support multi-device Bluetooth pairing, and how many devices can it connect to simultaneously?","ground_truth":"I don't know","answer":"The Sony WH-1000XM5 does not support multi-device Bluetooth pairing as it can only connect to one device at a time for audio playback.","contexts":["Using the earbuds\nMOMENTUM Sport  | 23\nConnecting the earbuds to Bluetooth \ndevices\nThe earbuds have a multipoint function, i.e. they can simultaneously \nestablish two connections via Bluetooth Classic (audio playback, \ntelephony) and two additional connections via Bluetooth Low Energy \n(sensor data transmission). You can find more information on Blue-\ntooth wireless connections here: page > 25\nAudio playback is only possible from one device at a time.","Getting started\nMOMENTUM True Wireless 4  | 15\n5. Connecting additional Bluetooth devices\n\u25b7 If desired, connect the earbuds to additional devices via Blue-\ntooth (> 22).\nThe earbuds can save the connection profiles of up to six Bluetooth \ndevices with which they have been paired. Audio playback is only \npossible from one device at a time.\nUsing the Smart Control app (\u201cConnections\u201d), you can view the list of \npaired devices and selectively connect and disconnect devices (> \n23).\n3s\nLR\n \u201cPairing\u201c","Getting started\nMOMENTUM True Wireless 4  | 15\n5. Connecting additional Bluetooth devices\n\u25b7 If desired, connect the earbuds to additional devices via Blue-\ntooth (> 22).\nThe earbuds can save the connection profiles of up to six Bluetooth \ndevices with which they have been paired. Audio playback is only \npossible from one device at a time.\nUsing the Smart Control app (\u201cConnections\u201d), you can view the list of \npaired devices and selectively connect and disconnect devices (> \n23).\n3s\nLR\n \u201cPairing\u201c","Using the earbuds\nMOMENTUM Sport  | 25\nInformation on the Bluetooth wireless \nconnection\nThe earbuds are Bluetooth 5.2 certified. \nThe use of the two Bluetooth wireless technologies Bluetooth Clas-\nsic and Bluetooth Low Energy ensures flexible use of the earbuds \nwith other devices and apps. The earbuds can simultaneously estab-\nlish two connections via Bluetooth Classic and two additional con-\nnections via Bluetooth Low Energy (multipoint function).","Using the headphones\nMOMENTUM 4  | 15\nInformation on the Bluetooth wireless \nconnection\nThe headphones are compliant with Bluetooth 5.2.\nIf your audio source supports one of the following high-resolution \naudio encoding methods, music is automatically played in high audio \nquality: aptX\u2122 Adaptive or AAC. Otherwise the headphones will play \nyour music in normal audio quality (SBC).\nPaired devices establish the Bluetooth wireless connection immedi-\nately after switch-on and are ready for use.","Is there a delay\/latency in the audio transmission?\n\n\nWhich smartphones are recommended to use with MobileConnect?\n\n\nWhich headphones do you recommend, and which induction neck loop do you recommend?\n\n\nIs it also possible to use headphones or hearing aids connected via Bluetooth?\n\n\nWhat if the smartphone does not provide a 3.5 mm headphone jack?\n\n\nCan I customize the app with my own logo or color?\n\n\nIs there an SDK (Software Development Kit) for implementation into my own app available?","Using the headphones\n16 | MOMENTUM 4\nPairing the headphones with a Bluetooth \ndevice\n1. Switch the headphones off and place them close to the Bluetooth \ndevice (max. 20 cm).\n2. Press the multi-function button for 5 seconds.\nThe headphones are switched on and you hear a sound signal. \nThe LEDs light up white 3x. \nThe headphones switch to pairing mode. The LEDs light up as a \nwhite continuous sequence and a melody can be heard.\n3. Activate Bluetooth on your Bluetooth device.","Wireless calling and streaming are only possible in the Bluetooth \ntransmission range of your smartphone. The transmission range \nlargely depends on environmental conditions such as wall thickness, \nwall composition etc. With a free line of sight, the transmission \nrange of most smartphones and Bluetooth devices is up to 10 meters.\nIf you, and therefore the headphones, leave the Bluetooth transmis-\nsion range of the smartphone, the sound quality deteriorates","Wireless calling and streaming are only possible in the Bluetooth \ntransmission range of your smartphone. The transmission range \nlargely depends on environmental conditions such as wall thickness, \nwall composition etc. With a free line of sight, the transmission \nrange of most smartphones and Bluetooth devices is up to 10 meters.\nIf you, and therefore the headphones, leave the Bluetooth transmis-\nsion range of the smartphone, the sound quality deteriorates","12 | BT T100 Bluetooth\u00ae Audio Transmitter\nGetting started\nPairing the transmitter to the headphones\/earphones\nCAUTION\nDanger of malfunction!\nThe transmitted radio waves of Bluetooth devices can impair \nthe operation of sensitive and unprotected devices.\n X Only use Bluetooth devices in locations where wireless \ntransmission is permitted.\nThe transmitter can save the connection profiles of up to eight Bluetooth \nheadphones. If you pair the transmitter to the ninth headphones, the saved"]}
{"question":"What is the water resistance rating of the Apple AirPods Pro 2?","ground_truth":"I don't know","answer":"The Apple AirPods Pro 2 do not have a water resistance rating mentioned in the retrieved context.","contexts":["Important safety instructions\nMOMENTUM Sport  | 3\nSafety instructions for Lithium rechargeable batteries\nNotes on the ingress protection rating of the earbuds\nThe earbuds feature an IP55 ingress protection rating which means \nthey are protected from the ingress of water (protection class \naccording to International Protection Marking (IP code), IEC standard \n60529, tested under laboratory conditions). The charging case has \nan IP54 protection rating and is protected against dust and splash","Important safety instructions\nMOMENTUM True Wireless 4  | 3\nSafety instructions for Lithium rechargeable batteries\nNotes on the ingress protection rating of the earbuds\nThe earbuds feature an IP54 ingress protection rating which means \nthey are protected from the ingress of water (protection class \naccording to International Protection Marking (IP code), IEC standard \n60529, tested under laboratory conditions).\nThe earbuds can be used in the rain, for example. However, they are","Important safety instructions\nMOMENTUM True Wireless 4  | 3\nSafety instructions for Lithium rechargeable batteries\nNotes on the ingress protection rating of the earbuds\nThe earbuds feature an IP54 ingress protection rating which means \nthey are protected from the ingress of water (protection class \naccording to International Protection Marking (IP code), IEC standard \n60529, tested under laboratory conditions).\nThe earbuds can be used in the rain, for example. However, they are","Frequency response 20 Hz - 20 kHz\nWeight 85 g\nTemperature range operation: 0 to 40\u00b0C (32 to 104\u00b0F)\nDimensions 93 x 93 x 27 mm (approx.)\nBluetooth\nVersion 4.2, class 1\nTransmission frequency 2402 to 2480 MHz\nModulation type GFSK, \u03c0\/4 DQPSK, 8 DPSK\nProfile A2DP\nRF output power 10 mW (max)\nSupported codecs SBC, aptX, aptX LL*\nNumber of active connections 2\n*supported on a single pair aptX LL headphone connection.","both earbuds and charging case: \napprox. 78 g\nVersion Bluetooth 5.4 certified, class 1\nTransmission frequency Classic BDR\/EDR and BLE 1M:\n2,402 MHz to 2,480 MHz\nBLE 2M: 2,404 MHz to 2,478 MHz \n(without 2,426 MHz)\nModulation GFSK, \u03c0\/4 DQPSK, 8DPSK\nProfiles AVRCP, A2DP, HFP, TMAP, PBP\nOutput power 10 mW (max)\nCodec aptX\u2122, aptX\u2122 Adaptive\/Lossless, \nAAC, SBC, Auracast\u2122 Broadcast \nAudio, LC3\nDevice name MOMENTUM TW 4\nNumber of active connec-\ntions\n2","both earbuds and charging case: \napprox. 78 g\nVersion Bluetooth 5.4 certified, class 1\nTransmission frequency Classic BDR\/EDR and BLE 1M:\n2,402 MHz to 2,480 MHz\nBLE 2M: 2,404 MHz to 2,478 MHz \n(without 2,426 MHz)\nModulation GFSK, \u03c0\/4 DQPSK, 8DPSK\nProfiles AVRCP, A2DP, HFP, TMAP, PBP\nOutput power 10 mW (max)\nCodec aptX\u2122, aptX\u2122 Adaptive\/Lossless, \nAAC, SBC, Auracast\u2122 Broadcast \nAudio, LC3\nDevice name MOMENTUM TW 4\nNumber of active connec-\ntions\n2","and M-size ear tip)\ncharging case: 78.4 g\nboth earbuds and charging case: 91 g\nDimensions earbuds: ap prox. 23.3 x 20.9 x \n26.1 mm\ncharging case: 63.7 x 64.8 x 30.0 mm\nSensors heart rate, body temperature, \n3-axis acceleration sensor, infrared \nin-ear sensor\nSensor measuring ranges heart rate: 30 ~ 220 bpm\nbody temperature: 35.5 to 42.0\u00b0C \n(accuracy: \u00b1 0.3\u00b0C)\nVersion Bluetooth 5.2 certified, class 1\nTransmission frequency 2,402 MHz to 2,480 MHz\nModulation GFSK, \u03c0\/4 DQPSK, 8DPSK","Specifications\nMOMENTUM True Wireless 4  | 49\nBluetooth\nTemperature range operation: 0 to +40 \u00b0C\ncharging: +5 to +35 \u00b0C\nstorage: \u201320 to +60 \u00b0C\nRelative humidity operation: 25 to 75 %, non condensing\nstorage: 10 to 90 %\nMagnetic field strength earbuds: 0.95 mT\ncharging case: 105 mT\nIngress protection of the \nearbuds splash proof (IP54)\nWeight earbuds: approx. 6 g each\ncharging case: approx. 66 g\nboth earbuds and charging case: \napprox. 78 g\nVersion Bluetooth 5.4 certified, class 1","Specifications\nMOMENTUM True Wireless 4  | 49\nBluetooth\nTemperature range operation: 0 to +40 \u00b0C\ncharging: +5 to +35 \u00b0C\nstorage: \u201320 to +60 \u00b0C\nRelative humidity operation: 25 to 75 %, non condensing\nstorage: 10 to 90 %\nMagnetic field strength earbuds: 0.95 mT\ncharging case: 105 mT\nIngress protection of the \nearbuds splash proof (IP54)\nWeight earbuds: approx. 6 g each\ncharging case: approx. 66 g\nboth earbuds and charging case: \napprox. 78 g\nVersion Bluetooth 5.4 certified, class 1","5 V , max. 100 mA\ncharging case: 5 V , max. 1000 mA\noutput:\nearbuds (R and L): none\ncharging case: \n5 V , max. 100 mA x 2 (R and L)\nCharging method via \ncharging case\nUSB charging via USB-C socket: \n5 V , 1000 mA max;\nQi wireless charging\nOperating time 7.5 hrs with rechargeable battery of \nthe earbud (ANC activated)\n7 hrs with rechargeable battery of the \nearbud (ANC deactivated)\n30 hrs with rechargeable battery of \nthe charging case\n(test conditions: iPhone, volume at \n50%)"]}
